news_id,url,publisher,publish_date,author,title,image,body_text,news_guard_score,mbfc_level,political_bias,country,reliability
7,https://www.americanthinker.com/articles/2020/05/killing_off_a_pandemic_is_engineering_not_science.html,American Thinker,2020-05-21,['Chet Richards'],"Killing Off a Pandemic is Engineering, Not 'Science'",https://www.americanthinker.com/images/bucket/2020-05/221035.jpg,"More than half a century ago a fellow grad student invited me into his laboratory to show me his doctoral research. He introduced me to the science of animal reflexes. A novel stimulus induces in an animal, however briefly, a freeze reaction. This is called an “orienting reflex.” What happens next depends on the animal’s response to the potential threat. If the novel stimulus does not seem to be a threat the animal gradually relaxes. Repeats of this type of stimulus gradually habituate its orienting reflex so that the animal, in effect, learns to ignore this particular stimulus.

On the other hand, in the case of a real threat, the animal can only respond in one of two ways: It can freeze for an extended length of time or it can panic and run to escape.

Humans, too, experience the orienting freeze reflex to novel stimuli. If the stimulus is a threat, a person may freeze in place for a substantial time, or the person may flee in panic. Or, and this is what makes humans different from all animals, some people may become coldly rational and plan out, and execute, an appropriate course of action. Training, especially, helps create this rational response.

The important thing to note is that the orienting reflex is so essential to survival that it evolved very early in the history of life. Its creation was back so deep in time that we share the orienting reflex with insects, with spiders, and with even more primitive creatures.

Society emulates an organism. An animal is a collection of functioning elements, all working in cooperation. It is useful to consider a society, such as America, as a kind of organism analogous to an animal. Individual people make up the cooperating functional elements of society. I postulate that our society has an orienting reflex, as well.

Consider the response of America to Japan’s attack on Pearl Harbor: Shock! Freeze! Anger! That was the first orienting response. Then, since we are human, came coldly rational plans, then fully unified action to destroy this threat to our existence. Consider America’s first response to 9-11. Initially it was the same, but soon different factions chose to use the event to promote their ideologies. Instead of unity we had disunity. America has changed — and not for the better.

Think of America’s response to COVID-19. We indeed have had the orienting reflexive freeze. What is this new threat? We wondered. What are its characteristics? What should we know about it? Because of the novelty of this virus we knew too little to make rational plans. Our natural reaction was to continue the orienting freeze reflex until we could find a way to defeat it.

We did know at the beginning a few things about this new disease: We knew that this virus is exceptionally contagious. One thing we thought we knew (but maybe were wrong about) was that this virus is exceptionally deadly. The thing we were certain of was that a really serious pandemic would overload our medical facilities. Rational response required a temporary lockdown to “flatten the curve” so as to not overload our medical establishment. This we did — successfully.

But then politics intervened — big time! There are people in our society who lust for power and luxuriate in it once they have it. Some are elected, many are not. Call them governors, call them mayors, call them health administrators, call them bureaucrats, call them “journalists,” the power mad have become a potentially lethal plague on America. They have suspended our civil liberties “for the duration.”

So what is the duration? These power-mad people have moved the goal posts to the undeterminable far future when a vaccine cure will be available. There has never been a successful vaccine for an upper respiratory corona virus. So don’t count on it this time. If we do get one an instant Nobel prize awaits. Waiting for a vaccine is just an excuse for continued suppression of our liberties. Moving the goal posts is profoundly dishonest and un-American.

In the name of “science” some governors forbade experimentation with various pharmaceutical treatments. When President Trump suggested that early experiments indicated that a combination of hydroxychloroquine, zinc and azithromycin was effective in stopping an early stage infection, the Left: left academics, left “journalists,” left bureaucrats, and left politicians, went berserk: Politics (I spit the word out)!

It is commonplace to say that the pandemic is a science problem. No it is not! Science has to do with fundamental understanding. Figuring out the molecular action of this coronavirus is science. Defeating the pandemic is not science. Defeating the pandemic is engineering!

When I was just starting my career as an engineering physicist I was told a story. The story is likely apocryphal, but it illustrates the profound difference between science and engineering: One day the ancient Romans decided to bring fresh water down from the mountains to the city. Naturally they hired the best hydraulic specialists — the Greeks — the masters of the science of hydrostatics. The Greeks said that the pressure in a tall waterpipe would be very great. They were right, of course. Therefore, buttress the outside of your filled pipes, they advised, to prevent their explosion. The Romans did as suggested. However, when the water started to flow the pipes imploded instead of exploded. No one knew why this happened. The Romans simply shrugged their shoulders and buttressed the inside of these water pipes — with great success. About two thousand years later the Bernoulli brothers found the scientific explanation. So, science is nice, but engineering works.

Who are the engineers in this pandemic? The doctors on the front line, of course. These are the pragmatic guys who are willing to try anything to save the lives of their patients — even if the academic scientists say don’t. Let’s also give credit to the hands-on lab scientists who are working, often with great ingenuity, to find a vaccine. That too is engineering, only at the molecular level.

Now that the pandemic is easing up a bit I was able to chat about this with a highly regarded infectious medicine specialist. This is a man who once saved my life by working in his lab to devise an antibiotic cocktail for me. This, after all conventional treatments had failed. This good doctor has spent almost every waking hour of the last two months saving the lives of COVID patients, some of whom were in intensive care. He has found that the hydroxychloroquine cocktail works with patients in the early to mid-phase of infection, but not much in the intensive care phase. He uses other techniques in the late phase. His experience with the cocktail corresponds to that of other doctors. The hydroxy cocktail is therefore a very effective prophylactic, or curative, depending on the stage of infection. But not later on.

When I mentioned the notion that, in this pandemic, he was an engineer, not a scientist, he most emphatically agreed. Then this mild mannered man surprised me by using very strong language with respect to the “science” advisors to the politicians.

Science has its place. Ultimately we will understand this new contagion and eliminate its threat. In the meantime, it is the medical engineers who are the key to defeating this invader: the medical doctors on the front line; the people working on vaccines and other medications. And, of equally great importance, let us not forget the business owners, small and large, who are the engineers of our economy. All these practical people should be the ones guiding society back to normality — not the power hungry politicians and, most especially, not the technocrat “scientists.”",12.5,Low,Extreme right,USA,0
8,https://www.americanthinker.com/articles/2020/05/clean_energy_via_legislative_diktat_.html,American Thinker,2020-05-20,['Charles H. Battig'],Clean Energy Via Legislative Diktat,https://www.americanthinker.com/images/bucket/2020-05/220912.png,"For those enamored by the clean electric-car, smoke-and-mirrors ""emission elsewhere scheme"" comes the recently enacted ""Virginia Clean Economy Act"", which includes one of the largest energy storage targets in the country at 2.4 GW by 2035, and prompts state regulators to craft a carbon dioxide cap and trade program that meets the objectives of the Regional Greenhouse Gas Initiative (RGGI).

The act, which requires Virginia’s electric utilities and competitive suppliers to generate electricity from 100% renewable energy by 2050, passed on the same day that Dominion Energy, the state’s largest utility, announced its goal of achieving net-zero emissions by 2050.

Carbon dioxide has been deemed a pollutant via legislative diktat. Accordingly, embedded in this legislation is language which prevents the Virginia State Corporation Commission from approving “any investor-owned utility to own, operate, or construct any electric generating unit that emits carbon as a byproduct of combusting fuel to generate electricity” until the state legislature has had a chance to review a report from the Air Pollution Control Board. Also embedded are escape clauses allowing fossil-fuel energy just in case the 100 per cent carbon-free dream mandate fails in the real world. In keeping with current virtuous political correctness and emotional zeitgeist, the bill also requires utilities and the commission to consider the social cost of carbon when reviewing the need for a new generation facility.

However, Dominion Virginia Power now says it may need to import energy from pollution-intensive sources out of state, even though nuclear power is part of the permitted energy mix. The price tag for this legislated decree wrought via politically virtuous green posturing, environmental sloganeering, and pandering to climate activists now comes to light. Get ready for acres of environmentally destructive solar panel installations which will fail to meet energy demand in the midst of winter, while decimating native habitat and leaching toxic chemicals into the soil. Look to the new Warren Buffet solar project in Arizona as the template for yet another taxpayer billion dollar boondoggle promising pollution free energy (when the sun shines), and reliance on giga-battery installations when it does not.

Trust that the air-conditioner comes on during a summer lull in ocean breezes when those European-built, experimental offshore wind turbines produce little electricity. Trust that the Atlantic hurricane season does not cause them to shut down in a self-preservation safety mode just when you need electric power. Trust that servicing those giga-windmills in a most hostile saltwater corrosive environment does not take them off-line too often. Trust that those envisioned giga-battery storage complexes for when the sun doesn’t shine, and the wind doesn’t not blow can actually be built. Trust that the tons of rare earth minerals needed to build such batteries can be sourced, and that such battery installations do not become ticking fire and explosion environmental disaster bombs. In England that risk to a small town has been compared to a small nuclear bomb. Safe disposal of the toxic-laden, worn-out solar panels is largely ignored.

Whatever these outcomes, Dominion can pass on these costs to their captive consumers. The State Corporation Commission has estimated ratepayers could see “at least a $23 per month” increase on their bills by 2027-2030… stress on the “at least.”

Virginia seems to be vying with California for the title of creator of the most destructive and unreliable energy policy at the highest cost to its citizens and industry by embracing radical environmentalism and rejecting objective science. However, the realities of a coronavirus economy have finally put the brakes on California’s green dreams. California Gov. Gavin Newsom has proposed budget cuts include canceling billions of dollars in climate change spending. Meanwhile, Virginia’s green plans appear unchanged.

“Out of sight, out of mind,” pollution is now the law of the land, and “just-like-that” (thank you Forrest Gump) by legislative fiat, we Virginians are all carbon free at the expense of pollution elsewhere. Never mind that there will be no measurable effect on the climate. As is usual, there is no definition of how the climate change will be measured; it usually falls back to changes in atmospheric temperature. Even the details of how, where, and when such temperature measurements will be made is open-ended.

With the recent film “Planet of the Humans,” liberal filmmaker Michael Moore upset the green lobby with such comments as: “most energy consumers don't realize the complex ways that so-called renewable energy has been developed with a co-dependency on non-renewables,” and ""The only reason we had been force fed the story 'climate change plus renewables equals we're saved' is because billionaires, bankers and corporations profit from it."" Warren Buffet said it about wind power in 2014: ""For example, on wind energy, we get a tax credit if we build a lot of wind farms. That's the only reason to build them. They don't make sense without the tax credit."" His aforementioned Arizona solar project would seem to fall into that category, as does Virginia’s new legislation with handouts galore.

Lost in this green crusade is the fact that carbon dioxide is an essential trace gas upon which plants depend for life. Each one of us exhales carbon dioxide at an approximate four percent concentration with each breath, as we are carbon-based life forms. Do not embarrass these legislators by asking how much the climate will be saved by this “Clean Economy Act”, however it might be measured against an atmospheric carbon dioxide concentration of 400ppm.

Get ready for needlessly increased energy costs for local governments and the public in this era of the coronavirus. Natural gas and petroleum are at record low prices, yet Virginia’s new energy plan has promised increased energy costs. For local governments, no problem -- just increase property taxes and property assessments. Those out of work are just out of luck.

By the target date of 2045, the authors of this legislation (including the Virginia governor and legislators who foisted this on the public) will probably (hopefully?) be out of office and forgotten and have no fear of facing recriminations. Not so lucky will be the children and grandchildren of the future facing an uncertain, but expensive, Virginia energy environment.",12.5,Low,Extreme right,USA,0
9,https://www.americanthinker.com/articles/2020/05/media_in_panic_mode_over_latest_presidential_polls.html,American Thinker,2020-05-19,['Brian C. Joondeph'],Media in Panic Mode over Latest Presidential Polls,https://www.americanthinker.com/images/bucket/2020-05/221007.png,"CNN, in their dogged and unending quest to overturn the 2016 presidential election and drive President Trump from office, is in full-on campaign mode. Just as in the last presidential election cycle, opinion polls are a campaign staple of the media and the Democrat party. Polls are not being used as they should, to reflect public opinion, but instead to shape opinion, a form of political propaganda.

CNN commissioned a poll, the results of which were released last week, conducted by SSRS, “an independent research company.” A CNN poll doesn’t mean Brian Stelter and Jim Acosta, also known as dumb and dumber, were on a street corner asking passersby how much they hated the Orange Man.

When CNN reported the poll results, their headline put a ho-hum spin on the poll findings, “Biden tops Trump nationwide, but battlegrounds tilt Trump.” Townhall reported the poll more accurately, “New CNN poll shows Trump crushing Biden in swing states.”

How illustrative that the same poll with the same results was presented so differently, Trump “crushing” in one headline while in another headline results simply “tilt.” In fact, CNN buried the poll results on their homepage as they didn’t like the results. I can’t blame them as it doesn’t fit the CNN narrative.

YouTube screen grab

Polls are designed to reflect the opinions of a group of people at a moment in time. A small sample of individuals are asked for their opinion regarding a particular issue and this small sample is hoped to be representative of the larger population. Otherwise the axiom of garbage in, garbage out applies.

The poll sample is important. Oversampling Democrats will skew the results in favor of the Democrat candidate. In this poll, “34 percent described themselves as Democrats, 26 percent described themselves as Republicans”, an 8-point difference. Imagine the results if those percentages were flipped, oversampling Republicans by 8 points.

The CNN poll also surveyed registered, not likely, voters. Since only slightly more than half of eligible voters actually voted in the 2016 presidential election, this, too, is not a representative sample of the electorate.

The CNN poll, with Democrat oversampling, showed voters nationally backing Biden over Trump by 51 to 46 percent, a five point difference, less than the 8 point difference in party affiliation. Theoretically, if the survey sample were equally balanced between Democrats and Republicans, Trump would come out ahead by 3 points. Which is perhaps why Democrats were oversampled.

Is a nationwide poll even relevant in a presidential election? Not really, because of the Electoral College. Instead there are 50 state elections taking place, not a national popular vote, much to the consternation of the political left.

Rather than a popular vote, the presidential election is decided by a handful of “battleground states” that tend to swing red or blue, depending on the electoral cycle. An opinion poll in New York or California is irrelevant as it’s a foregone conclusion that the Democrat will win those states. The margin doesn’t matter as the electoral votes will be the same.

In battleground states, Trump leads Biden by 52 to 45 percent, a 7-point margin. Add the 8-point difference in party affiliation of those polled and Trump’s lead could potentially be 15 percent. Is it any wonder CNN is not touting this news?

This poll has other interesting tidbits. The “economy, stupid” typically predicts the next president, as USA Today notes. The US economy is on life support these days with the Wuhan coronavirus causing a national economic shutdown. But as the Washington Post begrudgingly admits, “Americans have an increasingly dismal view of the economy, but they don’t blame Trump.” Really? Democrats and the media exclusively blame Trump.

A YouGov poll finds similar results, “One-third of Americans blame the Trump Administration for unemployment numbers.” A more honest headline would be that two thirds of Americans don’t blame Trump for the current economic mess.

In the CNN poll, Trump holds a 12-point lead over Biden when the survey asked, “Who they trusted most to handle the economy.” And that’s up from only a 4-point margin last month.

Sharpness and stamina also favor Trump by 49 to 46 percent. I suspect that margin is much higher, as Trump holds daily briefings, sparing with a hostile media for well over an hour while Biden can’t muddle through a fawning 5-minute interview from his basement with notes and a teleprompter, without losing his train of thought or saying something stupid.

Rasmussen, the most accurate pollster in the 2016 presidential election, offers another perspective. They survey likely voters, rather than simply registered or eligible voters. In their Daily Presidential Tracking Poll, President Trump, on May 15, had a 49 percent total approval rating, compared to 47 percent approval for President Obama exactly eight years ago.

Rasmussen Reports Screenshot

Gallup, no fan of President Trump, echoes Rasmussen.

Despite a wave of critical news coverage and Democratic catcalls, President Trump sits at his “highest” approval in the latest Gallup survey, and above where four of the last six presidents, including Barack Obama and George W. Bush, were at this point of the first term.

Two separate polls both pointing out the inconvenient truth that Trump is more popular than “The One,” Barack Hussein Obama. Wait until Barr and Durham unleash the hounds of hell on the ObamaGate conspirators and watch Obama’s popularity drop like an anchor.

Trump is dealing with an economic calamity the likes not seen since the Great Depression. The Beltway deep state is still trying to overturn the last election and remove him from office. The media is almost universally hostile and nasty toward Trump. Compare that to Obama, cruising to reelection against the hapless Mitt Romney, fanned on by an adoring media with virtually no Republican opposition. Yet Trump has higher approval ratings than Obama.

Remember that polls are a snapshot in time, with the only poll that matters being on Election Day. How wrong were the polls in 2016, predicting a Clinton landslide?

On Election Day, November 8, 2016, Frank Luntz, noted pollster and political pundit tweeted, “In case I wasn't clear enough from my previous tweets: Hillary Clinton will be the next President of the United States.” Some prediction.

Take opinion polls with a grain of salt. Note who was surveyed and how the results are spun. The truth is right in front of you.

Brian C Joondeph, MD, is a Denver based physician and freelance writer whose pieces have appeared in American Thinker, Daily Caller, Rasmussen Reports, and other publications. Follow him on Facebook, LinkedIn, Twitter, and QuodVerum.",12.5,Low,Extreme right,USA,0
