news_id,url,publisher,publish_date,author,title,image,body_text,news_guard_score,mbfc_level,political_bias,country
5,https://theduran.com/freedom-of-worship-under-attack-by-liberals-caught-on-video/,The Duran,2020-05-23,['Seraphim Hanisch'],"Freedom of worship under attack by liberals, caught on [Video]",https://149425939.v2.pressablecdn.com/wp-content/uploads/2020/05/Screen-Shot-2020-05-23-at-3.36.50-PM-e1590237648363.png,"When I was growing up in the US during the 1960’s, 1970’s and 1980’s, one of the prized freedoms we often and repeatedly talked about was the right to pray to God as one understands God, to be free both to go to the church of your church and to be free from going to the national church by requirement. Sure, this led to a pluralistic society, and sure, there are major challenges for each faith group in competition with other such groups and with the predominant secularism in the US, but believers have always had the freedom to pray and worship as they like.

Until now.

The coronavirus pandemic brought in a wide series of restrictions against gathering in public places all over the world. In our own series on the rightness or wrongness of Orthodox Christian places of worship closing due to government regulations, we noted that the restriction on religious worship is not particularly directed at Christians only. Mecca is closed, the Indian, Japanese and some Jewish religious activities have all shown the effects of COVID-19 prevention regimes.

However, in the United States, we now have elected leaders violating the principles set forth in the Constitution, namely, the very first Amendment:

“Congress shall make no law respecting the establishment of religion, or prohibiting the free excercise thereof; or abridging the freedom of speech, or of the press; or the right of the people peaceably to assemble, and to petition the Government for a redress of grievances.”

Instead, we have governors ordering churches closed, people fined and even arrested for going, and in places like Mississippi, the sentiment against Christian churchgoers has turned particularly nasty. A parish was burned to the ground, acccording to The New York Times:

The burning of a church in northern Mississippi this week is being investigated as arson because of a spray-painted message at the scene that seemed to criticize the church’s defiance of coronavirus restrictions. First Pentecostal Church had sued the city of Holly Springs, Miss., which is about an hour southeast of Memphis, arguing that its stay-at-home order had violated the church’s right to free speech and interfered with its members’ ability to worship. After firefighters put out the blaze early Wednesday, the police found a message, “Bet you stay home now you hypokrits,” spray-painted on the ground near the church’s doors, according to Maj. Kelly McMillen of the Marshall County Sheriff’s Department. A photograph of the graffiti also appears to show an atomic symbol with an “A” in the center, which is sometimes used as a logo for atheist groups.

One thing this clearly proves is that bigots cannot spell correctly.

But it also proves there is a great deal of animosity against Christians. This kind of attack would not have taken place even ten years ago, but now the anti-Christian climate in the United States is such that incidents like this are looking for ways to happen.

This video shows how embedded anti-Christian attitudes are now in the press corps at the White House. Watch as Press Secretary Kayleigh McEnany deftly and forcefully handles the ferocious accusations that go beyond First Amendment sensibilities.

On Friday, May 22nd, President Trump called on state governments to allow churches to open, and has also threatened to override any state that refuses to do so. Here is what he said, with emphasis added:

Thank you very much. At my direction, the Centers for Disease Control and Prevention is issuing guidance for communities of faith. I want to thank Dr. Redfield and the CDC for their work on this matter and all the other work they’ve been doing over the past what now seems like a long period of time. Today I’m identifying houses of worship, churches, synagogue and mosques as essential places that provide essential services. Some governors have deemed liquor stores and abortion clinics as essential, but have left out churches and other houses of worship. It’s not right. So I’m correcting this injustice and calling houses of worship essential. I call upon governors to allow our churches and places of worship to open right now. If there’s any question, they’re going to have to call me, but they’re not going to be successful in that call. These are places that hold our society together and keep our people united. The people are demanding to go to church and synagogue, go to their mosque. Many millions of Americans embrace worship as an essential part of life. The ministers, pastors, rabbis, imams and other faith leaders will make sure that their congregations are safe as they gather and pray. I know them well. They love their congregations. They love their people. They don’t want anything bad to happen to them or to anybody else. The governors need to do the right thing and allow these very important, essential places of faith to open right now for this weekend. If they don’t do it, I will override the governors. In America, we need more prayer, not less. Thank you very much. Thank you.

President Trump has this basic point right: without prayer to God, our nation is sunk. And it is, indeed, amazing how vile and anti-Christian our supposed “best and brightest” have turned out to be. Incidentally, the press and “Experts” are saying that the president has no power to make this stick. They are wrong. In the spirit of the First Amendment, he absolutely does have the power to make this order stick.

Liked it? Take a second to support The Duran on Patreon!

Read Later Add to Favourites Add to Collection Report",17.5,Low,Extreme right,Cyprus
6,https://theduran.com/us-militarizes-the-caribbean-sea-to-surround-venezuela/,The Duran,2020-05-23,[],US militarizes the Caribbean Sea to surround Venezuela,https://149425939.v2.pressablecdn.com/wp-content/uploads/2020/05/A-Venezuela-blockade.jpg,"Submitted by InfoBrics, authored by Lucas Leiroz, research fellow in international law at the Federal University of Rio de Janeiro…

Recently, the number of American ships and planes in the Caribbean Sea has increased exponentially. The most likely hypothesis so far is that there will be an attempt to block Venezuela, as the military flow in the region began to grow only after Iran announced the sending of oil ships to the Bolivarian country. On May 14, Venezuelan Foreign Minister Jorge Arreaza said that the boats that take gasoline to Venezuelan ports are being persecuted by the American Navy, which is worsening with the arrival of Iranian ships. The White House has already reported that it has taken retaliation against this cooperation between Venezuelans and Iranians, but no further information has been provided on the military operations being carried out. The United States has announced sanctions against any company that participates in the supply of gasoline to Venezuela, which is causing a structural crisis of fuel scarcity in the South American country.

In addition to the blockade, there is a humanitarian issue, as American measures are inducing a major economic recession in the Bolivarian Republic. It has also been reported by the Venezuelan government that the tax imposed by the United States is affecting the country’s food supply, which is already having an effect on society. With a crisis and the siege being imposed on Caracas, how do Venezuelans use to deal with the advancing pandemic of new coronaviruses? How can the Bolivarian government manage a major economic and social crisis with imminent health danger? It is just the American strategy: to raise a siege and provoke the Venezuelan national collapse, inducing, through coercion, Nicolás Maduro’s government to accept changes in the regime for the benefit of Washington.

The naval blockade is just one of the measures the United States is taking to overthrow Nicolás Maduro’s legitimate government. A few days ago, an attempted invasion against the country, carried out by Colombian mercenaries on American speedboats, was neutralized, with several terrorists arrested. Apparently, the sea will be the path by which Washington will try to overthrow Maduro, insisting on the military operation as solution of international controversies. The case also indicates the presence of the so-called “extermination war”, an ancient warlike practice in which a country is surrounded and kept under block by the navy of another nation, preventing the arrival of goods and food in port areas, affecting the population as a whole, indirectly leading thousands of people to hunger, misery and death. Basically, this is exactly the American goal in Venezuela with the current blockade. Without formally declaring war, Washington adopts an even more insidious strategy than traditional military confrontation.

However, there is yet another important factor – and above Venezuela – behind the American interest in militarizing the Caribbean Sea. Since at least the First World War, the USA has occupied a position of undisputed supremacy on the seas, which allowed Washington, in time, to exercise a role of “global naval police”. However, this reality is changing day after day, since the world is already beginning to contemplate a response from nations to American naval power, especially in Asia.

In the Asian continent, China and Iran are challenging the American Navy. In China, the progress of the Navy is absolute, with the Chinese having already succeeded, for the first time in its history, to overcome the International Date Line and concluding military tests in spaces traditionally occupied by the American maritime forces. In Iran, the maneuvering of small vessels against large American ships is daring. Recently, some sources have informed that Tehran will produce nuclear submarines, with the aim of increasing its naval power.

The United States has spoken out several times condemning its opponents in China and Iran, but nothing has been done other than the mere war of words. In practice, it is difficult to deny that the United States has a naval power today that is much less powerful than it was decades ago. Washington did not attack its rivals in Asia simply because it could not handle a counteroffensive from Beijing or Tehran – at least not without a big material loss as a result.

All of these factors are contributing to a redirection of the American Navy’s strategic policies. No longer able to keep its global power intact, Washington manages its forces for the southern portions of the American continent itself, guaranteeing a regional space of power. However, in the Americas the opposition to US possible aggression will be fierce and will have international support from other continents.

Liked it? Take a second to support The Duran on Patreon!

Read Later Add to Favourites Add to Collection Report",17.5,Low,Extreme right,Cyprus
7,https://theduran.com/israels-intent-to-annex-part-of-west-bank-may-spark-new-wide-scale-middle-east-crisis-amidst-global-pandemic/,The Duran,2020-05-23,[],Israel’s intent to annex part of West Bank may spark new wide-scale Middle East crisis amidst global pandemic,https://149425939.v2.pressablecdn.com/wp-content/uploads/2020/05/Israel-Palestine.jpg,"Submitted by InfoBrics, authored by Paul Antonopoulos, independent geopolitical analyst…

Palestinian leader Mahmoud Abbas announced that the Palestinian state and the Palestinian Liberation Organization (PLO) will no longer adhere to the agreements they signed with Israel and the United States. It is a reaction to Israel’s intentions to annex Jewish settlements in the West Bank. If Abbas’s intentions are consistently implemented, it would be a paradox for Palestine to abolish itself.

“The Palestinian Liberation Organization and the Palestinian state are rejecting any commitments from all agreements with the US administration and Israel, including those related to security,” Palestinian President Mahmoud Abbas said in response to the Israeli government’s intention to start on July 1 the process of annexing territories controlled by illegal Jewish settlers in the West Bank.

Abbas did not mention any specific agreements, but it is believed he is referring to a series of agreements signed by the Palestinians with Israel in the 1990’s – the 1993 Oslo Accords, the 1997 Hebron Protocol, and the 1998 Wye River Memorandum.

However, by cancelling the Oslo Accords, could the Palestinian Authority be abolishing itself?

If Abbas is referring to the entire Oslo Agreement, it would in a way mean the dissolution of the Palestinian Authority, since they emerged from that agreement. Abbas’s reaction was caused not only by the intention of Israeli Prime Minister Benjamin Netanyahu to annex large areas of the West Bank on July 1, but also by the visit of U.S. Secretary of State Mike Pompeo to Israel, who undoubtedly supports the move.

Security coordination with Israel, which Palestine could be giving up, is one of the most important aspects of the Oslo Agreement, which has become a cornerstone of the so-called peace process. Security coordination is essential for the day-to-day functioning of both the Palestinian Authority and Israel. The Palestinian Authority is highly dependent, in daily terms, on this cooperation with the Israeli authorities. And not only on security, but also on economics, as well as on the inflow of financial resources, which come from the Israeli government to Palestinian institutions.

Even in earlier announcements, despite the interruptions, the essential parts of the implementation of coordination were never questioned. Abbas is now more serious than before when he announced and threatened to sever security ties which could be a blow to Israel, even if it means the Palestinian authorities lose the legal basis of its existence in international eyes.

Secretary of the Palestinian Fatah organization, Fayez Abu Aita, said that in these circumstances breaking all agreements, including the Oslo peace agreement, was absolutely necessary – this is the only way to protect their territories.

“It is not our fault that we are now on the edge of a new stage, a new great confrontation with Israel. Only by breaking all obligations with Washington and Tel Aviv, Palestine has the chance to defend its right to exist, the right to own land. After all, we said that we would not allow the implementation of the Deal of the Century. The Israeli government only heard itself and its greed. But this was only the first step: the further the Israeli side goes, the more serious the Palestinian response will be,” he said. “There is nothing else left for us, considering how quickly Israel extends its hands to our land. They were the first to bring the situation to a dangerous dead end.”

If Israel annexes the West Bank, hopes of creating an Arab state within the 1967 borders will be extinguished.

While the U.S. supports Israel’s annexation, Russian Minister of Foreign Affairs Sergei Lavrov on Wednesday in a telephone conversation with Israeli Foreign Minister Gabi Ashkenazim confirmed the readiness of Russia to further promote the resumption of the peace process between Palestinians and Israelis. Russia is trying to prevent the annexation and, through diplomatic means, gather an international quartet with the participation of the UN.

Effectively Russia could be using this as an opportunity to present itself as a peace broker in the Palestine-Israel conflict. Whether this will be successful or not remains to be seen, but is necessary when it appears there is a strong chance that the Palestine-Israel conflict can breakout extremely violent again in the coming weeks amidst the consequences of the coronavirus pandemic.

Liked it? Take a second to support The Duran on Patreon!

Read Later Add to Favourites Add to Collection Report",17.5,Low,Extreme right,Cyprus
8,https://theduran.com/local-elections-suggest-virginia-may-be-turning-red/,The Duran,2020-05-23,['Malcolm Harris'],Local Elections Suggest Virginia May be Turning Red,https://149425939.v2.pressablecdn.com/wp-content/uploads/2020/05/Virginia-Riots-.jpg,"Virginia was once a solid-red state, known for its strict conservative culture ad its overall affiliation with the Bible Belt south. If anything, it seemed like it would be one of the last states to turn to the secular left. That is, until it voted for Obama in 2008.

Many thought it was just a phase. After all, Indiana, also a solid Republican state, voted for Obama as well. After all, Obama was still socially conservative at the time. The trend however, continued. The Democratic Party went on to win the state in the next two presidential elections, along with the governorship and most other executive positions. In 2019, a second blue wave swept the state, removing Republicans from many local positions and giving the Democrats almost complete control over the state.

Many wonder how such a solid Republican, culturally conservative state located in the south could possibly have flipped so suddenly. Many believe it is the migration of unionized government workers along with Latin American immigrants that caused the shift. Regardless, a recent election has shown that the trend may be reversing.

Staunton is a small city located in the more populous northern region of Virginia. It was a part of the wave that resulting in Barack Obama winning the state in 2008. Since then, it has continued to contribute to the state turning blue.

A recent election, however, seemed to show something different. In a series of local elections, Republicans were able to flip numerous city council seats and regain control over the city council. Although Democrats ultimately received more votes than they did in the previous election, Republican turnout soured to unprecedented levels. A Virginia political analyst, Chris Graham of the Augusta Free Press, had described the results as “stunning almost beyond words.”

These results may suggest that although the Democrats haven’t lost voters to the GOP, many working class whites are being energized to vote for the GOP.

The recent policies enacted by Governor Northam are far from popular among that demographic. Anti-gun measure being pushed by the Democratic government resulted in pro-gun protestors filling the streets. Strict coronavirus lockdowns, similar to those implemented in New York and Michigan, are also angering much working class as well.

Of course, one local election in one small city isn’t enough to determine the political leanings of an entire state. It does, however, raise the question of the Democratic Party’s popularity and the mobilization of the white working class, a demographic that is continuing to become more and more significant despite is reduction in the overall share in the population.

Liked it? Take a second to support The Duran on Patreon!

Read Later Add to Favourites Add to Collection Report",17.5,Low,Extreme right,Cyprus
9,https://theduran.com/dr-fauci-taken-to-task-as-covid-19-narrative-swings-wildly-again-video/,The Duran,2020-05-23,['Seraphim Hanisch'],Dr. Fauci taken to task as COVID-19 narrative swings wildly – again [Video],https://149425939.v2.pressablecdn.com/wp-content/uploads/2020/05/The-world-is-temporarily-closed-e1590209513267.jpg,"Anybody who has been following the story about the coronavirus pandemic is hopefully aware of the constantly changing double, triple, quadruple and n-speak that the “experts” give us concerning the need for social distancing, wearing masks, not touching each other, and in America, especially about not being together in “non essential” places like… church. All of this has been more or less led and spurred on by one Dr. Anthony Fauci. We reported three weeks ago on some rather amazing accounts suggesting that this doctor was somehow connected to the research programs in a “chimeric virus” containing strains of SARS, HIV and other goodies to produce a supervirus – one that is incurable. That research program was ongoing in the United States before the government got wind of it and shut it down, rightly so, since it was a program designed to bring about nothing but death. However, the allegation goes, Fauci managed to channel money illegally to Wuhan, China, to a lab there to further the research, and it is that virus, the causal agent of COVID-19, that we all have come to know and roundly hate.

So goes the allegation. It seems like wackadoo conspiracy theory still to me, but there is some interesting detail behind it, so it is possible that there are at least several true elements. However, Dr Fauci works for President Trump on the Coronavirus Task Force, and of late, the President has been ignoring the good doctor’s “for your own good” advice more and more. On Friday, May 22, the doctor did a reversal from his long-held course that we must be isolated until the end of time (and our media controlled) and suggested that isolation for too long may do “irreperable harm… including to our own health.”

Yeah. We knew that already. Ask anyone who has been riding this thing out in their home for the last two months. Do you feel better now? Now, granted, we have done a lot to adapt to the present pandemic, but the rhetorical churn and froth over how this is being handled, and how and what the virus itself does is such that for the last week or two, it has been extremely difficult to know what to report on here. The only constant about COVID-19 seems to be the never-ending stream of unqualified nonsense (we have stronger words for that, you know) that have everyone who tries to stay informed jumping and paranoid… or, has them finally coming to the conclusion that seems to be true:

Nobody really knows.

It would be okay if someone, anyone, in leadership said this honestly and continuously, as a preface for trying to establish some sort of common ground. We know less about COVID-19 than the experts act like, and the increasingly political nature of the handling of the pandemic is far more dramatic than the pandemic itself has turned out to be.

The video included with this article shows the response of one entertainer, Dave Portnoy, who has been skeptical of Dr Fauci’s position for a long time. After Dr. Fauci suddenly whipsawed to a different point of view (in truly Orwellian splendor, without acknowledging he was wrong), Dave does not let him get away with it.

If nothing else, the video ought to help all of us blow off some long-built-up steam.

Liked it? Take a second to support The Duran on Patreon!

Read Later Add to Favourites Add to Collection Report",17.5,Low,Extreme right,Cyprus
