news_id,url,publisher,publish_date,author,title,image,body_text,news_guard_score,mbfc_level,political_bias,country,reliability
0,https://www.americanthinker.com/blog/2020/05/turning_nursing_homes_into_extermination_sites_the_gretchen_factor.html,American Thinker,2020-05-23,['J.R. Dunn'],Turning nursing homes into extermination sites: the Gretchen factor,https://www.americanthinker.com/images/bucket/2020-05/221092.png,"We’re finally getting a clear picture of exactly how the beating of a 75-year-old nursing home patient by a man nearly one-quarter his age came about. And boy, it is a shocker.

It turns out that victim and perp were sent to the Westwood Nursing Center in Detroit due to the fact that both were suffering from COVID. The older man, an Army vet, was snatched from his apartment and dumped in the nursing home without any notification of his relatives, who then spent a considerable amount of time looking for him, to no avail.

As for the younger man, who is evidently named Jaydon Hayden, though the police haven’t yet confirmed it, he was suffering from some sort of breakdown and had been sent to a group home to await treatment when he was diagnosed with the coronavirus and also dumped in the Westview facility. His father, who seems to be a decent sort, says he never should have been put there.

Hayden is now in police custody, while his aged victim is in the hospital.

What it comes down to is that the victim was placed in the nursing home to die while the authorities aimed Hayden at him like a torpedo.

It has not escaped my notice (as it has everybody in the legacy media) that Detroit lies within the realm of her Imperial Majesty, Gretchen the Terrible. Nor has it come as a surprise that Gretchen has adapted the Democratic governor’s go-to policy of using nursing homes as ice floes to dump the sick atop of. But I must admit that I was taken back to learn that Michigan has added “disappearing” patients to the formula. Leave it to Gretchen Whitmer to combine Andrew Cuomo’s already inhumane dump-the-sick policy with the tactics of the KGB.

Clearly, we have yet to plumb the depths of the Cuomo policy. It has always been evident that it was a barely veiled effort to warehouse the sick until they popped off. But this – placing the violent mentally disturbed in the same facilities as the deathly ill with no safeguards or security whatsoever – reveals a callousness that beggars belief. The administrations and bureaucracies of the states following the dump ‘em and run policy – New York, California, New Jersey, and Pennsylvania being the chief culprits – have reached a plateau of psychopathy seldom witnessed in this country’s politics. As for stupidity, we’ll let that speak for itself. (Interestingly, Michigan was not even supposed to be on this list. We can hazard to guess that, like PA’s Tom Wolf, Gretchen slipped the policy into effect by stealth, under the impression that the media would let her slide.)

Nor have we seen the end of it. Yesterday Gretchen announced that, obeying the Will of the People, she will continue her iron-fisted policies until at least June 19th. Plenty of those sickies in hiding who need to be rousted out, you know. Not to mention those defiant barbers and ministers. Got to keep an eye on the big picture, playmates. Gretchen will qualify for that VP slot yet, you’ll see. The carpenter’s at work, and the chips will fly…",12.5,Low,Extreme right,USA,0
1,https://www.americanthinker.com/blog/2020/05/weary_michiganders_got_an_unwelcome_surprise_from_governor_gretchen_whitmer.html,American Thinker,2020-05-23,['Andrea Widburg'],Weary Michiganders got an unwelcome surprise from Governor Gretchen Whitmer,https://www.americanthinker.com/images/bucket/2020-05/221090.jpg,"When the Bourbon dynasty, which had been brutally dethroned during the French Revolution, returned to the throne upon Napoleon’s downfall in 1814, the two Bourbon kings tried unsuccessfully to turn back the clock. The French diplomat Talleyrand said of them, “They had learned nothing and forgotten nothing.”

Using that metric, Michigan governor Gretchen Whitmer is giving the Bourbon monarchs a run for their money. On Friday, she announced that her beleaguered state would remain locked down through the last minute of June 12.

During this time of coronavirus, Whitmer has distinguished herself as the governor with both the harshest and most random lockdown orders. Whitmer’s “Stay Home, Stay Safe Executive Order” went into effect on March 23. At the time, several states were going into lockdown mode, ostensibly to “flatten the curve” – that is, to slow the disease’s spread so that medical facilities would not be overwhelmed. Whitmer, like several other governors, quarantined everyone, locking them in their homes except for allowing them to go to major chain stores or to work for (and still get paid by) the government.

Whitmer’s orders included carveouts for activities that raised taxes or advanced social policies (allowing alcohol, pot, and lottery tickets purchases, as well as abortions). At the same time, she almost randomly issued orders affecting harmless or constitutionally protected behavior, such as banning travel to vacation homes, forcing stores to close whole sections, banning store advertising and hydroxychloroquine, and forbidding jet skiing and outdoor gardening.

While Whitmer has backed off of some of her more extreme bans (e.g., store advertising, hydroxychloroquine), that hasn’t stopped her from being controversial. Her administration waged a brutal war against a 77-year-old barber who had to choose between ignoring her ban against personal grooming services or starving.

On Thursday, a judge finally set the matter to rest by ruling in favor of Karl Manke’s barbershop, but not before hundreds of people, both barbers and customers, gathered outside the Michigan Capitol to give and receive protest haircuts. Michigan is not the only state preventing people from grooming, but the optics of waging war against a 77-year-old barber in Owosso, a town of only 15,194 people outside of Lansing, were ugly.

Meanwhile, unlike Whitmer, we’ve all learned a few things: The Wuhan virus is not easily transmissible from casual surface contact, the mortality rate is significantly lower than initially thought, Vitamin D helps, medical facilities have not been overrun, states that opened early have had fewer deaths, and 29.7% of Wuhan virus deaths occurred in the Michigan nursing homes that Whitmer had forced to accept sick patients.

Aside from having a naturally tyrannical streak, Whitmer is also aiming for bigger things than the Michigan statehouse. The Democrats’ probable candidate, Joe Biden, has confirmed that she’s one of the people on his shortlist for a running mate. Whitmer is therefore working to distinguish herself by opposing Trump as hard as possible (see the hydroxychloroquine ban, above).

For the past couple of days, Whitmer and her attorney general, Dana Nessel, another strident leftist, have been garnering headlines by complaining that President Trump failed to wear a mask when he visited a Ford plant in Ypsilanti. Indeed, Nessel went so far as to say that the president is no longer welcome in Michigan and threatened to sue the Ford plan for violating the state’s mask rules. The fact that Trump (a) is regularly tested for the virus and (b) wore the mask when not giving a speech didn’t matter to leftists anxious to show how tough they are.

Given her personality and political posturing, should anyone be surprised that Whitmer has announced that her state’s stay-at-home order, originally scheduled to end next Thursday, will continue until 11:59 p.m. on June 12, with Michiganders still forced to remain flabby and ungroomed?

Earlier this week, the governor did allow social gatherings of 10 people or fewer to resume and retail stores to arrange appointment-only shopping for customers. But things like gyms, hair salons and barbershops remain closed.

Michiganders are already getting restless under their governor’s arbitrary and capricious rule. It’s entirely possible, therefore, that at some point they will break and engage in mass civil disobedience.

The Michigan unemployment rate hit 22% three weeks ago and is still rising. Sooner rather than later, Michigan citizens need to remind their political class that they are public servants, not monarchs. While Whitmer, in true Bourbon fashion, has learned nothing and forgotten nothing, it’s to be hoped that the people of her state will do better than that.

Postscript: This post just touches upon the lockdown. We also know now that Whitmer’s Green policies affected the dams that broke, flooding several communities in an already hard-hit state.",12.5,Low,Extreme right,USA,0
2,https://www.americanthinker.com/blog/2020/05/covid19_becomes_a_political_disease.html,American Thinker,2020-05-23,['Bill Livingstone'],COVID-19 becomes a political disease,https://www.americanthinker.com/images/bucket/2020-05/221094.jpg,"Just as the coronavirus begins to wane, another dangerous pathogen is infecting America – COVID-19 politics.

In the early days of the pandemic, state governors walked in lockstep, ordering lockdowns to mitigate coronavirus infections and safeguard hospitals from being overwhelmed with patients.

Now that the number of new cases is flattening, politics are taking over, with states veering in different directions. Science no longer appears to be in the driver’s seat.

Blue states are extending stay-at-home orders, while red states are opening for business.

Two playbooks are in motion.

Red states are scrambling to revive the economy as quickly as possible, to get people back to work so they can feed their families. They fear the country, already facing a recession, may spiral into a depression if too little is done, too late.

Blue states say they are continuing quarantines to save lives, putting the nation’s economic recovery on the back burner. New Jersey Governor Phil Murphy said there’s “no cost that is too high to save any one precious life.” Los Angeles Mayor Eric Garcetti is locking down the nation’s second largest city for another three months and said it won’t fully reopen until a vaccine becomes available.

The endgame for the red and blue states is the November election.

If the economy has stopped bleeding and unemployment numbers are improving, giving hope for a return to normal, the public will likely reward President Trump with a second term.

But if storm clouds remain on the horizon, with the economy sputtering or worse, offering little hope the crisis will soon end, the public may hold the president responsible and vote for new leadership to steer America to safety.

It’s not hard to believe that some Democrats are rooting for the worst. It was just eight months ago that comedian Bill Maher said he hoped America would suffer a recession. “I really do,” he enthused. “We have survived many recessions. We can’t survive another Donald Trump term.”

Democrats had few cards to play regarding the economy prior to the pandemic. Unemployment was at a historic low for African Americans, women, and Hispanics. The numbers have since flipped. Unemployment now is at a historic high, dealing the Democrats back into the game. This November, it will be “It’s the economy, stupid” all over again.

Given the political advantages that accrue to the Democrats from a poorly performing economy, the question arises, “Are blue states extending lockdowns to purposely delay an economic recovery, as a means to unseat President Trump?

This may seem cruelly cynical, but far leftists once bankrupted New York City to try to enact their socialist agenda. The political strategy was crafted by socialist academics Richard Cloward and Frances Fox Piven. New York City, at the time, was providing very generous welfare benefits, but not everyone who was eligible to receive them was enrolled. Cloward and Piven published an article explaining how this situation could be exploited to create a political crisis that “could lead to legislation for a guaranteed annual income and thus an end to poverty.”

Far left activists embraced the strategy. Over the next several years, they boosted the number of single-parent households on welfare from 4.3 million to over 10.8 million. New York City could not afford the additional cost and was forced into bankruptcy in 1975.

This sad incident offers an important teaching moment. Far leftists are willing to do just about anything – including willfully destroying the economic wellbeing of the largest city in America – to advance their socialist policies. Given this history, it’s not a stretch to think the blue states might implement a Cloward-Piven strategy to impair America to advance their political standing in the November election.

Of course, the blue states will never acknowledge such a diabolical scheme exists and will argue their decision to continue the quarantines is necessary to save lives.

The political lines are already forming. As the economy worsens, and it will, expect red states to place blame on blue states for waiting too long to reopen businesses, killing off jobs that otherwise would have been saved. Blue states will fight back, condemning red states and President Trump for opening businesses too early, causing the death of thousands of Americans.

In the midst of the political furor that’s building, don’t be surprised if a wild card changes everything. Some examples:

· The Trump Administration is moving at “warp speed” to bring viable treatments and vaccines to market to counter the coronavirus. Successfully doing so will allow America to return to normal and derail the Democrat playbook. · Some epidemiologists are predicting a second COVID-19 wave this fall. If states are forced again to shutdown businesses, it will deepen the economic crisis and play into the hands of the blue states. · Obamagate. In the 1974 election, in the wake of the Watergate scandal, Republicans lost 49 seats in the House and four seats in the Senate. It could happen again, with the tables turned. Expect Democrats to utilize the “coronavirus defense” and claim the issue is a smokescreen to divert the public’s attention from the Trump Administration’s “mismanagement” of the coronavirus outbreak.

America, already overwhelmed by the Wuhan coronavirus and its destructive path, is sure to see its political temperature rise in the coming months due to the election, compounding the public’s maladies. Unfortunately, there’s no vaccine to protect them from COVID-19 politics and sheltering-in-place will not forestall its transmission.

Image credit: Minh Nguyen via Wikimedia Commons",12.5,Low,Extreme right,USA,0
3,https://www.americanthinker.com/articles/2020/05/class_warfare_will_worsen_the_pandemic.html,American Thinker,2020-05-23,['Rainer Zitelmann'],Class Warfare Will Worsen the Pandemic,https://www.americanthinker.com/images/bucket/2020-05/221089.png,"Medieval depictions of the bubonic plague often illustrated a “dance of death,” portraying peasants, noblemen, and clergy all equally afflicted by the plague. The current pandemic affects people of all classes too. It made front page news when actor Tom Hanks (net worth approximately $400 million) announced he and his wife had contracted COVID-19.

Public opinion about Hanks, a beloved entertainer, is almost universally sympathetic, but attitudes toward the rich as a whole haven’t changed during the pandemic. Wealthy people remain easy targets for social prejudice and mistrust.

The headlines say it all. In GQ last month: “How Are Rich People Getting Richer During the Coronavirus Pandemic?” The month before that in the Atlantic: “It Pays to Be Rich During a Pandemic.” A recent Axios report detailed a smorgasbord of similar stories, all about wealthier individuals fleeing to private islands or using private health care to protect themselves from COVID-19. Axios quoted a progressive scholar who lambasted “an undercurrent of unequal sacrifice.”

Although news is supposed to be unbiased, classism is hard to shake. Supposedly neutral articles about bonuses and salaries often featured sweeping generalizations, along with negative and highly emotive terms such as “greed,” “gambling,” “excess,” “filling their pockets,” and “obscene.”

On the other hand, although Oxfam’s reports on wealth inequality in recent years have been criticized rightly for questionable methodology, widespread coverage of the reports often took their findings at face value. That’s likely because Oxfam’s central claims and the organization’s general thrust against “the super-rich” are closely aligned with much of the media’s editorial viewpoints. Thomas Piketty’s book Capital in the Twenty-First Century received similarly favorable coverage.

It’s not surprising that this media bias reinforces the public’s negative view toward the wealthy. But although researchers have extensively studied other stereotypes and prejudices, very little work has been done to understand prejudice based on social class, and even less has been done on “upward classism.” An international comparative survey measured what people in the United States, Germany, U.K, and France think of the rich. The survey asked questions that identified whether participants had a sense of “social envy.” It turned out that social envy is highest in France, followed by Germany. It is significantly lower in the United States and U.K, but there’s a caveat: younger Americans were more likely than older Americans to resent and distrust the wealthy, showing that America may soon be like continental Europe in this regard.

Social envy enables scapegoating or assigning blame to an out-group for societal problems. The comparative survey showed that nearly two-thirds of social enviers tend to scapegoat other groups. Scapegoating depends on a kind of a zero-sum thinking, and many respondents across the nations surveyed agreed that “The more the rich have, the less there is for the poor” -- an assumption belied by the way that classes across a society commonly rise and fall together.

Like any other stereotype, these negative views toward the rich discount or ignore the many individuals who are virtuous or working to solve global problems. Unconscious bias toward the rich lumps white-collar criminals and unscrupulous businessmen together with Bill Gates, who created a world-changing computing system and went on to devote much of his fortune toward philanthropy, including hundreds of millions of dollars on coronavirus research. These biases probably make it easier for people to accept strange conspiracy theories about Gates, such as the idea that he wants to use the pandemic to start a world government or use vaccines against it to depopulate the world.

Class bias is western society’s unaddressed blind spot. Someone biased on a class basis is only a hop, skip, and jump away from adopting bias toward other groups -- especially during a crisis like the current pandemic. If one blames the rich for society’s problems, it’s no surprise that they’re just as capable of blaming an entire race. Some think classism and racism come from opposite sides of the political spectrum, but that’s not always true. Many episodes of genocide, like those in Rwanda and Cambodia, have had elements of both.

These biases harm society as a whole. If people do not understand the real causes of crises and negative events, choosing instead to believe simple explanations and assign blame to an easy target, this gets in the way of finding real solutions to problems like the current pandemic. Just as we now know that the bubonic plague was spread by rats and fleas, rather than by witches or Jews, we should be able to reject scapegoating in our own time.

Rainer Zitelmann is the author of The Rich in Public Opinion: What We Think When We Think about Wealth, published by the Cato Institute.",12.5,Low,Extreme right,USA,0
