news_id,url,publisher,publish_date,author,title,image,body_text,news_guard_score,mbfc_level,political_bias,country,reliability
15,http://www.presstv.com/Detail/2020/05/20/625728/positive-coronavirus-test-football-Premier-League-,Press TV,2020-05-20,[],EPL: six positive coronavirus tests across three clubs,https://cdn.presstv.com/Photo/2020/5/20/2df5d8f1-a4dc-4143-8aaf-f93cab4d371a.jpg,"Over football news, the Premier League has said that 6 people from 3 different clubs had tested positive for COVID-19.

The league said in a statement on Tuesday, that the infected players or staff who were not named, will now self-isolate for 7 days.

The tests were taken on Sunday and Monday, ahead of the return to small group training. On Monday, the Premier League voted to allow clubs to begin small group, non-contact training.

A maximum of 5 players will be allowed per pitch, with tackling forbidden for now. As you know, the Premier League has been suspended since March 13th because of the Covid-19 pandemic.

The league had previously set June the 12th as a tentative date for a restart of action, but there is now an expectation this will need to be pushed back.",17.5,Low,Right,Iran,0
16,http://www.presstv.com/Detail/2020/05/23/625969/Rouhani-Tamim-al-Thani-Iran-Qatar-Venezuela-tankers-US,Press TV,2020-05-23,[],Iran will respond in kind if US makes trouble for Venezuela-bound oil tankers in Caribbean: President Rouhani,https://cdn.presstv.com/photo/20200523/0a15b909-f18d-4506-90c4-b83a4b2dde1c.jpg,"Iran's President Hassan Rouhani warns of retaliatory measures against the United States should Washington make ""trouble"" for Iranian tankers carrying fuel to gasoline-starved Venezuela.

""If our tankers in the Caribbean or anywhere in the world face trouble [caused] by the Americans, they (the US) will also be in trouble in kind,"" Rouhani said in a phone conversation with Qatar's Emir Sheikh Tamim bin Hamad al-Thani on Saturday.

He added that Iran attaches special significance to regional security and emphasized that some US measures in different parts of the world have led to ""unacceptable conditions"" but ""we will never initiate any tension or conflict at all.""

Iran reserves the legitimate right to defend its national sovereignty and territorial integrity and secure its own interests, Rouhani said, adding, ""We hope the Americans do not make a mistake.""

The Iranian president stressed the importance of strengthening joint cooperation amid the current coronavirus pandemic and said, ""However, the United States of America continues to make wrong decisions and keeps it inhumane approaches.""

He once again emphasized that regional security should be maintained by countries in the region, adding, ""We have always expressed our readiness for more cooperation with neighboring countries.""

According to Refinitiv Eikon tracking data, a flotilla of five tankers carrying Iranian fuel for Venezuela is approaching the Caribbean, with the first expected to reach the South American country’s waters on Sunday.

The shipments have infuriated the United States as both Iran and Venezuela are under US sanctions. Washington has threatened to take measures in response especially against Iran, according to a senior US official, who did not provide further details.

In a letter to United Nations Secretary General Antonio Guterres last week, Iran's Foreign Minister Mohammad Javad Zarif issued a stern warning against the provocative acts by the US which has dispatched its naval forces to the Caribbean Sea with the goal of disrupting the course of the Iranian tankers heading to Venezuela.

Zarif described ""the illegal, dangerous and provocative US threats [against the Iranian tankers]"" as a form of piracy and a big threat to international peace and security.

Venezuela's Defense Minister Vladimir Padrino Lopez said Wednesday that Caracas will send planes and ships to escort Iranian tankers arriving with fuel to the country in case of any US aggression.

He added that Venezuela's navy and air force will welcome the Iranian tankers bound for the Latin American country, seeing them through the nation's maritime territory and into port.

Read more:

Elsewhere in the Saturday phone call, Rouhani called for promotion of Tehran-Doha relations in various fields, particularly in economic and commercial sectors, and said both countries should revive economic cooperation in line with health protocols amid the deadly coronavirus outbreak.

Qatar to make utmost efforts to prevent new tension

The Qatari emir, for his part, said his country opposes any tension in the region and would do its utmost to reduce tensions.

Qatar strongly believes that regional security must be ensured through cooperation among all countries in the region, he added.

Al Thani emphasized that Iran and Qatar should make efforts to further boost economic cooperation.",17.5,Low,Right,Iran,0
17,http://www.presstv.com/Detail/2020/05/24/626041/Palestine-Gaza-strip-Eid-Fitr-coronavirus-restrictions,Press TV,2020-05-24,[],Palestinians hold Eid al-Fitr prayers amid coronavirus restrictions,https://cdn.presstv.com/Photo/2020/5/24/a616224e-941b-46ab-aa27-14ca28ebeb40.jpg,"Ruba Shabit

Press TV, Gaza



Palestinians in the Gaza Strip have celebrated the first day of Eid al-Fitr holidays which mark the end of the holy month of Ramadan.

People attended the morning prayers of Eid Al Fitr at mosques that have reopened recently. Worshippers attended the prayers while taking the necessary precautionary measures.

Palestinians are celebrating Eid Al Fitr holiday differently this year due to worldwide coronavirus. However, people here say this won't prevent them from congratulating their families and celebrating Al Eid while following the instructions.

People in Gaza usually take the opportunity of Eid al-Fitr to wear new clothes, visit relatives, distribute sweets and traditional cookies. In this year however, they limited themselves to congratulating each other on the happy occasion.

Gaza, with a population of nearly two million has not been affected badly by the new coronavirus. Only one death from COVID-19 has been reported so far. People in Gaza say closure of mosques were unprecedented by they appreciate authorities for doing so to protect the lives of people.

Since the outbreak of COVID-19, Gaza has been on the edge. This is because the medical sector in the besieged enclave was already on the verge of collapse before the virus hit the territory.",17.5,Low,Right,Iran,0
18,http://www.presstv.com/Detail/2020/05/24/626001/Palestinians-Gaza-Eid-al-Fitr-Dire-Conditions,Press TV,2020-05-24,[],Palestinians in Gaza prepare for Eid al-Fitr amid dire conditions,https://cdn.presstv.com/Photo/2020/5/24/e5883d52-2207-4821-a183-7e463e010643.jpg,"Ashraf Shannon

PRESS TV, Gaza

As the holy month of Ramadan draws to an end, Palestinians in the blockaded Gaza Strip are preparing themselves to receive the Eid al-Fitr holiday under inhumane conditions.

People traditionally head to markets to buy new clothes, gifts and sweets for their families, but many here cannot afford to do that due to harsh economic conditions.

Most people have to shop for many hours trying to find affordable gifts for their loved ones.

This year the coronavirus pandemic has only made things worse.

Usually during festive occasions like Eid al-Fitr, sales are high in markets around the world, but in Gaza merchants complain about poor sales. For them it is one of the worst seasons they had in many years.

Almost all happy occasions in this impoverished territory have been marred by the blockade and other Israeli atrocities in recent years.

As they prepare for Eid-al-Fitr under the Israeli blockade, Gazans say the enclave will fall short of a full celebration. This is because the joyous occasion comes amid a high rate of poverty and unemployment.",17.5,Low,Right,Iran,0
19,http://www.presstv.com/Detail/2020/05/24/626022/Iranians-Eid-al-Fitr-Social-Distancing,Press TV,2020-05-24,[],Iranians mark Eid al-Fitr amid social distancing,https://cdn.presstv.com/Photo/2020/5/24/4437fabc-c5c2-44d9-8b9e-5b2cd8410676.jpg,"Yusef Jalali

Press TV, Tehran



With this prayer, Muslims bid farewell to the fasting month of Ramadan and welcome one of the major festivities in Islam, Eid al-Fitr, or the festival of breaking the fast.

This year, however, the rows of the congregational prayers are arranged differently, with worshipers observing the safety distance amid the coronavirus pandemic.

Eid al-Fitr is associated with family visits, public celebrations and spending more time with the elderly.

Such traditions are mostly avoided this year, but there are other ways to catch up with relatives.

Eid al-Fitr is a culmination of one month of abstinence from eating and drinking, that's why Muslims consider it a reward for their month-long self-discipline and control over their diet.

Eid al-Fitr falls on the first day of the lunar month of Shawwal. The announcement of the festivity depends on the sighting of the new moon. Saudi Arabia, Egypt and some other countries observed the Eid a day earlier.

This year, Muslims marked the most different Eid al-Fitr with the novel coronavirus outbreak preventing family visits and public celebrations. However, these people say the darkest hour is just before the dawn, and distances today will bring about happier reunion tomorrow.",17.5,Low,Right,Iran,0
20,http://www.presstv.com/Detail/2020/05/24/626011/US-Venezuela-Caribbean-militarize,Press TV,2020-05-24,[],US militarizes Caribbean to tighten blockade of Venezuela,https://cdn.presstv.com/Photo/2020/5/24/c330ebc6-90b3-4d2a-a172-6717c576afe3.jpg,"Jesus Silva

Press TV, Caracas

The United States has recently placed a significant number of warships along the Caribbean Sea. This happens at a time when US President Donald Trump has threatened to block Venezuela from receiving any kind of aid from overseas, suggesting fuel-loaded ships sent from Iran to the Latin American country.

Caracas has said that the National Armed Forces will provide military protection to the Iranian vessels to make sure they reach Venezuela accordingly. Socialist lawmakers say the government should defend the country’s sovereignty by any means necessary.

But on the opposition side, lawmakers have warned against any confrontation with the US military.

Meanwhile, experts say international law gives the right to Venezuela to receive aid from Iran or other countries.

Venezuela is fighting for its self-determination while facing tough US economic sanctions and the toll of the coronavirus outbreak.

Although the US is trying to prevent Venezuela from receiving any cooperation from overseas, Caracas assures that the purported US navy blockade will be overcome and the foreign help will be received.",17.5,Low,Right,Iran,0
21,http://www.presstv.com/Detail/2020/05/24/626008/SPain-Barcelona-lockdown,Press TV,2020-05-24,[],Barcelona anti-lockdown protesters call for end to state of emergency,https://cdn.presstv.com/Photo/2020/5/24/45676b99-1a76-4bc3-84b5-7dfaaae15171.jpg,"Kusai Kedri

Press TV, Barcelona

Barcelona may still be under a strict lockdown amidst the coronavirus pandemic, but a young drummer is out on a protest with the family nonetheless, and they want an end to the lockdown.

The protest, dubbed “Deconfining Rights and Freedoms,” was organized by a pro-independence group called the October 3 Platform. Koki Grassiot, one of the founders, says they have been organizing such rallies online during the lockdown. Their previous petitions to protest were turned down by the Spanish Ministry of the Interior for health reasons, until today.

The protesters say the current health crisis and its economic fallout are the result of years of overreach by the central governments in Madrid.

Similar protests have kicked off across Spain in recent weeks, allegedly pushed by the conservatives and far right to bring down the left-leaning coalition executive.

Barcelona will move to phase one of the Spanish deconfinement plan and that includes partially reopening more businesses, retail stores and restaurants. Residents are required to wear face coverings in public spaces, beaches remain open only for limited hours while sunbathing is prohibited.

Whatever may have triggered the anti-lockdown protests, they seem to reflect the same concerns: the distress many feel as they try to cope with the coronavirus and the fear of what may lie ahead.",17.5,Low,Right,Iran,0
22,http://www.presstv.com/Detail/2020/05/22/625935/Palestinians-mark-Intl.-Quds-Day-in-Gaza-Strip,Press TV,2020-05-22,[],Palestinians mark Intl. Quds Day in Gaza Strip,https://cdn.presstv.com/Photo/2020/5/23/13b10960-b025-4046-8a4d-4fbb52bb179d.jpg,"Ruba Shabit

Press TV, Gaza

Palestinians in the Gaza strip marked International Quds Day on the last Friday of the holy month of Ramadan.

Among the events held on the occasion was a press conference by resistance groups in the so-called buffer zone. The event was held following Friday prayers. Organizers said the conference was aimed at highlighting the importance of supporting the Palestinians against the US plots.

Like elsewhere in the world, Quds Day rallies were called off in Gaza due to the coronavirus pandemic. But people say nothing will stop them from countering the Israeli occupation.

Palestinians marked al-Quds Day this year at a crucial point in time after the US declared support for the so called deal of the century and recognized Jerusalem al-Quds as the capital of Israel. They said they will never accept Israel’s illegal annexation of Palestinians’ lands in the West Bank.

Palestinian groups also called for urgent actions from the international community to stop Israel’s land grab policies. On International Quds Day, Palestinians in the occupied territories once again highlighted the importance of resistance as the only way to achieve victory against the Israeli regime and set Jerusalem al-Quds free.",17.5,Low,Right,Iran,0
23,http://www.presstv.com/Detail/2020/05/22/625931/International-Quds-Day-Rallies-Online-COVID-19-Pandemic,Press TV,2020-05-22,[],Intl. Quds Day rallies held online amid COVID-19 pandemic,https://cdn.presstv.com/Photo/2020/5/22/574f7d5e-518e-4abb-ae30-a924d94880f7.jpg,"Saman Kojouri

Press TV, Tehran

For the first time in their history, International Quds Day events have gone online as a result of the deadly COVID-19 pandemic.

But according to organizers of Quds Day rallies, the forced cancellation of the annual events in Iran does not mean that Iranians have forgotten Palestinians at this important period of time.

To mark the occasion this year, applications have been made to stream messages from a wide array of community leaders, activists and public figures. In this campaign, all truth-seekers in Iran have been asked to choose an anti-Israel slogan, and then join an online rally on social media to show their support for Palestine.

International Quds Day is an annual event during which demonstrators express their solidarity with the Palestinian people and their opposition to the occupation of Palestinian territories by the Zionist regime of Israel.

The day is seen as the legacy of the late founder of the Islamic Republic of Iran Imam Khomeini who officially declared the last Friday of the holy month of Ramadan as International Quds Day back in 1979.

Although this year’s Quds Day rallies have been called off as a result of the coronavirus pandemic, the support for Palestinian cause remains high. This shows that despite all difficulties Palestine will remain the first issue of the Islamic world forever.",17.5,Low,Right,Iran,0
24,http://www.presstv.com/Detail/2020/05/19/625647/Brazil-president-responsible-for-deaths-of-citizens,Press TV,2020-05-19,[],‘Brazil president responsible for deaths of citizens’,https://cdn.presstv.com/photo/20200519/40689c32-ab7b-4677-b962-e3f0c91a6d6a.jpg,"Latin America Expert, Gloria Estela La Riva says Brazilian President Jair Bolsonaro is responsible for the deaths of citizens because of his lackluster response to the coronavirus pandemic.",17.5,Low,Right,Iran,0
25,http://www.presstv.com/Detail/2020/05/24/626042/NASA-SpaceX-Russia-coronavirus-,Press TV,2020-05-24,[],Press TV The Lite Bulletin,https://cdn.presstv.com/Photo/2020/5/24/45cd88fa-729c-461c-973d-2e886c4dfdcd.jpg,"Press TV’s website can also be accessed at the following alternate addresses:

MORE FROM News Bulletin

MORE FROM News Bulletin

Sign up for our Newsletter

Sign up for our newsletter to receive a daily email of our best content",17.5,Low,Right,Iran,0
26,http://www.presstv.com/Detail/2020/05/23/625977/protest-Spain-Madrid-coronavirus-lockdown-,Press TV,2020-05-23,[],Far-right protests erupt in Spain against coronavirus lockdowns,https://cdn.presstv.com/Photo/2020/5/23/c7ecce2f-01e1-45f9-9b3e-1c676f02a67f.jpg,"Thousands of cars and motorbikes honking horns and waving Spanish flags drove in procession through Madrid on Saturday, May 23, as part of a nationwide protest called by the far-right Vox party against the country's coronavirus lockdown.

Spain, which imposed one of Europe's toughest lockdowns on March 14, has started to ease restrictions, but Madrid and Barcelona have remained in lockdown for longer because of more severe coronavirus outbreaks.

The protesters called for Prime Minister Pedro Sanchez and Deputy Prime Minister Pablo Iglesias, of the centre-left Socialists and left-wing Podemos coalition, to resign over their handling of the coronavirus crisis, and, in particular, the lockdowns and the damage done to the economy and jobs.

Protests against the lockdown started in Madrid's wealthy Salamanca neighbourhood last week, where people started banging pots and pans. But Saturday's procession marked the first organised protest against the government since the beginning of the coronavirus pandemic.

Vox urged people to protest in every regional capital, and similar car processions took place in Seville and Barcelona, among others.

Madrid and Barcelona are preparing to ease their lockdowns from Monday as infections have slowed. This will allow outdoor dining and gatherings of up to 10 people.

Spain has registered 28,628 deaths from COVID-19 and 234,824 cases.

(Source: Reuters)",17.5,Low,Right,Iran,0
27,http://www.presstv.com/Detail/2020/05/21/625832/Llama-Delivering-Food-Remote-Places-Wales,Press TV,2020-05-21,[],Llama helps deliver food to remote places in Wales,https://cdn.presstv.com/Photo/2020/5/21/561216fd-101c-427b-8093-57224121715d.jpg,"Max the llama has been making food deliveries to remote properties in the Welsh Valley during the coronavirus lockdown.

Alex and Matt from the llama farm ""Pembrokeshire Llamas"" decided to try and do something positive after their business was shut down by the virus. They've taken one of their llamas 'Max' to visit people living in remote spots while they deliver food to people and cheer them up.

""Shopping in the old days was miserable, wasn't it? It's great fun these days,"" said one of the customers in the video filmed by the farm owners on May 6.

According to the couple, llama delivery is not only eco-friendly but is most of all a safe alternative for those at risk of catching the virus, if they went out of the valley to shop.

Llama delivers food supplies several times a week, which helps Max stay in shape.

(Source: Reuters)",17.5,Low,Right,Iran,0
28,http://www.presstv.com/Detail/2020/05/23/625982/Donald-Trump-COVID-19-drug-malaria--,Press TV,2020-05-23,[],Drug touted by Trump raises death risk in COVID-19 patients,https://cdn.presstv.com/Photo/2020/5/23/e509609a-6d1b-4a27-894f-aa191cf3d9e3.jpg,US President Donald Trump is under fire for promoting an anti-malaria drug for coronavirus patients. A study says hydroxychloroquine could prove deadly for the patients. This is not the first time Trump touts strange prescriptions for COVID-19 patients.,17.5,Low,Right,Iran,0
29,http://www.presstv.com/Detail/2020/05/21/625819/UN-Palestinian-children-prison-coronavirus-pandemic,Press TV,2020-05-21,[],UN calls for release of Palestinian children detained by Israel,https://cdn.presstv.com/Photo/2020/5/21/75929a15-6d67-487c-9ef7-c37d4b8782ed.jpg,"Press TV’s website can also be accessed at the following alternate addresses:

The United Nations has called on Israel to release imprisoned Palestinian children amid the global coronavirus pandemic.

MORE FROM InfoClips

MORE FROM InfoClips

Sign up for our Newsletter

Sign up for our newsletter to receive a daily email of our best content",17.5,Low,Right,Iran,0
30,http://www.presstv.com/Detail/2020/05/19/625703/Palestine-Gaza-coronavirus-,Press TV,2020-05-19,[],Gaza shows solidarity with countries hit by coronavirus,https://cdn.presstv.com/Photo/2020/5/19/a69b4ad3-b865-469d-bd75-2a6b285cafb2.jpg,Palestinians in Gaza show solidarity with countries affected by coronavirus. The event was organized by the International Commission to Support Palestinians' Rights. Gaza has recorded a number of coronavirus cases due to the Israeli restriction on entry and exit movements.,17.5,Low,Right,Iran,0
31,http://www.presstv.com/Detail/2020/05/23/625983/Post-Pandemic-cold-war,Press TV,2020-05-23,[],Post pandemic cold war,https://cdn.presstv.com/Photo/2020/5/23/8b1a8fd4-ce14-4234-801d-bdf7cff35a00.jpg,"This edition of the program is about US escalating war with China and tensions with Iran and Venezuela.

Escalating tensions between China and the United States over the coronavirus are shaping the superpower rivalry in a unique fashion at the time of the pandemic. Also, the administrations malignant campaign against Iran is another example, although it has failed to bring the Islamic Republic to its knees.",17.5,Low,Right,Iran,0
32,http://www.presstv.com/Detail/2020/05/22/625874/Rohingya--settlements,Press TV,2020-05-22,[],PressTV,https://cdn.presstv.com/photo/20200522/2b3703d7-a368-4e63-9de6-ec2ca0266ae8.jpg,"After stripping away the autonomy of Kashmir through the revocation of articles 370 and 35A of the Indian constitution, Kashmir's independence is again under a new threat which is the new domicile law. In this episode of the ""The Subcontinent"" we will be looking into this law which has been imposed on the Kashmiri people undermining the autonomy and freedom of the residents of this oppressed region.

And we will be also reviewing the recent internet blackout in the Rohingya refugee camps and its role in making it more difficult to fight the novel coronavirus (COVID-19). Undoubtedly this action to block the people's access to the internet threatens the lives of the Rohingya people as they can't be updated with the newest information about fighting the virus.",17.5,Low,Right,Iran,0
33,http://french.presstv.com/Detail/2020/05/24/626043/Etats-Unis-Chine-guerre-commerciale-froide-coronavirus-Trump,Press TV,2020-05-24,[],Pékin déclare la guerre aux USA,https://cdn.presstv.com//photo/20200524/65ff3498-2474-4a64-9da7-3c63c7c93bfa.jpg,"Press TV’s website can also be accessed at the following alternate addresses:

You can send your comments to the relevant email below.

MORE FROM Static

MORE FROM Static

Sign up for our Newsletter

Sign up for our newsletter to receive a daily email of our best content",17.5,Low,Right,Iran,0
