news_id,url,publisher,publish_date,author,title,image,body_text,news_guard_score,mbfc_level,political_bias,country,reliability
16,https://www.americanthinker.com/articles/2020/05/in_honor_of_the_class_of_2020_some_scalding_coffee.html,American Thinker,2020-05-16,['Robert Oscar Lopez'],"In Honor of the Class of 2020, Some Scalding Coffee",https://www.americanthinker.com/images/bucket/2020-05/220922.jpg,"In 2020 many memes pay homage to the high school and college seniors who were supposed to have a commencement and walk up in robes and square hats to receive diplomas. That is how civilized societies reward teenagers and young adults for wrapping up four years of general education. But the coronavirus changes everything, in the way money behaves in the Cyndi Lauper song “Money Changes Everything.” I wish I could be like the millions of people who can turn out a fulsome praise to make everyone feel warm and fuzzy.

Instead, I’d like to pay honor to the class of 2020 by giving them the precious gift of honesty. This crop of graduates has been lied to, probably more than any other. I should know, because for all the years they’ve lived, I was inside the machine that manufactured the lies.

This year I graduated at the age of forty-nine in my own way. After twenty years of teaching college students, I finally left my last academic job and moved on from academia. I watched twenty classes of students move through the system while these current graduates incubated. My departure was as unceremonious as their non-ceremonies are going to be.

So here’s some truth that needs to be told: Your teachers didn’t know what they were talking about most of the time. I know you may have liked many of them, but that’s a kind of Stockholm Syndrome you get from the deliberate mental work the institutions do on you. You’re in school and they are the ones to whom you are captive. That’s why they may have seemed so kind; they needed you to give them high teaching evaluations so they could be promoted.

The people who taught you English were trained by unhinged Marxists who never made them read much classic literature before throwing them in the classroom to teach you. They rarely studied any foreign languages so had no grasp of world literature or classical literature. They were trained to disregard the Christian Bible so they lacked any meaningful connection to the thousands of years that the Bible and churches influenced artistic expression. The departments that hired them wanted chatty courtiers who could talk about glossy critical theories. Search committees didn’t hire literature professors who had a broad background, largely because the people on the hiring committees lacked the range to understand what they were talking about in job interviews. So you got the teacher who showed up talking about feminist readings of Jane Austen novels, like a million other grad students.

I know this because I sat through graduate school in the 1990s and went to conference after conference with English teachers. They did master’s theses and doctoral dissertations on idiotic pet theories that fascinated their advisors. In order to fund their reckless forays into illustrated children’s literature, erotica, music videos and other esoteric tomfoolery, they held their noses and studied composition and rhetoric so they could get jobs teaching young people how to write papers. So you were the cash crop that funded their dilettantism. If they made Shakespeare, Milton, and Henry James feel accessible to you, that’s likely because they were going off the Sparknotes just as you were. They made it accessible because they only knew as much as you did about the texts.

Most of what they told you about how to write is awful advice. The “rhetorical fallacies” like the straw man, red herring, and post hoc ergo propter hoc, are actually effective forms of persuasion that have served great commentators well from Demosthenes to Malcolm X. Ad hominem attacks make the world go round, contrary to what you’ve heard; the Declaration of Independence, remember, was a long personal attack on King George III. The human mind doesn’t react well to dry, dispassionate five-paragraph essays written by people who were forbidden from using “I” and discouraged from suggesting anything interesting or new. Once you graduate from college, nobody will ever ask you to write a 5-7 page paper with a topic sentence and formulaic presentations of evidence. Your teachers had to consume large amounts of alcohol to read those papers you hated writing.

Some of your English teachers may have followed their own suffocating rules of composition. If they did, they joined the ranks of those who write 25-page articles that take four years to get into print at a peer-reviewed journal, to be read by three grad students who stumbled on it on J-STOR when they were looking for something else. Most of your English teachers, though, broke the rules if they wrote anything impactful. They rolled up their sleeves, jumped on social media, and started flinging irresponsible mud at people over topics they felt emotional about. In other words, they were like Alexander Pope, Jonathan Swift, Emile Zola, Jean-Paul Sartre, and George Orwell. Passionate people worth studying.

But no matter how much you rave about the way your English teachers loved you and changed your life, the truth is they were horrible people. I worked alongside them for two decades. These are people who would strangle kittens for tenure. They pulled childish tricks to rig their student evaluations and nominated themselves for excellence in teaching awards. For all their prattle about sexual and racial equality, they zipped their mouths about colleagues abusing students. They did nothing when tenure review boards went after minority teachers. If it seemed like you had very few teachers of color and all the ones you had focused on ethnic studies, that’s because all the classicists of color were driven out of the academy for being self-hating Uncle Toms. Trust me. I lived that ugly routine at four different colleges.

You may think of yourself as liberal or conservative, but you’re probably neither. If you were a true leftist, you’d be staging protests against the abusive student debt and the hideous labor conditions of academia. You’d care about the adjuncts who teach 70% of your classes. When I was in college we built shanties to protest South African apartheid and some of us shouted at deans over campus governance, instead of working with “deans of diversity” to hold harmless parades about safe spaces for people of color and transgender track and field runners. The left you know is a phony game of distraction, designed to keep you unworried about the tuition they’ve extorted from you. Most of what the left preaches, whether it’s green energy or MeToo, ends up being consumerism and celebrity culture, which is really the same thing. Buy a Taylor Swift CD to show solidarity because someone grabbed her at a concert in Colorado. Log onto Google with your smart phone to learn about windmills and solar. Let’s pretend a Twitter mobbing against someone who said something homophobic in 1991 is left-wing activism… not.

I wrote Wackos, Thugs, and Perverts in 2017 to roll out the three basic flavors of educational progressives: wackos who are simply lunatics, thugs who will engage in all kinds of unethical behavior for a quick buck or power, and perverts who project their unhealthy obsessions onto their academic expertise. That’s the left you’ve seen. You’d be triggered in a nanosecond if you had to speak to an actual radical from the 1970s who wanted to push for social change. You’d probably accuse the person of mansplaining.

Even if you think you’re conservative, you’re probably not that either. Maybe you read the Daily Wire and love hearing Ben Shapiro say “facts don’t care about your feelings.” But if you were conservative, you’d be courageous enough to stand up for traditional values. In educational settings the few self-identified “conservatives” tend to come in three flavors: creeps, cretins, and cowards. The creeps were the libertarian profiteers who saw money to be made in the aftermath of pseudo-liberal destruction in the academic world; they make a living by dressing-up pro-corporate propaganda in Christian platitudes so it can be sold as Reagan’s three-legged stool to people who have no memory of what that was. The cretins were conservatives who had no concept of wolves in sheep’s clothing, and glommed onto numerous creeps (see prior sentence). The cowards were people who knew what traditional values were but didn’t want to jeopardize their chance of going to Harvard Law School or something.

All three of these conservative characters were completely useless. That’s why their movement got nowhere even as Ben Shapiro got invited to speak at campus after campus.

Whether you thought of yourself as conservative or liberal, you were really pseudo-libertarian, which is the default setting of both the Millennials and Generation Z. You wanted the experience of low-cost piety and reckless self-righteous adventures that involved no risk to yourself. You wanted to be able to snitch on your teachers and get them fired but you also wanted a small and non-intrusive government that would allow your gay classmates to make out at the senior prom. This is not your fault. During the last twenty years the entire educational system was rigged to foster that behavior in you because it kept you self-absorbed and ultimately unwilling to question the status quo. Other generations, like mine, rebelled against our teachers to feel cool. Your generations aped and flattered your supposedly progressive teachers to feel rebellious, which wasn’t necessarily cool, just the perpetually new normal.

As you get ready to start the next phase of your life, you are blessed to have had coronavirus overshadow your graduation. You have had a wakeup call that I haven’t seen students receive in twenty years. When I tried to explain to previous classes that experts were not as knowledgeable and all-powerful as people assumed they were, they wouldn’t believe me. The whole system told them that the APA, AMA, NEA, MLA, ALA, NEH, NIH, CDC, DOJ, and the rest were the gold standard. Now you’ve had your commencement canceled because these experts said everyone had to stay home for two months, since they couldn’t think of anything else to do about a virus. You sat at home wasting day after day with nothing to do while the experts couldn’t pull together a large-scale triage system, distribute reliable antibodies tests, or find treatment for people who got infected. After billions in science funding, this. If you’re paying attention, you’ve realized they’re a clown show.

What might feel scary to you could also become a sense of liberation. You hold a golden place of history. God gave you a graduation present: insight into the inner workings of a society that had spent at least sixty years convincing itself that their lies were real. In truth, human beings are still fragile organisms who can’t be saved by experts, degrees, courses of study, diplomas, transcripts, papers, conferences, or grades. People who seemed all-powerful and unquestionable to classes that came before you now stand exposed for being less than a wizard behind a curtain. They’re the bobblehead behind a telescreen (pace Orwell).

Please forgive me for speaking so frankly to you. You’ve been had. But you can’t be had any longer, since everything is breaking down. You didn’t ask for my advice but I’ll give it to you. You should stand up and fight the system at this point, whether you’re left or right. Past generations risked their safety to engage in real civil disobedience. Read Thoreau if it helps. When you’re young and not set in your career, you have more freedom than you can imagine. I wish I’d taken a stand for my beliefs at 19, so I didn’t have to take the stand at 49 with two kids, a wife, and a mortgage to worry about. I don’t regret my choices but my timing. If you don’t avail yourself of your freedom now, chances are you’ll be part of the machine for the rest of your life. And the machine is broken.

Robert Oscar Lopez can be followed at bobbylopez.me or on twitter @RLopezMission.",12.5,Low,Extreme right,USA,0
17,https://www.americanthinker.com/articles/2020/05/the_coronavirus_fifth_column.html,American Thinker,2020-05-16,[' Eileen F. Toplansky'],,https://www.americanthinker.com/images/bucket/2020-05/220963.png,"As left-wing Democrat-controlled states continue to keep people in lockdown, it is becoming apparent that they are using the pandemic as a means to gain ultimate control of people's lives.

In fact, leftists the world over are exploiting the pandemic in order to create their alleged utopias. Vanessa Vallejo, a Colombian activist and columnist explains that

Whenever they come to power, communists work hard to create a clientele network that will vote for them and support them in the future. So instead of looking for real solutions to lift people out of poverty altogether, they offer them subsidies or useless jobs where citizens are dependent on politicians. At the same time, they make life difficult for entrepreneurs, resulting in more and more unemployed people who can be hooked into their clientele network. Many of them will not be able to get subsidies, but plunging them into poverty will make them easy prey to convince so long as the government offers them aid and blames right-wing entrepreneurs and politicians for their misery.

Sound familiar? This is happening all across the United States. The governors of states like Michigan, New York, New Jersey, California, and Pennsylvania continue to hold people hostage to their dictatorial impulses.

After all, ""[c]ompanies have been forced to close, people cannot leave their homes so they can not 'seek' income on their own, many are sick or have sick relatives, and in this crisis, they have no way to pay the expenses raised by the calamity. In just a few weeks, government spending and the people who need help have both increased dramatically because people have lost their jobs.""

Eric Levitz at Intelligencer can barely conceal his glee as he writes

Now, the world is besieged by a pandemic that threatens to kill 100,000 Americans if we’re lucky [emphasis mine] before triggering a global economic depression.

He believes that the COVID-19 pandemic has ""expanded the spectrum of imaginable futures and political possibilities. And some of those possibilities have been a sight for sore socialists’ eyes.""

Thus, ""there's good news for progressives"" as they see a golden opportunity to assert that employer-based health care system is inadequate and the market economy which results in ""gross inequality"" must be dismantled. To the Left, the pandemic ""provides a vivid reminder that the state is perfectly capable of sheltering its constituents from the market’s mercilessness [.]"" Enter a ""progressive movement defined by the twin goals of Medicare for All and Green New Deal [that] might thrive in COCI-19's wake."" Leftists assert the need to

mount a robust, progressive response to climate crisis

transcend the nation state

establish ""cross-class and inter-ethnic solidarities""

include the undocumented by providing cash assistance

assist ""stigmatized constituencies"", i.e., people in jail

The ultimate goal for the Left is ""to fortify the progressive project"" by ""cultivat[ing] border-collapsing modes of social identity and secur[ing] a modicum of political power for the world’s disenfranchised and dispossessed.""

At the Jacobin, an American socialist, Marxist quarterly based in New York, Ben Burgis emphasizes that

Progressives and democratic socialists need to make the case that there’s a third alternative to business-as-usual centrists running the states Trump wants to 'liberate' and the cynical demagogues who want to feed low-income workers to the capitalist death machine by prematurely ending the lockouts [emphasis mine].

Consequently, he emphasizes that ""the pandemic can be an opportunity for the Left if [they're] prepared to fight for bold measures.""

In fact, the ""Democratic Socialists of America have an estimated 10,000 new members -- growth that organizers attribute, in part, to the coronavirus pandemic."" Since ""[t]he financial toll will be felt for years -- maybe decades -- to come, and with Congress’s push to expand the social safety net, more and more Americans could be open to government playing a bigger role in their lives. There is, in other words, great potential for systemic change in this as-yet-unwritten future -- a potential that [Democratic Socialists of America DSA] members recognize.""

Madeline Osburn reports that ""[a] network of Democratic non-profits and super PACs are funneling millions of dollars toward advertisements in key swing states, with the intent of politicizing the Wuhan coronavirus crisis and blaming the pandemic on President Donald Trump.""

The Washington Post reported the group Pacronym is planning to spend $5 million on ads attacking Trump’s response to the pandemic. Pacronym, whose board of directors includes former Barack Obama campaign manager David Plouffe, said its ads will target key 2020 swing states like Michigan, Wisconsin, Pennsylvania, North Carolina, and Arizona.

Money is distributed to progressive causes by a number of Democratic PACs, e.g., Sixteen Thirty Fund. In fact, ""in 2018, Politico reported that the Sixteen Thirty Fund 'funneled millions of dollars to progressive causes' by setting up a secret-money network of other groups, which were the 'most prolific political advertisers of 2018' when combined.""

Trevor Loudon has documented how ""communists and socialists are infiltrating the Democrat Party -- some openly, some secretly and some even running for public office on the Democratic Party ballot line."" In reality, ""politicizing the growing fears, illnesses and deaths of American citizens"" is a potent weapon in the Leftwing arsenal.

And, yet, as Vanessa Vallejo states, ""What is happening in the United States is a novelty that, once again, shows us how strong and important are the values and ideas on which this great country was built. In different parts of the U.S., there have been protests, including armed ones. Also, in different parts of the U.S., police have declared that they will not comply with orders to keep people completely confined by preventing activities that do not represent any danger and are necessary for the survival of many people.""

The declarations that we are seeing in the United States these days on this matter are shocking to those of us who come from countries where people have simply become accustomed to obeying any nonsense spouted by the ruler of the day. To see a policeman telling the media that he will always 'put constitutional rights before political opinions' and that therefore, he will not abide by draconian measures that go against common sense is encouraging for those of us who defend freedom. The coronavirus has cleared the field for communists. It is an opportune moment for the left in general, but above all, for those who already wield a certain amount of power and want to perpetuate themselves and implant their totalitarian paradise once and for all.

Freedom-loving Americans need to understand the existence of this fifth column and then assiduously fight the penetration of enemies to the state.

Eileen can be reached at middlemarch18@gmail.com",12.5,Low,Extreme right,USA,0
