news_id,url,publisher,publish_date,author,title,image,body_text,news_guard_score,mbfc_level,political_bias,country
15,https://theduran.com/regime-change-back-in-focus-pompeo-targets-iran-cuba-venezuela-in-epic-tweet-thread/,The Duran,2020-05-21,[],"Regime Change Back In Focus: Pompeo Targets Iran, Cuba & Venezuela In Epic Tweet Thread",https://149425939.v2.pressablecdn.com/wp-content/uploads/2020/05/pompeoflag.jpeg,"Sanctions, threats, “democratic transition” & charges of anti-Semitism…

Given the very noticeable rise in threatening rhetoric focused on Iran over the past week, it seems thoughts of regime change in Tehran are once again top of the agenda. Or perhaps simultaneously the administration needs a significant distraction of sorts amid the coronavirus pandemic, and the persistent national reopening question and agenda.

On Wednesday, Secretary of State Mike Pompeo went gloves off on Twitter, attacking Iran’s ‘Supreme Leader’ Ayatollah Ali Khamenei, blasting him as “anti-Semitic”, “disgusting” and as someone representing “hate speech,” according to Pompeo’s remarks.

The United States condemns Supreme Leader Khamenei's disgusting and hateful anti-Semitic remarks. They have no place on Twitter or on any other social media platform. We know Khamenei’s vile rhetoric does not represent the Iranian people’s tradition of tolerance. pic.twitter.com/cfBhyOfFa9 — Secretary Pompeo (@SecPompeo) May 20, 2020

He announced new sanctions on the Iranian government, specifically targeting the Minister of Interior, Abdolreza Rahmani, as well as top intelligence officials, for leading protest crackdowns and human rights violations.

But Pompeo didn’t stop at Iran, in follow-up tweets coming just minutes and hours apart calling out the “dictatorial Castro regime” as well as Maduro, urging “peaceful democratic transition for Venezuela” — or again in other words regime change.

Two years ago today, Maduro showed the Venezuelan people and the world that there can be no free and fair election while he occupies Miraflores Palace. The Democratic Transition Framework provides a roadmap for peaceful democratic transition for Venezuela. https://t.co/eB5TDZIuBk — Secretary Pompeo (@SecPompeo) May 20, 2020

Within a few hours he issued no less than nine tweets targeting Iran, Cuba, and Venezuela. On Cuba the US top diplomat called out the “Castro regime” who has “trampled the rights of the Cuban people”.

“I salute the brave Cubans who continue the fight for democracy and prosperity. The United States stands with you,” he added.

Today, Cubans celebrate their independence, yet the struggle for freedom continues. The dictatorial Castro regime has trampled the rights of the Cuban people. I salute the brave Cubans who continue the fight for democracy and prosperity. The United States stands with you. — Secretary Pompeo (@SecPompeo) May 20, 2020

White House and State Department briefings have been COVID-19 focused of late, whether on the domestic front or abroad — where the administration has been in a blame-game war of words with China over the virus origins and accompanying economic shutdown — but Wednesday’s Pompeo tweet rampage strongly suggests he’s ready to get back to the business of regime change.

Recall that last summer was dominated by ‘tanker wars’ in the gulf and Mediterranean. It appears we’re in for another hot one.

https://www.zerohedge.com/geopolitical/regime-change-air-pompeo-calls-change-government-iran-cuba-venezuela

Liked it? Take a second to support The Duran on Patreon!

Read Later Add to Favourites Add to Collection Report",17.5,Low,Extreme right,Cyprus
16,https://theduran.com/another-day-another-fail-bloomberg-mixes-up-hospital-bed-stats-of-russia-oecd-in-attack-on-countrys-covid-19-response/,The Duran,2020-05-21,['Greg'],"Another day, another fail: Bloomberg MIXES UP hospital bed stats of Russia & OECD in attack on country’s Covid-19 response",https://149425939.v2.pressablecdn.com/wp-content/uploads/2020/05/5ec4c5fa85f5401fa1112894.jpg,"Shortly after asking “why the coronavirus did not kill more Russians,” Bloomberg illustrated a stinging op-ed with a graph suggesting Russia is far behind OECD states in hospital beds… though the exact opposite is true.

Everything’s fine if it fits the narrative, Bloomberg Opinion editors might have thought when they misquoted World Bank statistics on the number of hospital beds per 1,000 residents, including the misrepresented data in a Russia-bashing op-ed by Clara Ferreira Marques, titled ‘How Putin’s Russia Bungled the Pandemic’.

Taking a swipe at Russia’s efforts to upgrade the Soviet healthcare system to make it less cumbersome and more effective, the piece argued that the endeavor failed, only leading to a drop in hospitals, beds available, and doctors.

To back up the premise, the article featured a graph claiming to be based on 2013 data from the World Bank. However, according to the World Bank’s actual stats, while Russia had over twice as many beds in 2013 (8.2 versus 3.8 per 1,000), the initial version of the Bloomberg story had Russia lagging far behind the OECD countries by the same margin.

The blunder did not go unnoticed by the Russian Embassy in the US, which accused Bloomberg of promoting a new barrage of “politicized allegations” with “fake” stats.

“We demand that Bloomberg Opinion refute, apologize and respect its own customers,” the embassy said in a Facebook statement.

We are convinced that readers and viewers of the leading American media deserve verified, but not deliberately distorted, information.

Several hours after the embassy voiced its protest, Bloomberg Opinion amended the article, embedding a correct version of the graph instead of the misleading one.

The blunder came just days after Bloomberg ran another story about Covid-19 and Russia that raised some eyebrows. “Experts Want to Know Why Coronavirus Hasn’t Killed More Russians,” the initial headline stated, in what many commenters saw as the outlet’s disappointment in the country’s relatively low death toll. It has since been changed twice to sound more neutral.

Other Western media outlets seem to be taking the same misleading doom-and-gloom approach in covering Russia’s fight with the epidemic. Last week, CNN declared Moscow “devastated” based on the number of identified cases, which came with increasingly large-scale testing.

Meanwhile, the New York Times and Financial Times seem to imply that the Russian government is covering up the damage done by the epidemic with the creative use of official mortality statistics. The mystery of Russia’s low death toll was thus “solved” by the Western press. But when the Russian Embassy in the US tried to have the New York Times print comparative statistics for Moscow, New York City, and London to give readers some proper context, it refused, according to the diplomats.

Liked it? Take a second to support The Duran on Patreon!

Read Later Add to Favourites Add to Collection Report",17.5,Low,Extreme right,Cyprus
17,https://theduran.com/new-evidence-suggests-the-united-states-government-may-have-engineered-covid-19/,The Duran,2020-05-21,"['Jake Olivier', 'Jack Garbo']",New Evidence Suggests the United States Government may have Engineered Covid-19,https://149425939.v2.pressablecdn.com/wp-content/uploads/2020/05/Dr.-Fauci.jpg,"The United States has a long history of using bioweapons against its own people.

On September 20, 1950, a US navy ship released a bioweapon into the air just off the coast of San Francisco in a deliberate attempt to experiment with its own population. The experiment resulted in at least one death and countless other infections. No one was prosecuted. In fact, the mainstream media almost completely ignores this piece of history.

Despite popular claims, Project MKUltra is not a conspiracy theory. According to documents uncovered under the Freedom of Information Act, the government illegally experimented on humans to discover means of mind control. Techniques that were used included high doses of psychoactive drugs, electroshocks, sensory deprivation, electroshocks, isolation, sexual abuse, and other forms of torture. These experiments were not just done on prisoners, it was done to innocent American citizens without their consent, including doctors, military personnel, and members of the general public. This information can all be found in wikipedia.

In one well known incident, government researchers, without informing the men they had the diseases, studied the effects of syphilis on African Americans. Afterwards, they deliberately withheld treatment to the men.

In addiction, there are countless other examples of incidents similar to those mentioned above.

After the sars outbreak in 2002, the United States government funded a collaboration of Chinese scientists and the US military from a bioweapons lab in Dort Detrick. Fort Detrick was the center of the U.S. biological weapons program from 1943 to 1969. After the program was discontinued, it served as the host for most elements of the United States biological defense program. It was also the grounds for Project MKUltra.

In 2002, Chinese scientists and a team of American scientists led by none-other than Dr. Fauci, teamed up to study the viruses effect on bat tissues. In addiction, they created what is called pandemic superbots. These were strains that were intentionally created to be more lethal than the strains occurring naturally. The fear of these strains being released alarmed other researchers. One Harvard professor told the Time magazine that Dr. Fauci’s work was intentionally weaponizing the virus. Despite this, Dr. Fauci’s work continued to be subsidized by the US government. Yes, I said the US government, not just the Chinese government.

Over the years, there were various incidents that resulted in the new weaponized virus from nearly being released. In response, in 2014, the US government terminated Fauci’s federal funding. This decision, however, did nothing to stop Fauci’s research. Instead, it just shifted the blame away from the US government over to the Chinese government. The research was then shifted to a military lab in a particular place in China. That place was Wuhan. Once the research was moved to Wuhan, the United States government reinstated its funds to the dangerous research. The amount given is thought to be around $3.7 million, although it is likely that it could be much higher.

Bat rectal swap research was also apart of Dr. Fauci’s research. Remember that the virus was alleged to have came from bats.

Three years later, in 2017, Dr. Fauci did an interview in which he claimed President Trump would face a global pandemic. “The history of the last 32 years that I have been the director of the NIAID will tell the next administration that there is no doubt they will be faced with the challenges their predecessors were faced with… We will definitely get surprised in the next few years.”

Indeed, we were surprised. Three years later, a virus similar to the SARS outbreak came about in the same place Dr. Fauci was creating another coronavirus strain at the same time he claimed a global pandemic would break out. Almost immediately after, the man in charge of these research is appointed to advise President Trump. Is this a coincidence? That’s up for you to decide.

If it is true that this virus was intentionally created and released by the United States, it is also worth noting why. There are many reasons to why the United States and China would intentionally release a bioweapon on its own populations. One theory is that the bankers and investors that control the United States government are using this crisis to dethrone the dollar as the world’s reserve currency, replacing it with an IMF based world currency. This currency would be used to even further their control over our monetary system and increase their wealth even more. We have already seen the United States unofficially endorse a IMF backed world currency. That however, can be discussed another time.

Regardless, these revelations should result in some serious questions being asked, including why the media has completely ignored this information and continues to hail Dr. Fauci as a hero.

Sources:

https://en.wikipedia.org/wiki/Project_MKUltra

https://www.businessinsider.com/military-government-secret-experiments-biological-chemical-weapons-2016-9?op=1#so-whats-happening-now-7

https://www.healio.com/infectious-disease/emerging-diseases/news/online/%7B85a3f9c0-ed0a-4be8-9ca2-8854b2be7d13%7D/fauci-no-doubt-trump-will-face-surprise-infectious-disease-outbreak

Liked it? Take a second to support The Duran on Patreon!

Read Later Add to Favourites Add to Collection Report",17.5,Low,Extreme right,Cyprus
