news_id,url,publisher,publish_date,author,title,image,body_text,news_guard_score,mbfc_level,political_bias,country,reliability
9,https://humansarefree.com/2020/05/h-r-6666-the-nullifying-your-4th-amendment-and-forcibly-separating-your-family-to-keep-you-safe-act.html,Humans Are Free,2020-05-20,[],H.R. 6666 – The Nullifying Your 4th Amendment and Forcibly Separating Your Family to Keep You ‘Safe’ Act,https://humansarefree.com/wp-content/uploads/2020/05/H.R.-6666-–-The-Nullifying-Your-4th-Amendment-and-Forcibly-Separating-Your-Family-to-Keep-You-‘Safe’-Act.jpg,"Representative Bobby Rush (D-Il) introduced on May 1st H.R. 6666, a piece of Orwellian legislation that could create a national surveillance and quarantine program, allow government entry into our homes to test for Covid-19 and even grant the authority to remove Americans from their homes by force.

Also called the TRACE Act (Testing, Reaching and Contacting Everyone), the bill was co-sponsored by 58 house democrats and touts that it would allow the Centers for Disease Control (CDC) to provide grants to some hospitals, schools, and nonprofits to help fight the coronavirus.

“This bill authorizes the Centers for Disease Control and Prevention (CDC) to award grants for testing, contact tracing, monitoring, and other activities to address COVID-19 (i.e., coronavirus disease 2019).” [SOURCE]

However, the law would also give these organizations the power to test Americans for Covid-19 “as necessary, at individuals’ residences, and for other purposes,” and give the Department of Health and Human Services (HHS) the authority to forcibly remove Americans from their homes if “necessitated by the circumstances of the declared emergency.” [SOURCE]

This bill is in clear violation of the fourth amendment, which guarantees, “the right of the people to be secure in their persons, houses, papers, and effects, against unreasonable searches and seizures.”

The key word here is ‘unreasonable’, however, meaning if the Supreme Court classifies it as ‘reasonable’, these home invasions will remain legal despite being clearly against the spirit of the law.

The push for forced entry echoes remarks made by the World Health Organization’s Dr. Michael Ryan in early April.

“In some senses, transmission has been taken off the streets and pushed back into family units, now we need to go and look in families and find those people who may be sick and remove them, and isolate them, in a safe and dignified manner.” – Dr. Michael Ryan [SOURCE]

The Queen of England voiced her support for forced entry as she compared it to British evacuations prior to the London bombings of WWII.

“[Citizens were] evacuated from their homes and sent away for their own safety. Today, once again, many will feel a painful separation from their loved ones but now, as then, we know, deep down, it is the right thing to do.” [SOURCE]

The TRACE Act has a keen focus on ‘contact tracing’, a term that effectively means government surveillance of our everyday behavior.

Its purpose is to test for who has the coronavirus and to whom they may have come in contact.

In Washington State, the government will soon require restaurants catalogue the phone numbers, emails, and time of arrival of every customer.

You may want to think twice if you believe that these programs will ever go away once enacted. Governments rarely give up power without incredible pushback from voters.

Edward Snowden articulated this brilliantly while the pandemic was still in its early stage.

“Do you truly believe that when the first wave, this second wave, the 16th wave of the coronavirus is a long-forgotten memory, that these capabilities will not be kept?

“That these datasets will not be kept? No matter how it is being used, what is being built is the architecture of oppression.” – Edward Snowden [SOURCE]

Interestingly, Bill Gates was recently awarded patent #060606 for a, “crypto currency system using human body activity data.” In layman terms, it’s a patent for a digital tattoo microchip which can detect ‘body activity.’

Millions of dollars have already been awarded to companies for similar technologies by the Bill and Melinda Gates Foundation.

Watch Luke Rudkowski discuss the larger agenda behind the TRACE Act on Bitchute:

By Phillip Schneider, WakingTimes.com",5,Low,,USA,0
10,https://humansarefree.com/2020/05/fauci-george-soros-bill-gates-david-rockefeller-ted-turner.html,Humans Are Free,2020-05-11,[],"Image Surfaces of Dr. Fauci With George Soros, Bill Gates Sr., David Rockefeller, Ted Turner",https://humansarefree.com/wp-content/uploads/2020/05/photos-image-surfaces-oof-dr-fauci-with-george-soros-bill-gates-sr-david-rockefeller-more.png,"Former Rep. Ron Paul called for the firing of Dr. Anthony Fauci, the infectious disease specialist leading President Trump’s medical response to the coronavirus pandemic.

Mr. Paul, a retired doctor who ran three times for president during his decades in politics, also called Dr. Fauci a “fraud” and encouraged Americans to “quit listening to him.”

The former Republican congressman from Texas made the remarks during an internet program he co-hosts, the Ron Paul Liberty Report, after Dr. Fauci (whose NIAID gave a $3.7 million grant to Wuhan lab at the epicentre of the COVID-19 outbreak) slashed the number of Americans projected to die from COVID-19, the infectious respiratory disease caused by the novel coronavirus.

The majority of the American people don’t agree with Fauci’s way of handling the Wuhan Virus crisis.

The people in the picture are: Dr. Fauci with Leonore Annenberg, Brooke Astor (of the Astor Illuminati bloodline), Irene Diamond, William H. Gates Sr. (the former head of Planned Parenthood – depopulation through abortion and child offerings to Satan), George Soros (one of the biggest sponsors of depopulation through famine, abortions, LGBTQP – “P” from pedophilia – groups and sexualization of children) and notorious self-confessed depopulationists, David Rockefeller (eugenics and sterilisation since the early 1900s) and CNN owner Ted Turner.

Very important article on the subject: List Of 32 ‘Elites’ That Support And Promote Depopulation

And one image of Dr. Fauci from twenty years ago made Americans question if Dr. Fauci is part of the “Deep State”:

As you can see, Qanon posted about this event, with a picture from a different angle. In this post you can see David Rockefeller:

Twitter user @Mikebravodude found the event from 2001 that the images came from:

Dr. Fauci with Leonore Annenberg, Brooke Astor, Irene Diamond, William H. Gates Sr., David Rockefeller, George Soros and Ted Turner. How many illuminati blood lines do you count here?

Article below with proof it. pic.twitter.com/evF7a0eP4Y — Mike Bravo (@mikebravodude) April 6, 2020

Dr. Fauci with Leonore Annenberg, Brooke Astor, Irene Diamond, William H. Gates Sr., David Rockefeller, George Soros and Ted Turner. How many illuminati blood lines do you count here?

Article below with proof it. pic.twitter.com/evF7a0eP4Y — Mike Bravo (@mikebravodude) April 6, 2020

The latest théorie du complot making its way around the Twitterverse has to do with the data modeling the government is using to track the coronavirus, including forecasts for deaths and the impact on hospitals across the country.

The Institute for Health Metrics and Evaluation at the University of Washington publishes models for the United States.

It’s used by Drs. Anthony Fauci and Deborah Birx in conjunction with their roles in advising the president and taking part in the daily press briefings.

The institute receives substantial funding from the Bill and Melinda Gates Foundation. Microsoft founder Bill Gates was out in front of predicting a pandemic several years ago and stepped forward as a leader to use his fortune to help fund the development of a COVID-19 vaccine.

And there’s the fuse to light the conspiracy dynamite.

Not all of them are alike. First, there are the QAnon-level conspiracies, but even those get picked up by anencephalic members of the Right such as Newsmax’s Emerald Robinson:

The more you study this virus, the more you find the same name: Bill Gates. He's the 2nd largest funder of WHO. He's building 7 vaccine labs. Fauci. Tedros. Event 201. ID2020. He basically controls global health policy. What's the plan? Using vaccines to track people. — Emerald Robinson ✝️ (@EmeraldRobinson) April 6, 2020

The “vaccine tracking” conspiracy is in a zone all by itself. But there’s another milder conspiracy making the rounds that focuses on the data modeling.

The IHME models have changed over time, predicting fewer deaths as time goes by.

Such improvements, instead of getting received positively, have become fodder for people to “ask questions” about the modeling since it’s been so “wrong.” For example:

Bill Gates-Funded IHME Coronavirus Model Wrong Again – 12,000 ICU Beds Projected For New York Today, Only 4,100 Used https://t.co/uJ8YchWhvE via @gatewaypundit — Bill Mitchell (@mitchellvii) April 5, 2020

By Natalie Dagenhardt, Guest writer",5,Low,,USA,0
11,https://humansarefree.com/2020/04/taiwan-no-lockdowns-covid-19.html,Humans Are Free,2020-04-30,[],"TAIWAN: No Lockdowns, No Closed Businesses, Non-WHO Member, and Relatively Unaffected by COVID-19",https://humansarefree.com/wp-content/uploads/2020/04/TAIWAN-No-Lockdowns-No-Closed-Businesses-Non-WHO-Member-and-Relatively-Unaffected-by-COVID-19-e1588177463520.jpg,"Johns Hopkins University had predicted that Taiwan would have the second most COVID-19 cases in the world, due to its close proximity to Mainland China.

But astonishingly, in spite of being only 80 miles from the coast of China with over 400,000 of its 24 million citizens working in China, as of mid-April, the country only had 400 cases of COVID-19, and only 6 deaths. And the vast majority of their 400 cases came into the country from abroad.

All of this has happened without shutting down the country with lock downs, and with almost all of its businesses continuing to operate.

Is Taiwan doing something else the rest of the world is largely missing?

This question will no doubt be asked for months or even years into the future, but it is a question well worth asking, given the devastating effects to the economy that have resulted from more restrictive measures such as the United States took.

The first thing to note is that while President Trump is now looking seriously at pulling out of the World Health Organization, Taiwan was never part of it. They were not allowed to join due to the WHO’s pro-China stance.

According to the Taipei Times, Taiwan’s CDC tried to warn China and WHO on December 31, 2019 about possible human-to-human transmission of the new coronavirus, while China was still denying that such transmission was possible.

That same day, Taiwan started policies to monitor travel from China to reduce the chance of having the coronvirus come into their country. They were one of the first countries to restrict travel from China at their borders.

Taiwan had bad experiences from the 2003 SARS (another coronavirus) outbreak in China, and as a result their hospitals were well supplied with equipment to handle any outbreaks.

This SARS situation had reportedly taught them to have a healthy distrust in China and the World Health Organization to accurately report facts, and to have their own plan in place for future outbreaks.

But unlike the U.S. and many other countries, Taiwan did not quarantine the entire nation.

They focused on quarantining travelers coming in from abroad in their own homes, while the rest of the nation went about their business, with some restrictions in place such as wearing face masks, and practicing social distancing.

It is hard to argue with their reported results so far, with so few actual cases and very few deaths. They kept the country open, and did not destroy their economy.

John Ransom, reporting for TownHall Finance writes:

Protests in the streets, oil trading at negative numbers, rapidly spiraling unemployment, locked-down international travel and trade: I think we can all agree that by any barometer, including these, the world has failed the Wuhan flu test.

Why the world’s answer to the China flu has been so disastrously wrong, ill-thought out and ignorant to reality can be left to future post-mortems. But after spending literally trillions on public health over the decades to prevent just such an occurrence, it’s clear by now that the world’s investment in public health professionals was wasted.

We can debate whether the cost was worth it, but there is no denying that the cost has been beyond anyone’s imagining.

Some may argue that in such a crisis, experts faced a no-win situation where they had to either trade lives for the economy or the economy for lives.

To that I give a one-word answer: Taiwan.

Taiwan is the other “China”. It’s a small island off the southern coast of China, called the Republic of China (ROC). It was created as a bastion of “free” China as the Communist Party took over mainland China (PRC).

The island may be small, but the country is a regional and worldwide powerhouse. It’s the 21st largest economy in the world (19th if counting by PPP), despite having a population of just 24 million. It ranks 11th in GDP per capita, comparable to Denmark and Sweden.

It’s also an important partner with Communist China as one of the leading investors, trading partners and bankers for the PRC. Consequently, Taiwan hosts quite a bit of contact with the PRC.

For comparison sake, the United Sates saw about 3 million visitors from China in 2018, while Taiwan hosted 2.6 million visitors from China in 2018.

That’s why the results from Taiwan in fighting China’s Wuhan flu—as they call it in Taiwan—is so extraordinary.

Worldwide there have been 321 cases of COVID-19, or Wuhan flu, per million people. In Taiwan there have been just 0.3 cases per million people for a total of 422 cases, with only six total deaths.

Equally important is that while the Taiwanese economy has been damaged by the global shutdown, their domestic economy and society has remained open. (Source and Full Article Here.)

We report these results as a comparison to what other actions have been taken in other countries, that have had far more disastrous results.

We are not necessarily endorsing everything that Taiwan has done, just reporting the facts about their response and their results so far.

Many questions are still unanswered. Did the actions the Taiwan Government take cause a much lower rate of reported infections of COVID-19?

Or are there other factors involved that kept their infection rates lower?

Since the SARS outbreak more than 15 years ago was so severe there, was there some natural immunity against coronaviruses involved? Did their location closer to the equator with more sunlight and warmer temperatures this time of year play a factor?

About the only thing we do know for sure, is that the vaccine gods and their global leaders like Bill Gates and Dr. Fauci and the WHO cannot take credit for Taiwan’s success, because they never were able to successfully develop a vaccine for SARS, and they have successfully kept Taiwan out of the WHO.

Writer Marc A. Thiessen offers his perspective:

This pandemic has provided us with a clinical trial in the healing power of freedom. We can now compare two control groups in the form of two Chinese societies — one free and democratic, the other under the grip of a brutal totalitarian dictatorship.

Totalitarian China has not only been ravaged by the virus but has also spread the contagion to our shores. Free China has defeated it. The lesson is clear: COVID-19 grew in the cesspool of Chinese Communist tyranny.

The antidote to the coronavirus is freedom. (Source)

Watch the PBS News Hour report:

By Brian Shilhavy, Health Impact News",5,Low,,USA,0
12,https://humansarefree.com/2020/04/bill-gates-depopulation-agenda-rfk.html,Humans Are Free,2020-04-28,[],Bill Gates and the Depopulation Agenda – Robert F. Kennedy Jr. Calls for an Investigation,https://humansarefree.com/wp-content/uploads/2020/04/Robert-F.-Kennedy-Junior-the-cdc-is-a-vaccine-company-e1588063028646.jpg,"For over twenty years Bill Gates and his Foundation, the Bill and Melinda Gates Foundation (BMGF) have been vaccinating foremost children by the millions in remote areas of poor countries, mostly Africa and Asia.

Most of their vaccination program had disastrous results, causing the very illness (polio, for example in India) and sterilizing young women (Kenya, with modified tetanus vaccines). Many of the children died. Many of the programs were carried out with the backing of the WHO and – yes – the UN Agency responsible for the Protection of Children, UNICEF.

Most of these vaccination campaigns were implemented without the informed-consent of the children, parents, guardians or teachers, nor with the informed-consent, or with forged consent, of the respective government authorities. In the aftermath, The Gates Foundation was sued by governments around the world, Kenya, India, the Philippines – and more.

Bill Gates has a strange image of himself. He sees himself as The Messiah who saves the world through vaccination – and through population reduction.

Around the time, when the 2010 Rockefeller Report was issued, with its even more infamous “Lock Step” Scenario, precisely the scenario of which we are living the beginning right now, Bill Gates talked on a TED show in California, “Innovating to Zero” about the use of energy.

He used this TED presentation to promote his vaccination programs, literally saying, “If we are doing a real good job vaccinating childen, we can reduce the world population by 10% to 15%”.

This sounds very much like eugenics.

I have included the top comments as well:

The video, the first 6’45”, “The Truth about Bill Gates and his Disastrous Vaccination Program”, will tell you all about it.

Robert F Kennedy Jr, an avid Defender of Children’s Rights and anti-vaccination activist, has launched a petition sent to the White House, calling for “Investigations into the ‘Bill and Melinda Gates Foundation’ for Medical Malpractice & Crimes Against Humanity.”

If you wish to Sign the Petition Click Here

Robert F. Kennedy Junior: “The CDC is Actually a Vaccine Company.”

See also brief video featuring Author Bill Still ( 6 min) entitled The Truth about Bill Gates and his disastrous Vaccination Programs around the World:

Robert. F. Kennedy Exposes Bill Gates’ Vaccination Agenda

Now Mr. Gates and his allies, including Big-Pharma, WHO, UNICEF, Dr. Anthony Fauci, Director of NIAID / NIH, a close ally of Mr. Gates – and of course, Agenda ID2020, are proposing to (force) vaccinate 7 billion people around the globe, with their concoction of a (so far) untested coronavirus vaccine.

This is a multi-billion dollar bonanza for Big Pharma and for all those who support the vaccine. Nobody will really know what the vaccine cocktail will contain. They intend to start with the Global South (Developing Countries) and then gradually move North (Developed Countries).

Mind you, there is no need for a vaccine to cure the corona virus. There are many cures:

French Professor Didier Raoult, who is one of the world’s top 5 scientists on communicable diseases, suggested the use of hydroxychloroquine (Chloroquine or Plaquenil), a well-known, simple, and inexpensive drug, also used to fight Malaria, and that has shown efficacy with previous coronaviruses such as SARS.

By mid-February 2020, clinical trials at his institute and in China already confirmed that the drug could reduce the viral load and bring spectacular improvement. Chinese scientists published their first trials on more than 100 patients and announced that the Chinese National Health Commission would recommend Chloroquine in their new guidelines to treat Covid-19. (Peter Koenig, April 1, 2020)

Be aware, awake, alert and warned.

By Peter Koenig – Research Associate of the Centre for Research on Globalization.",5,Low,,USA,0
13,https://humansarefree.com/2020/04/bill-gates-and-ellen-degeneres-discuss-vaccinating-7-billion-healthy-people-in-order-to-return-to-normal.html,Humans Are Free,2020-04-25,[],Bill Gates and Ellen Degeneres Discuss Vaccinating ‘7 Billion Healthy People’ in Order to ‘Return to Normal’,https://humansarefree.com/wp-content/uploads/2020/04/Bill-Gates-and-Ellen-Discuss-Vaccinating-‘7-Billion-Healthy-People’-in-Order-to-‘Return-to-Normal’.jpg,"While millions of Americans suddenly find themselves jobless and broke, Bill and Melinda Gates just purchased a $43 million dollar home near San Diego, California, along with an $18 million dollar house in Santa Fe.

When he’s not buying extra mansions, Gates is busy appearing on national media discussing his solution to the pandemic.

For one of his most revealing conversations of late, Gates recently appeared The Ellen Degeneres Show.

Ellen has also been in the news in recent weeks after being described as ‘one of the meanest people alive’ by actor Kevin T. Porter.

Right now we all need a little kindness. You know, like Ellen Degeneres always talks about! 😊❤️ She’s also notoriously one of the meanest people alive Respond to this with the most insane stories you’ve heard about Ellen being mean & I’ll match every one w/ $2 to @LAFoodBank — Kevin T. Porter (@KevinTPorter) March 20, 2020

TV script writer Benjamin Simeon also commented that Ellen ‘picks someone different’ in the office to hate every day, a sharp turn from her fun and quirky demeanor she presents on camera.

B) A new staff member was told ""every day she picks someone different to really hate. It's not your fault, just suck it up for the day and she'll be mean to someone else the next day. They didn't believe it but it ended up being entirely true. — Benjamin Siemon (@BenjaminJS) March 20, 2020

Bill Gates sat down with Ellen DeGeneres over the internet last week to discuss the coronavirus pandemic and to tell the world that life will not get back to normal until ‘7 billion healthy people’ have taken his soon-to-be-invented vaccine.

Of course, their tacitly agreed upon position is that a vaccine is the solution and that there are no other alternatives worth discussing, even though many are reporting that the virus is already mutating and a vaccine may not ever be possible.

Bill: “…what policies do we have, because until we get almost everybody vaccinated, uh, globally, we still won’t be fully back to normal.”

Ellen: “…I mean, I can’t even imagine going out to a crowded restaurant or anything in June or July if we don’t have vaccines, how, how do you see us acclimating back into a normal life when we don’t have the cure for this?”

Bill: “…we need to start getting things back to normal. They won’t be back to normal until we either have that phenomenal vaccine or a therapeutic that’s over 95% effective and so we have to assume that’s going to be almost 18 months from now.” – Bill Gates

Eighteen months of lockdown would desolate our civil liberties and destroy the economy for years to come, all while substantial money is made from the eventual vaccine, whether or not it works as intended or causes harm to the patient.

“[The economy] won’t go back to normal in some very rapid fashion because not only do we have these factories shut down and all these activities have ceased, even as we start them back up people will still be a bit leery about going out and they will have seen their investments and their job security greatly reduced.” – Bill Gates

Bill Gates, Anthony Fauci and others have for weeks been alluding to a coronavirus vaccine and immunity certificate for everyone, which would ostensibly be required to engage in essential activities such as school, work, and worship.

The Bill and Melinda Gates Foundation has been funding the development of vaccines by supporting leading pharmaceutical companies, and also supporting the development of new technologies such as ‘microneedle technology,‘ which would implant a record of immunization under the skin that can be read by smartphone technology or via infrared light. Numerous multimillion-dollar grants have been awarded to these projects.

“We want to get into this semi-normal phase whenever we can and then the vaccine is the thing that will change things and that’s why [we need to] figure out how to make sure it’s safe because when you give it to 7 billion healthy people that’s super important.” – Bill Gates

In contrast to Gates’s foreboding message that lockdowns, required vaccines, and a global economic recession must happen, protests are occurring around the country calling for an opening of the American economy again and a return of our civil liberties which are being rapidly eroded.

As Ellen’s never-ending praise for Bill Gates and apparent refusal to ask any serious questions about our civil liberties or the implications of global vaccination illustrates, bleeding heart Hollywood stars and billionaire philanthropists are not always the characters they play on TV.

By Phillip Schneider, Waking Times",5,Low,,USA,0
