news_id,url,publisher,publish_date,author,title,image,body_text,news_guard_score,mbfc_level,political_bias,country
0,https://theduran.com/dnc-hack-hoax-exposed-time-to-free-assange-video/,The Duran,2020-05-18,['Alex Christoforou'],"DNC hack hoax exposed, time to free Assange (Video)",https://149425939.v2.pressablecdn.com/wp-content/uploads/2020/05/assange-free.jpg,"The Duran’s Alex Christoforou and Editor-in-Chief Alexander Mercouris discuss the complete collapse of the DNC email hack story, as the Crowdstrike president of Services and CSO has admitted under oath that he has no proof that Russia exfiltrated DNC emails.

With the stunning revelations from Crowdstrike, and the Michael Flynn entrapment at the hands of the Obama White House and the FBI, the question must be asked, why is Assange being held in a UK prison?

Support Free Speech:

Subscribe to The Duran on YouTube – Find us on BitChute.

The Duran Audio Podcast:

Follow on Soundcloud – Subscribe on iTunes.

“Six big lies you have been told about Russiagate” authored by Nebojsa Malic, via RT…

‘Russian meddling’ in the 2016 US presidential election has become an article of faith, not just among Democrats but many Republicans as well, thanks to the endless repetition of vague talking points, none of which hold water.

It all began with the Democratic National Committee (DNC) claiming in June 2016 that Russia hacked their computers, after documents were published revealing the party’s rigging of the primaries. This was followed by Hillary Clinton accusing her rival for the presidency, Donald Trump, of “colluding” with Russia by asking Moscow for her emails – the ones she deleted from a private server she used to conduct State Department business, that is.

With a little help from the mainstream media, which overwhelmingly endorsed Clinton and predicted her victory, her efforts to cover up her email scandal turned into Russia “hacking our democracy,” eventually spawning the ‘Russiagate’ investigation led by Special Counsel Robert Mueller and a series of failed attempts to derail Trump’s election and oust him from the White House.

Lie #1: Russia hacked the DNC

The infamous US intelligence community assessment (ICA) of January 2017, and the Senate Intelligence Committee report based on it – as well as ‘analysis’ by actual election meddlers, among others – all claimed that the Russian government and President Vladimir Putin personally were behind the “hack” and publication of DNC documents. These have always been assertions, and no evidence was ever provided.

Last week’s declassification of 50+ interviews in the probe conducted by the House Intelligence Committee revealed that the cybersecurity firm CrowdStrike, brought in by the DNC lawyers to fix the “hack,” did not have evidence either.

CrowdStrike’s president, ex-FBI official Shawn Henry, testified that they “saw activity that we believed was consistent with activity we’d seen previously and had associated with the Russian Government.” [emphasis added]

In the same testimony, Henry also testified that CrowdStrike never had any evidence the data was actually “exfiltrated,” i.e. stolen from the DNC servers.

CrowdStrike’s feelings about the hack remain the only “evidence” so far, since the FBI never asked them or the DNC for the actual server, as Henry also confirmed. Meanwhile, former NSA official and whistleblower William Binney argued back in November 2017 that actual evidence showed a leak from the inside, not a hack.

Lie #2: Russia hacked Podesta’s emails and published them in collusion with WikiLeaks

There is likewise zero proof that the Russian government had anything to do with the private email account of John Podesta, Clinton’s campaign chair, which a staffer admitted had been compromised when someone fell for a phishing scam.

Instead, the key argument that WikiLeaks was somehow ‘colluding’ with Russia over the publication of the emails rests on a conspiracy theory promoted by the Clinton campaign staff, after RT reported on a fresh batch of emails before WikiLeaks got around to tweeting about them – but after they were published on the website and available to anyone willing to do actual journalism.

In fact, the existence of RT has been a major “argument” of Russiagaters; a third of the ICA intended to show ‘Russian meddling’ consisted of a four-year-old appendix about RT that was in no way relevant to the 2016 situation but lamented its coverage of fracking and ‘Occupy Wall Street’ protests, for example.

Lie #3: The Steele ‘pee tape’ dossier was irrelevant

As it later emerged, Clinton’s claims about ‘Russian collusion’ were based on a dodgy dossier her campaign commissioned through the DNC and a firm called Fusion GPS from a British spy named Christopher Steele. It said that the Kremlin was blackmailing Trump with a tape of depraved sex acts in a Moscow hotel, with prostitutes supposedly paid to urinate on a bed President Barack Obama had slept on.

It was clearly ridiculous and entirely evidence-free. Democrats claimed it played no role in Russia investigations. Yet the FBI paid Steele for information from the dossier, and used it to justify a FISA warrant for the surveillance of Trump campaign aide Carter Page – and with him the campaign itself – starting right before the election, and renewed three times.

By January 2020, the DOJ had formally disavowed the dossier and all four FISA warrants, along with any information obtained from them, saying “there was insufficient predication to establish probable cause.”

Lie #4: General Michael Flynn treasonously colluded with Russia and lied about it to the FBI

Trump’s first national security adviser was hounded out of the White House after less than two weeks on the job, after media leaks insinuated he had improperly discussed sanctions with Russian Ambassador Sergey Kislyak, violating the Logan Act, and then lied to the FBI about it.

After FBI Director James Comey was fired by Trump in May 2017, he told the media the president had urged him to drop the investigation of Flynn, which was quickly construed as “obstruction” and used as one of the pretexts to appoint Robert Mueller as special counsel into Russiagate.

When actual evidence was finally coaxed out of prosecutors, however, it showed that the FBI sought to frame Flynn in a perjury trap, and that the people involved were Comey himself, his deputy Andrew McCabe, disgraced lovers Peter Strzok and Lisa Page, and others. All charges against Flynn were dropped.

Flynn didn’t even lie to Strzok and the other agent interviewing him – and the memo of that conversation had been first heavily edited, then destroyed. Basically, everything about the Flynn case has been as false as ABC’s December 2017 bombshell report about his “collusion” with Russia that got Brian Ross fired.

Lie #5: Mueller found collusion, or at least Russian meddling

When Mueller’s final report came out, in the spring of 2019, it found zero evidence of “collusion” but insisted there had been Russian “meddling” in the election. The only trouble was that he had no proof of meddling, basing it entirely on the above-mentioned intelligence “assessments” and his own indictments.

A Russian company named in one of the indictments actually contested it in a US court and won. First, a federal judge slapped down Mueller’s prosecutors for violating rules by presenting allegations as “established” and “confirmed” facts and ruling that no link was actually established behind a catering company accused of “sowing discord” on social media – a far cry from hacking the DNC! – and the Russian government.

The DOJ quietly dropped that particular case in March, just as coronavirus shutdowns were starting across the US, using “recent events” and a change in classification of some of its evidence as a face-saving excuse.

Lie #6: Paul Manafort was Trump’s conduit to Russia

Paul Manafort, who ran Trump’s campaign between March and August 2016, was convicted of multiple counts of conspiracy against the US and sentenced to a lengthy prison term. However, despite repeated attempts by the media to present him as some kind of liaison between Trump and Russia, the entirety of things that got him in trouble with the law had to do with tax evasion on money he made lobbying for and in… Ukraine.

During the two trials against Manafort, it emerged that he and his business partner Rick Gates had worked with Podesta’s brother Tony to fleece Ukrainian oligarchs for years, and stash the profits in tax havens.

The Ukrainian officials who leaked the so-called “black ledger” implicating Manafort to the US media were even convicted of election meddling by a court in Kiev, and the whole thing may have been solicited by a Ukrainian-American DNC contractor… The US media have been curiously uninterested in that particular “collusion,” needless to say.

Peel back all these layers of misinformation, like an onion, and what’s left is an empty talking point, endlessly repeated by Democrats like Adam Schiff (D-California), that “Russia hacked our democracy.”

The charge is vague enough that it can mean anything, and deliberately so. No evidence is ever offered, because there isn’t any – as the years of investigations and boxes full of documents have clearly shown.

Liked it? Take a second to support The Duran on Patreon!

Read Later Add to Favourites Add to Collection Report",17.5,Low,Extreme right,Cyprus
1,https://theduran.com/reports-uk-to-cut-huaweis-involvement-in-5g-network/,The Duran,2020-05-24,['Greg'],Reports: UK to cut Huawei’s involvement in 5G network,https://149425939.v2.pressablecdn.com/wp-content/uploads/2020/05/webp.netresizeimage203.jpg,"Boris Johnson wants to reduce Chinese tech giant’s involvement in building network to zero by 2023, according to British media.

British Prime Minister Boris Johnson plans to reduce the role of Huawei in the U.K.’s 5G network in the wake of the coronavirus crisis, according to reports in the Guardian and the Telegraph.

Johnson has instructed officials to draft plans that would reduce Huawei’s involvement in building the U.K.’s 5G phone network to zero by 2023, the Telegraph reported.

The move marks a departure from the U.K. government’s previous position. In January, Johnson said he would allow the Chinese tech giant to build up to 35 percent of its 5G phone network but block access to “sensitive core” parts of the network.

The push for new plans comes amid growing backlash among Conservative MPs against Chinese investment and a lack of transparency around Beijing’s handling of the coronavirus pandemic, according to the Telegraph.

The paper also reported Johnson hopes to ramp up trade talks with the United States, which has been one of the most vocal critics of the U.K.’s decision to allow Huawei into its market, citing security concerns.

The reports “simply don’t make sense,” Huawei Vice President Victor Zhang said in a statement. “As a private company, 100% owned by employees, which has operated in the UK for 20 years, our priority has been to help mobile and broadband companies keep Britain connected, which in this current health crisis has been more vital than ever. This is our proven track-record.”

Referral link

Liked it? Take a second to support The Duran on Patreon!

Read Later Add to Favourites Add to Collection Report",17.5,Low,Extreme right,Cyprus
2,https://theduran.com/globalists-in-panic-george-soros-warns-eu-may-not-survive-coronavirus-crisis/,The Duran,2020-05-24,['Malcolm Harris'],Globalists in Panic: George Soros Warns EU May not Survive Coronavirus Crisis,https://149425939.v2.pressablecdn.com/wp-content/uploads/2020/05/George_Soros_-_Festival_Economia_2012_02.jpg,"The coronavirus crisis is affecting the European Union on multiple levels. The union is in complete disarray economically, socially, and politically. As the block plunges into recession, anti-EU and anti-Euro sentiment is continuing to grow rapidly.

The ground zero for this sentiment is Italy. For almost a decade, Italy has been on the edge of facing a similar crisis to that of Greece. This has mainly been due to the large deficits produced by the right-wing Berlusconi governments. Since 2018, anti-establishment and anti-EU sentiment in Italy continues to grow, with anti-EU populists now making up a majority of the Italian parliament. Berlusconi’s party is now polling at 6%, while former centre-left Prime Minister Matteo Renzi’s party continues to barely make the polling threshold needed to enter parliament. When the coronavirus crisis hit, right-wing populists such as Matteo Salvini and Georgia Meloni viciously went after the Euro, pushing for a return to an Italian currency to better handle the crisis. They also criticized the European Union as a whole for its late response to the coronavirus in Italy, which forced the government to turn to aid from Russia.

Their push seems to be working. According to a poll published by Tecne, 47% of Italians support leaving the Eurozone and 46% support leaving the European Union altogether. To compare, only 41% of those polled supported remaining in the union.

Italy, however, isn’t the only nation in Europe where Europskepticism is on the rise. A recent poll suggests nearly 60% of France has no trust in Brussels, up 10 points since the election of Emanuel Macron. This comes as Macron faces increased pressure to resign, this time coming from the left as 10 of his party’s MPs have switched parties. Macron, a former Rothschild banker, often dubbed as a “puppet of the big banks”, has slowly been losing control of his country. As the Yellow Vest protests are starting to revive, the president is also being faced by migrant riots. Time will tell how long Macron can hold on. Recent polling suggests that he could be ousted in the next election by the far-right Marine le Pen.

As the union struggles to hold on economically, the idea of issuing Eurobonds is being seen as an option to satisfy Italy. That option, however, may be off the table as a German court recently declared it unconstitutional. Merkel has since announced she opposes the plan.

George Soros has came out in support for the Eurobond program: “A 1 trillion-euro bond would cost 5 billion euros a year, assuming an interest rate of 0.5%. The consols would not need to be sold all at once; they could be issued in tranches and they would be snatched up by long-term investors like life insurance companies.” The move would add $1 trillion of debt to the European Union as a whole, as if Europe didn’t have enough debt.

Along with Soros, Macron has announced his support for the plan. Unlike Merkel, who at times will turn on the World Order in favor of the interests of her own nation, Macron almost always carries out the interests of those who put him in power. Despite support from Macron, the move seems more and more unlikely as Merkel has not backed down in her opposition to the plan.

Will economic troubles lead to a collapse in the union? George Soros seems to think so. “If the EU is unable to consider it now [Eurobonds], it may not be able to survive the challenges it currently confronts… This is not a theoretical possibility; it may be the tragic reality.”

With globalist leaders such as Macron and Italian Prime Minister Conte on the edge of losing power to the far-right, economic troubles for the block may trigger the collapse of both the European Union along with the establishment governments within the block. Time will tell. However, since one of the main architects of the union already echos this sentiment, we may already know the answer.

Liked it? Take a second to support The Duran on Patreon!

Read Later Add to Favourites Add to Collection Report",17.5,Low,Extreme right,Cyprus
3,https://theduran.com/coronavirus-war-room-ep19-with-dr-judy-mikovits-by-dr-paul-cottrell/,The Duran,2020-05-24,[],Coronavirus War Room Ep19 (with Dr. Judy Mikovits) by Dr. Paul Cottrell,https://149425939.v2.pressablecdn.com/wp-content/uploads/2020/05/5ec94c0c04dc9-hqdefault.jpg,"Switch to the dark mode that's kinder on your eyes at night time.

Switch to the light mode that's kinder on your eyes at day time.",17.5,Low,Extreme right,Cyprus
4,https://theduran.com/like-post-war-britain-we-need-a-new-normal-after-covid-19/,The Duran,2020-05-23,[],"Like post-war Britain, we need a new normal after Covid-19",https://149425939.v2.pressablecdn.com/wp-content/uploads/2020/05/A-covid-post-world.jpg,"Submitted by InfoBrics, authored by Johanna Ross, journalist based in Edinburgh, Scotland…

As lockdown restrictions begin to be lifted, and we slowly aim to return to ‘normality’, questions are beginning to be asked about just what that normality should be. For never in recent history has a crisis so blatantly highlighted the inequalities in our society. And it’s not just those on the left that think so. Veteran right-wing journalist Max Hastings, recently wrote a piece in which he said the coronavirus pandemic unleashed a demand for ‘social, political and economic reform unprecedented in our memories’. Even the former governor of the Bank of England, Mark Carney, recently admitted that when this is over, it would be ‘reasonable’ for people to ‘demand improvements’ in the quality of social provision and healthcare.

The reality is that Covid-19 has turned capitalists into socialists overnight, whether they like it or not. We’ve kept hearing about governments making the choice between people and the economy. But people are the economy. Fundamentally, we need a change in priorities. The danger is that we return to a status quo from which another crisis will be born: this pandemic is not over yet, the threat of another one in future is real, and we need to have the social measures in place to enable us to deal with the fallout. Britain only has to compare itself statistically with other nations to realize that, along with the US, it has suffered particularly badly so far from this disease, and we have to ask why. An under-funded healthcare system, together with a 20% poverty rate surely plays a role.

In the midst of this ‘war’, with unemployment set to skyrocket, and families struggling to pay the rent and feed their children, Jeremy Corbyn’s agenda at the last election looks appealing. The renationalisation of key industries, a ‘living’ wage, a massive social housing programme, and immediate pay rise for public sector workers; somehow it doesn’t seem so ‘radical’ after all. The latest figures show that people living in poorer areas in Britain are twice as likely to succumb to coronavirus. What is the government doing about it? Not much. One of the Tory pledges in their 2019 election manifesto was to add five years on to life expectancy by 2035. But that’s a tall order and would mean a significant change in policies – not just in the short term for dealing with the Covid-19 pandemic – but in the long term. We may be the world’s fifth largest economy but Britain is currently ranked 29th in the global life expectancy index, behind a host of European countries.

The question is, what kind of post-Covid-19 future do we want? Already comparisons are being made with the aftermath of the Depression and the Second World War. After the Depression, President Roosevelt stated that ‘heedless self-interest is…bad economics’ and that ‘freedom from want’ must be a key factor in policy-making. As for the UK, war-time leader Winston Churchill’s Conservative party was rejected in the 1945 election in favour of Labour, whose manifesto brandished the slogan ‘The Labour party is a Socialist party and proud of it’. The policies on which the party won were radical: nationalisation of the Bank of England, the coal and energy industries, public transport, and iron and steel. During the war, inequality was laid bare much in the same way as it has been during this current pandemic, and we saw the 1942 Beveridge report published, which laid the foundation for the welfare state – the cornerstone of British society as we know it today.

‘Goodbye globalisation’ read the front cover of this week’s Economist. It argues that globalisation was already on the rocks after the 2008 financial crash and Trump’s war with China; Covid-19 has been the final nail in the coffin. It predicts that global trade faces a troubling time ahead as governments, forced to underwrite national firms, will continue to favour them moving forward. But this can only be welcomed. Firstly, global trade generally means rich countries exploiting cheap workers abroad. Aside from welfare, a return to ‘normality’ would be disastrous for the planet. Satellite images have shown the remarkable changes which have taken place in our atmosphere across the globe as lockdowns were imposed on an international scale. Carbon dioxide emissions are set to have fallen this year by 8%, but this would have to occur every year for a decade in order to limit global warming to less than 1.5C above pre-industrial temperatures.

Obviously, repeated and prolonged lockdown is not a solution, but some serious attempt must be made to address climate change before it’s too late. The coronavirus pandemic illustrates just how mother nature can floor us before we know it. She can’t be underestimated. Indeed there has been something wonderful about the way nature has been able to reclaim its territory in this short time, with social media packed with viral videos of wild animals roaming the empty streets of our metropolises without a care in the world. It could be imagination, but somehow even the trees and bushes seem more green and luscious at this time.

So while governments take their first steps back towards ‘normality’, it’s vital that, as a race, we don’t. This is a pivotal moment in our history, when the world is on pause, that we can think about what kind of future we want for our grandchildren, instead of being completely at the mercy of business, blindly bashing on, maximizing profit at whatever the cost. As William Beveridge proclaimed back in 1942 “A revolutionary moment in the world’s history is a time for revolutions, not for patching.’

Liked it? Take a second to support The Duran on Patreon!

Read Later Add to Favourites Add to Collection Report",17.5,Low,Extreme right,Cyprus
