news_id,url,publisher,publish_date,author,title,image,body_text,news_guard_score,mbfc_level,political_bias
0,https://www.rt.com/op-ed/489553-stockholm-coronavirus-outbreak-biased-media/,RT News,2020-05-23,[],Biased mainstream media again misuses science to paint sensible Sweden as reckless gamblers - here is why they are wrong,https://cdni.rt.com/files/2020.05/article/5ec8d0ed85f540183c11cbe4.jpg,"By Peter Andrews , Irish science journalist and writer based in London. He has a background in the life sciences, and graduated from the University of Glasgow with a degree in genetics

Sweden has found that just 7.3 percent of Stockholmers have antibodies for coronavirus, despite the country’s laissez-faire handling of the outbreak. The mainstream media think this proves them right. It doesn’t.

Just last week, I criticized a piece of reportage in the Guardian, that grand old publication, for its remedial understanding of coronavirus. They are at it again, this time holding up an antibody study as evidence that Sweden, a land of dangerous wrong-think, is killing people with its coronavirus policy.

First, let us deal with the study itself. It reported that, based on antibody tests – which are supposed to detect people who have had and cleared the coronavirus – far fewer Stockholmers had had the virus than thought, which would mean that Sweden has a long way to go to reach herd immunity. But the thing about antibody tests is that they are utterly unreliable.

Also on rt.com Shameful treatment of the elderly is further proof Sweden got its Covid-19 strategy all wrong

There is no way to know what proportion of infected people generate antibodies. And even if they all do, we don’t know how accurate the tests are in detecting them. Therefore, as Professor Sunetra Gupta of the University Oxford confirmed on Thursday, the figure that comes out of an antibody test is a lower bound of the proportion of people who have been infected. A more honest reporting of the data would have read “At least 7.3 percent of Stockholm had Covid-19 antibodies by the end of April.”

Sweden turns heel

In order to turn on their usual social democratic idols Sweden, the Guardian has had to spin harder than a hamster on a wheel. They have decided to find a metric on which Sweden can be made to look bad, and they have chosen to compare its deaths per million to the other Nordic countries. Deaths per million is a laughably crude metric that takes no confounding factors into account – least of all the wildly different reporting countries use for Covid deaths. At the bottom of the Guardian’s graph is a disclaimer reading: “Note: counting methods vary by country.”

Sweden does score higher than Denmark, Norway and Finland on that particular metric, due in large part to their failure to keep the virus out of nursing homes. But in order to ascribe this difference to Sweden’s decision not to shut down their economy, the Guardian must establish that France, the UK, and above all Belgium – well above Sweden in deaths per million – have been even more laissez-faire than Sweden regarding the virus. But of course this is impossible.

Also on rt.com ‘Swedish model’ of no-lockdown response to Covid-19 ‘WORKED REGARDLESS OF EXCESSIVE DEATHS,’ its architect says

They appear to have found a Swedish Guardian reader, one Bjorn Olsen of Uppsala University. Olsen, taking the 7.3 percent antibody result at face value, and being a man of some education, has calculated that this is rather far away from the 50 or 60 percent required for herd immunity. “I think herd immunity is a long way off,” tooted the professor of infectious medicine.

But Sweden is not aiming for herd immunity, as their state epidemiologist Anders Tegnell keeps telling people. They are simply ensuring that hospitals do not become overwhelmed, rather than being scared of the second wave. You know, as was the point all along. When, by the way, did that go out the window? Wasn’t all of this done on the pretext of not inundating hospitals with too many patients at once?

Less rationalism, please

I’ll give them this: the Guardian has a knack of unearthing quirky opinions. Another of their popular Sweden articles, which almost has to be read to be believed, is by Tae Hoon Kim, a South Korean based in Stockholm. Kim moans that he is “worried” and “not reassured” by the Swedish government’s virus-wrangling.

Kim also thinks that Sweden’s “tendency to regard coronavirus just as a serious public health problem… something that requires the careful observance of rules set out by health experts” has got them into trouble. Instead, he prefers to think of the loop of RNA as “an ‘invisible enemy’… an existential problem that calls for the state to suspend civil liberties.”

Also on rt.com Why is the MSM working overtime to try to show that Covid-19 is dangerous to CHILDREN - when so few of them have died?

Perhaps Kim would feel more comfortable in, er, I don’t know, South Korea? There, the government would know his exact whereabouts at all times via a compulsory app on his phone, and he would have to tell them the nature of his business everywhere he went. But what do I know? Maybe Kim is right, and we do need more woo-woo philosophizing and op-ed psychobabble. Perhaps a few more celebrity renditions of Kumbaya? As long as we’re spitballing…

Swedes 1, Turnips 0

It is remarkable that even in a year with no Eurovision, Sweden has managed to make such a splash in the Western media. It is fascinating to watch them tie themselves in knots as they try to reconcile their image of Sweden as a progressive paradise with their new notion of a Scandinavian banana republic running a callous Darwinian experiment in which the old are sacrificed for the empty pleasures of the young.

Oh, how the MSM would have loved it if the one country to deviate from conventional wisdom had been Hungary, or the Philippines, or best of all, Russia. How much easier the smear job would have been had it been some poor, backward Latin American or Asian country, or anywhere run by a “literally Hitler” strongman-type politician. But they had no such luck; sensible, freethinking Sweden had to go and deviate from the party line.

No matter how much the MSM bury their heads in the sand, Sweden is running the safest, most responsible reaction to the outbreak in a world gone mad. The real experimenters are the lockdown evangelists. They are the ones playing with people’s lives, and it is high time they accepted that responsibility.

Think your friends would be interested? Share this story!",32.5,Very low,Right-center
1,https://www.rt.com/news/489547-china-zero-new-cases-coronavirus/,RT News,2020-05-23,[],China reports zero new Covid-19 cases for FIRST TIME as pandemic finds new ‘epicenter’ in South America,https://cdni.rt.com/files/2020.05/article/5ec8a12c85f5401daf63c5cf.JPG,"Beijing has reported no new Covid-19 infections for the first time since the pandemic erupted last year, but as the virus dies out in its original epicenter, South America has quickly emerged as a major hotspot.

China’s National Health Commission said it confirmed zero new cases of the virus on Saturday – a first since the country began tallying infections in January – and reported only two suspected cases, one of them imported from abroad.

Good News! Chinese mainland reports ZERO daily new #COVID19 case! 2 suspected cases reported – 1 imported case in Shanghai and 1 domestic in NE#China's Jilin. pic.twitter.com/6SElh7UxUX — Global Times (@globaltimesnews) May 23, 2020

The lethal illness first emerged late last year in the Chinese city of Wuhan, spreading across the country to infect some 84,000 people, killing in excess of 4,600. But with aggressive containment measures that put tens of millions of citizens under strict lockdown, Beijing appears to have largely brought the contagion under control, reporting a only slow trickle of new cases as the virus took hold elsewhere in the world.

While the United States remains the top epicenter with more than 1.6 million infections, South America has quickly overtaken other regions for the number-two spot, with the World Health Organization (WHO) warning of a dramatic spike in cases there.

“In a sense, South America has become a new epicenter for the disease,” Dr Mike Ryan, the WHO's top emergencies expert, told a press conference on Friday, noting that Brazil is “clearly the most affected.”

Also on rt.com ‘Still long way to go’: WHO records BIGGEST single-day increase in new Covid-19 cases

Over the last week in Brazil, health officials have reported tens of thousands of new infections each day, bringing its current disease toll to more than 330,000, rapidly eclipsing Russia as the second-worst-affected nation. Brazil has also counted more than 21,000 fatal cases, nearly seven times more than Peru, the region’s next hardest-hit country.

Though no vaccine, or even a reliable treatment, currently exists for the coronavirus, Brazilian authorities have approved widespread use of the anti-malarial drug hydroxychloroquine as a therapy, after receiving shipments of raw materials for the chemical from India last month. The drug has shown early promise as a treatment, but its effectiveness has yet to be proven in a clinical setting. A new study in the Lancet journal, meanwhile, suggests the medicine could cause heart complications and even death, showing little or no benefit to Covid-19 patients.

Since the pandemic broke out last December, more than 5.2 million people have been sickened and some 338,000 killed worldwide, making it one of the deadliest viral outbreaks since the 1918 Spanish Flu.

Also on rt.com Bolsonaro says experimental Covid-19 drug could save 'thousands of lives' & thanks India for approving exports of raw ingredients

Like this story? Share it with a friend!",32.5,Very low,Right-center
2,https://www.rt.com/op-ed/489356-coronavirus-divided-society-surprising-ways/,RT News,2020-05-21,['Simon Rite'],"The 5 tribes of coronavirus: Society has divided up in surprising, and not so surprising ways",https://cdni.rt.com/files/2020.05/article/5ec68bff85f54006321a3a25.jpg,"is a writer based in London for RT, in charge of several projects including the political satire group #ICYMI. Follow him on Twitter @SiWrites

is a writer based in London for RT, in charge of several projects including the political satire group #ICYMI. Follow him on Twitter @SiWrites

Times of crisis bring people together under a common cause – says the propaganda of the blind optimist. What we’ve actually seen during the coronavirus pandemic is society divide into different tribes; here are five of them.

The Remain-at-Homers

This group will not leave their homes no matter what, as a matter of principle. By pure coincidence they also tend to have the biggest houses and largest gardens, and jobs they can do comfortably from their well-equipped studies. It’s not self-discipline getting them through lockdown, but pure smugness – which you can see on their face when they gleefully tell you, via Zoom, how long it’s been since they left the house in much the same manner a veteran might describe landing on Omaha Beach or defending Stalingrad.

Also on rt.com Cambridge University's degree of separation: The ‘new normal’ is an abnormal world where we never learn to socialise

The Anti-Lockdowners

This lot can be heard saying things like, “it’s just a nasty cold,” or “grandad was going to die anyway.” However they justify it, they’re just not interested in being forced to stay at home. You’ll see them angrily protesting for their right to get a beer and a haircut... or perhaps you’ll see them in the hospital on a ventilator recovering from a nasty cold.

The Hypocrites

Read more

The Hypocrites are a strange mix of Remain-at-Homer and Anti-Lockdowner. These virtue signallers will keep up the smug facade of those who are following all the rules by staying at home to watch Netflix. However, don’t be fooled because they’re also going shopping for essential supplies three times a day and exercising twice a day, despite the fact that they hadn’t even run for a bus in two decades before all this started. Yep, they spend more time outside than they used to!

The Snitches

And then there are the Snitches. These are your neighbours who spend the whole day longingly staring out the window dreaming of freedom, but as soon as they see you walk out the front door to buy bread and booze, they call the police to get you properly locked down. Solidarity has its limits.

The Conspiracists

These are the people who think Covid-19 is a Bill Gates plan to force you to buy Windows 27. Or that the government is just trying to wipe out pensioners. Or that 5G is downloading the virus straight into your brain in an impressive two seconds as long as your cell plan is up to date. Whatever the theory, as long as there is no proof, they’ll tell you all about it. Via Zoom.

If you like this story, share it with a friend!",32.5,Very low,Right-center
3,https://www.rt.com/uk/489510-scientist-criticizes-government-coronavirus-handling/,RT News,2020-05-22,[],"‘We have lions on the front line, we need lions in leadership’: Nobel Prize-winning scientist SLAMS UK govt response to Covid-19",https://cdni.rt.com/files/2020.05/article/5ec7f61785f54036cd699a3c.JPG,"Top scientist Sir Paul Nurse has blasted the UK government for lacking proper leadership over the Covid-19 outbreak, saying Westminster has been “increasingly playing catch-up” and “firefighting” its way through successive crises.

In an interview with BBC Radio 4 on Friday, Nurse claimed that he believed that the UK government has not responded effectively to the outbreak of Covid-19.

Nurse - who won a Nobel Prize for Physiology or Medicine in 2001 – even asked who's really in charge of handling the pandemic, before adding he's uncertain that the British leaders themselves know the answer to that question.

“Who is developing the strategy and the operation and implementation of that strategy?” he asked. “I don't know, but more importantly, do they know?”

Also on rt.com ‘Cabinet of incompetents’: UK govt on course to miss ANOTHER Covid-19 target with only 1,500 contact tracers hired



The scientist was particularly critical of Boris Johnson's administration for abandoning mass testing at an early stage of the outbreak, which meant that hospitals became “potentially unsafe spaces” as many asymptomatic staff and patients would have been infectious without knowing it. He did, however, praise frontline workers, comparing their bravery to that of “lions”.

Northern Ireland Secretary Brandon Lewis responded to Nurse's criticism in the same radio show, arguing that the government has been “very transparent” with people and insisting that they've been following “the best scientific advice out there” about tackling coronavirus.

PM Johnson has been heavily criticized by scientists and the opposition since the start of the pandemic for drastic PPE shortages across the NHS, as well as a lack of mass testing during the early stages, although the government maintains that it acted assuming a probable worst case scenario.

Also on rt.com It is ‘not safe’ for England’s schools to reopen on June 1, former UK chief scientific adviser’s group warns

The UK is currently the worst hit country in Europe by the pandemic, with 36,393 deaths and over 254,000 confirmed coronavirus infections.

Think your friends would be interested? Share this story!",32.5,Very low,Right-center
4,https://www.rt.com/uk/489380-northern-ireland-nhs-app-coronavirus/,RT News,2020-05-21,[],"N. Ireland won’t use UK’s contact-tracing app, will use own version to ‘interact’ with Republic of Ireland’s one, minister says",https://cdni.rt.com/files/2020.05/article/5ec6b0c785f540061e0137db.JPG,"The health minister for Northern Ireland has said the NHS Covid-19 tracing app is “not compulsory” to download, urging people to wait for a separate app being developed to work in conjunction with the Republic of Ireland’s one.

Speaking to the Northern Ireland Assembly's Committee for Health, Robin Swann said that, since NI is part of the UK, residents will have access to the NHS app “whether we want it or not.”

He did not suggest downloading it, however, as a “Northern Ireland version” is being created which “can interact with” with the Republic’s one.

Northern Ireland is the only one of the UK’s devolved administrations to create its own app, since both apps on the island of Ireland will need to work in conjunction with one another. Swann said there had already been some “difficulties” and “uncertainties” with the NHS app, which is intended to alert users if they have been in contact with a person who tested positive for the virus.

Also on rt.com Contact-tracing app will be ‘key part’ of UK government’s Covid-19 ‘surveillance programme’ – Johnson spokesman

Dublin has opted for a “less intrusive” decentralized model for the app, which sees user data stored on devices rather than sent to central databases run by authorities, as is the case with the NHS app.

NI’s Deputy First Minister Michelle O'Neill said officials from there and the Republic had met already to discuss using an all-island system. She said she had concerns around the centralized model from a “human rights point of view.”

The UK app has been beset with problems and concerns around privacy due to its centralized structure. While officials initially touted it as a “key part” of its tracing strategy, they have shifted the focus back onto manual tracing in recent days, as reports of issues with the app spread.

It also looks as though the NHS app may miss its target launch date of June 1, as it is still currently in test mode.

Also on rt.com Useless & invasive? UK’s Covid-19 contact tracing app gets bad reviews after reportedly failing all performance tests

Like this story? Share it with a friend!",32.5,Very low,Right-center
5,https://www.rt.com/sport/489562-nba-legend-patrick-ewing-coronavirus/,RT News,2020-05-23,[],NBA legend Patrick Ewing in hospital after testing positive for Covid-19,https://cdni.rt.com/files/2020.05/article/5ec8fd8920302707a401e96d.JPG,"Basketball icon Patrick Ewing, 57, has revealed he has tested positive for the coronavirus, urging fans ""not to take the virus lightly"" as he received treatment in hospital.

The current head coach of Georgetown University men’s team sent out a statement on Twitter that revealed his result alongside a message that read:

“I want to share that I have tested positive for COVID-19. This virus is serious and should not be taken lightly. I want to encourage everyone to stay safe and take care of yourselves and your loved ones.”

I want to share that I have tested positive for COVID-19. This virus is serious and should not be taken lightly. I want to encourage everyone to stay safe and take care of yourselves and your loved ones. pic.twitter.com/a2fMuhIZyG — Patrick Ewing (@CoachEwing33) May 22, 2020

An 11-time NBA All-star, Ewing decided to share the news to show that the virus could affect anyone, regardless of wealth or status.

He immediately began to receive messages of support from the basketball world.

I went to war with you for ten years. I won’t leave you on the battlefield now. Get well Patrick. More fights ahead. @CoachEwing33#BrothersFight#PatrickEwing#GetWellBrotherpic.twitter.com/1ZkR03bccc — Charles Oakley (@CharlesOakley34) May 23, 2020

Was such a thrill when we had Patrick Ewing on #TheJump a couple weeks ago - now he's in the hospital with COVID. This virus moves quickly and mercilessly. Please be safe out there, everyone. pic.twitter.com/BPVUhGlrU6 — Rachel Nichols (@Rachel__Nichols) May 22, 2020

Officially one of the NBA’s 50 greatest players of all time, Ewing spent the majority of his 17-year playing career at the New York Knicks, before a spell at Seattle Sounders and Orlando Magic. He has been Georgetown’s Head Coach since 2017.

The statement from Georgetown also revealed that Ewing is currently receiving care while isolated at a local hospital and that no other members of staff or players tested positive.",32.5,Very low,Right-center
6,https://www.rt.com/usa/489548-elderly-beating-nursing-home-coronavirus/,RT News,2020-05-23,[],‘Someone dropped the ball’: Suspect in beating of 75yo nursing home patient was moved to facility AFTER contracting Covid-19,https://cdni.rt.com/files/2020.05/article/5ec8b4ac85f540189834f9cd.JPG,"The 20-year-old man accused of beating an elderly patient in a Detroit nursing home – captured in a shocking viral video – was inexplicably moved to the facility after testing positive for Covid-19.

The young man, who has not been named, was transferred from an Ann Arbor hospital to Detroit’s Westwood Nursing Center last week after contracting the coronavirus, his father told local media. He later appeared in disturbing footage repeatedly punching an elderly man in the face. While the suspect has since been arrested for the assault, it remains unclear how or why he ended up at the nursing home in the first place, given that seniors are among the most vulnerable to the lethal illness.

“He never should have been housed – quarantined – with the victim that he eventually assaulted. That should have never happened,” the man’s father said, adding: “Someone dropped the ball.”

He has [mental] issues and for them to put him in a facility like that, nothing good was going to happen.

Prior to the attack that was captured on video – apparently filmed by the assailant himself – the suspect already faced charges in nearby Washtenaw County, where he is accused of assaulting a staff member at another facility. While acknowledging his son’s severe behavioral and mental problems, the father said he “never would have consented” to sending him to a nursing home had he been informed of it. It is still unknown who made the decision to transfer him there.

Also on rt.com ‘Can this be for real?’ Trump weighs in on SHOCKING VIDEO of 75yo being brutally beaten in Detroit nursing home

Some mystery also surrounds the 75-year-old victim of the nursing home assault. Relatives told local press that they began to worry when they were unable to reach him by phone, explaining that, for reasons that are still unclear, he was taken from his Detroit apartment and brought to the Westwood center. The man is now recovering from his injuries at a nearby hospital.

The incident has sparked widespread outrage, even drawing the attention of US President Donald Trump. The backlash has only been intensified with the latest revelation, prompting a flood of criticism and questions from critics online.

Gosh, it gets worse. The Michigan beating suspect was moved to a nursing home because he was diagnosed with COVID-19, says his father. Suspect also had a pending assault case. The elderly male victim is an Army veteran. cc: ⁦@GovWhitmer⁩ https://t.co/73BWavqS7Z — Andy Ngô (@MrAndyNgo) May 23, 2020

It's so heartbreaking to see the videos of the guy beating an elderly man at a nursing home in Detroit. Elder abuse has been going on way longer than covid. Where's the vetting? Funded thru Medicare/Medicaid. Who's NOT doing their job? — JJOSS (@iamjs4) May 23, 2020

And put a violent schizophrenic in a room w/ probable dementia patient. #JadonHayden wiped the man’s streaming blood on his bedsheet. Staff ignored that & claimed to be unaware of assaults after the arrest. That’s a lie. I called them a few times. Westwood Nursing Home Detroit — Ida Ivey (@IdaIvey1) May 23, 2020

When local reporters contacted the Westwood Nursing Center on Friday, a man answering the phone – presumably a staff member – would only say the facility’s director was busy with meetings.

Think your friends would be interested? Share this story!",32.5,Very low,Right-center
