news_id,url,publisher,publish_date,author,title,image,body_text,news_guard_score,mbfc_level,political_bias
0,https://dcdirtylaundry.com/fact-coronavirus-vaccines-will-contain-aborted-human-babies/,DC Dirty Laundry,2020-05-23,['Ethan Huff'],FACT: Coronavirus vaccines will contain aborted human babies,https://dcdirtylaundry.com/wp-content/uploads/2018/10/Human_fetus_10_weeks_with_amniotic_sac_-_therapeutic_abortion1-768x578.jpg,"(Natural News) Pro-lifers everywhere had better think long and hard about what they plan to do in the event that state or local governments try to mandate vaccination for the Wuhan coronavirus (COVID-19) once a jab is commercially released because chances are those syringes will contain the remnants of aborted babies.

Even though President Trump has said that Wuhan coronavirus (COVID-19) vaccines will not be mandated at the federal level, there is still the possibility that some states may try to force them locally, which will put not just those opposed to vaccination in a tough position but also those who recognize the sanctity of unborn human life.

After it was announced recently that Canada’s largest federal research and development organization has teamed up with a Chinese vaccine company to test a new trial coronavirus vaccine in Canada, Dr. Alan Moy, M.D., founder and scientific director of the John Paul II Medical Research Institute and CEO of Cellular Engineering Technologies decided to do some digging, upon which he discovered that the test vaccine in question is made from aborted fetal cell lines.

CanSino Biologics Inc., also known as CanSinoBIO, is the name of the Chinese firm that partnered up with Canada’s National Research Council (NRC) to conduct trials on Ad5-nCoV, as it is being called, which Dr. Moy found contains a cell line known as HEK293 that was derived from unborn children that were murdered while still inside their mothers’ wombs.

take our poll - story continues below

Trump or Biden, who will win? Why wait until November 3? Show all of America who you're voting for in 2020

TRUMP or BIDEN You Decide * Donald J. Trump Joe Biden Undecided

Email *

Email This field is for validation purposes and should be left unchanged. Completing this poll grants you access to DC Dirty Laundry updates free of charge. You may opt out at anytime. You also agree to this site's Privacy Policy and Terms of Use.

“Since it’s using an adenovirus replication-defective vector, it is using HEK293,” Dr. Moy told LifeSiteNews. “HEK293 is an aborted fetal cell line.”

What’s worse, Ad5-nCoV probably won’t even work

Besides its unethical origins, the Ad5-nCoV more than likely will not even work as promised, Dr. Moy warns. As it turns out, there is a high incidence of immunity against Ad5, so most of the people who are injected with it will confer no protection whatsoever against the Wuhan coronavirus (COVID-19).

“I don’t envy Canadians,” Dr. Moy is further quoted as saying. “Your government and PM (prime minister) have mandated draconian policies that are anti-life … Not a good vaccine solution if pro-life or pro-choice.”

What is further confounding is the fact that Canada would even agree to contract with a vaccine company based out of China, which is where this whole crisis originated. Ad5-nCoV was reportedly also co-developed by the Beijing Institute of Biotechnology which, like all other Chinese institutions, is governed and controlled by the Chinese Communist Party (CCP).

This vaccine is said to be the first “phase 2” coronavirus vaccine, meaning it has been approved to be “safely” used in human test subjects. And the Canadian government could not be more excited about the prospect of injecting as many Canadians as possible with it to “cure” them of the Wuhan coronavirus (COVID-19).

“NRC is proud of our ongoing partnership with CanSino Biologics,” stated NRC President Iain Stewart in a recent press release.

Dr. Xuefeng Yu, chairman and CEO of CanSinoBIO, also stated in the same press release that his company has “strong connections to Canada” and is “proud to be building on past successes and continuing our ongoing partnership with the NRC to address health needs on a global scale.”

Amazingly, both the NRC and CanSinoBIO are proud of their proprietary HEK293 aborted baby cell line, which they say will help “to advance a scale-up production process for the vaccine candidate.” In other words, thanks to these aborted babies, Canada and China will be able to produce Wuhan coronavirus (COVID-19) vaccines for mass distribution much faster than normal, paving the way for a global vaccination campaign unlike anything the world has ever seen.

More of the latest news about the Wuhan coronavirus (COVID-19) is available at Pandemic.news.

Sources for this article include:

LifeSiteNews.com

NaturalNews.com

NaturalNews.com

Abortion",12.5,Very low,
1,https://dcdirtylaundry.com/oklahoma-after-state-killed-275000-jobs-over-covid-19-sheriff-now-evicting-residents-who-cant-pay/,DC Dirty Laundry,2020-05-23,['Matt Agorist'],"Oklahoma: After State Killed 275,000 Jobs Over COVID-19, Sheriff Now Evicting Residents Who Can’t Pay",https://dcdirtylaundry.com/wp-content/uploads/2020/05/eviction-660x330-1.jpg,"Oklahoma City, OK — Since March, unemployment across the country has reached record and potentially catastrophic numbers. In the entire country, a record 38.6 million Americans have filed for unemployment during the pandemic. That corresponds to nearly 25% of the entire United States labor force. While many of these folks are receiving unemployment from state and federal government, many others are not.

Millions of Americans — who watched states close non-essential businesses, subsequently crushing their careers — cannot even access unemployment benefits, according to the Economic Policy Institute. While some of these problems have been remedied, for others, collecting unemployment insurance was never an option.

Business owners who were unable to obtain an SBC loan or other forms of COVID-19 government subsistence have been frantically fighting to reopen their business as they watched their life savings go up in flames. The Free Thought Project has reported on multiple instances in which people unable to obtain government support have tried to reopen their businesses to support themselves, only to leave them in handcuffs. It’s a catch-22.

Of those millions of jobless claims in the United States, over a quarter-million of them were in the state of Oklahoma. With a population just under 4 million, 275,000 unemployed residents are massive. While some of these folks have likely sought out and found jobs to support themselves and their families, others have likely endured conditions that may have prevented them from doing so.

take our poll - story continues below

Trump or Biden, who will win? Why wait until November 3? Show all of America who you're voting for in 2020

TRUMP or BIDEN You Decide * Donald J. Trump Joe Biden Undecided

Email *

Name This field is for validation purposes and should be left unchanged. Completing this poll grants you access to DC Dirty Laundry updates free of charge. You may opt out at anytime. You also agree to this site's Privacy Policy and Terms of Use.

As a result of the state shutting down the economy, these unemployed residents of the state have been unable to pay their bills, including their rent and house notes. Now, in spite of the fact that this record spike in unemployment was a function of the state’s COVID-19 measures, Oklahoma is taking action in the form of evictions.

On their Facebook page this week, the Oklahoma County Sheriff’s Office announced that they will begin physically evicting residents unable to pay their bills. It reads as follows:

EVICTION NOTICE UPDATE We know that this will be difficult, but want to give as much notice as possible regarding OCSO deputies serving eviction notices. Deputies will start serving judicial eviction orders this week, and enforcing evictions on May 26, 2020. We understand how tough times are currently for many as a result of the health crisis the past few months, but we must enforce orders issued by the courts. Once the order is served tenants have 48-hours to leave the premises of the residence they are renting/leasing. Please, if you are set for an eviction hearing, attend. Make your case to the judge, the only person who can determine your case. Civil process, and our issuing evictions is mandated by state law: https://www.oscn.net/applications/oscn/DeliverDocument.asp… We will be compassionate, and respectful during scheduled evictions. We are hopeful that everyone issued an eviction will be able to make living arrangements.

Now, as the inevitable effects of the government’s shutdown order crash the economy and force people to choose between eating and paying their rent, that same government is going to start kicking them out of their homes.

See how that works?

As banks and other large corporations across the country receive hundreds of billions in Federal money — ensuring a lifetime of debt for future generations — Joe Sixpack on Main Street, USA is told to kick rocks.

RELATED: The Homosexual Rights Movement and Child Sexual Abuse

No one here is advocating for people to be able to squat and exploit this situation to get out of paying their house note or rent. However, that is not the case here. While grocery stores and fast-food restaurants are hiring, other businesses are told they must operate at 25% capacity or remain closed entirely. This is hardly sustainable when it comes to maintaining a decent workforce with substantial pay.

Unfortunately, this is likely the beginning of an economic snowball that will continue to grow as the next few months roll on. As TFTP has predicted from the beginning, the shutdown of the economy will have lasting consequences, unprecedented in nature, and that will be here for a long time. As this case in Oklahoma and countless other ones illustrate, the government’s promise of “safety” almost always ends in human suffering.

Article posted with permission from Matt Agorist

h.t TWS

Oklahoma",12.5,Very low,
2,https://dcdirtylaundry.com/bill-gates-backed-coronavirus-testing-program-shut-down-by-the-fda/,DC Dirty Laundry,2020-05-21,['John Vibes'],BILL GATES-BACKED CORONAVIRUS TESTING PROGRAM SHUT DOWN BY THE FDA,https://dcdirtylaundry.com/wp-content/uploads/2020/05/My-Post-46.jpg,"The Bill Gates-backed at-home coronavirus testing program has been halted by the US Food and Drug Administration (FDA) because it began operation without getting proper authorization, according to the New York Times. The agency noted that they do not have any specific safety concerns about the product, but said that they still needed to do some research to ensure that the tests were safe.

The program in question is known as the Seattle Coronavirus Assessment Network (SCAN) and they are now being asked to put their operation on hold until proper authorization is obtained. This also means that patients who have already sent in their tests will not be able to receive their results until the authorization has been given. SCAN is promising that this shut down is only temporary.

SCAN’s website stated that, “The FDA has not raised any concerns regarding the safety and accuracy of SCAN’s test, but we have been asked to pause testing until we receive that additional authorization.”

SCAN was sending out free test kits to potential patients, including people who were asymptomatic, hoping to obtain some data on how the coronavirus spreads through people who don’t show symptoms.

take our poll - story continues below Trump or Biden, who will win? Why wait until November 3? Show all of America who you're voting for in 2020

TRUMP or BIDEN You Decide * Donald J. Trump Joe Biden Undecided

Email *

Comments This field is for validation purposes and should be left unchanged. Completing this poll grants you access to DC Dirty Laundry updates free of charge. You may opt out at anytime. You also agree to this site's Privacy Policy and Terms of Use. In a statement announcing the finer details of the program last week, Gates said that, “As SCAN gathers more test results in the weeks ahead, researchers expect the new data to provide a better sense of the number of infections and serve as one source to help answer other questions, like when physical distancing measures can be relaxed.”

However, an FDA shut down order came within days of the announcement, and the details behind the order are still unclear. The United States has been slow to get started with mass testing, especially of asymptomatic individuals, and the tests are mostly controlled by government agencies like the CDC. The tests currently available have also been criticized for being inaccurate. Just last week, the FDA issued a warning about tests made by Abbott Laboratories, saying that they often gave falsely negative results.

John Vibes is an author and journalist who takes a special interest in the counter culture, and focuses solutions-oriented approaches to social problems. He is also a host of The Free Your Mind Conference and The Free Thought Project Podcast.

Bill Gates",12.5,Very low,
3,https://dcdirtylaundry.com/tennessee-hospital-got-121000-in-covid-19-relief-even-though-its-been-closed-for-a-year-owes-1-2-million-in-unpaid-federal-taxes/,DC Dirty Laundry,2020-05-21,['Tim Brown'],"Tennessee: Hospital Got $121,000 In COVID-19 Relief Even Though It’s Been Closed For A Year & Owes $1.2 Million In Unpaid Federal Taxes",https://dcdirtylaundry.com/wp-content/uploads/2020/05/Tennessee-Hospital-Got-121000-In-COVID-19-Relief-Even-Though-It’s-Been-Closed-For-A-Year.jpg,"This is just more evidence that the federal government is not to be charitable with our money and we never authorized such disbursements of our money by the government such as was doled out in the recent stimulus. A hospital in Tennessee that has been closed for nearly a year received $121,000 in COVID-19 relief money from the people of the US, and that unconstitutionally, while still owing $1.2 million in federal income taxes.

According to the Department of Health and Human Services, something else not authorized in the Constitution, the Rennova-owned Jamestown Regional Medical Center, which has been closed since June 13, 2019, received $121,722 in federal relief money from the unconstitutional coronavirus stimulus passed by Congress and signed by President Trump.

WTSP reports:

It’s not fair for them to direct money to a hospital that has currently no real ability to re-open and provide adequate and safe patient care,” former Jamestown nurse Miah Elmore said.

take our poll - story continues below

Trump or Biden, who will win? Why wait until November 3? Show all of America who you're voting for in 2020

TRUMP or BIDEN You Decide * Donald J. Trump Joe Biden Undecided

Email *

Name This field is for validation purposes and should be left unchanged. Completing this poll grants you access to DC Dirty Laundry updates free of charge. You may opt out at anytime. You also agree to this site's Privacy Policy and Terms of Use.

As the Rennova-owned hospital cashes taxpayer dollars, WBIR found it owes more than $1.2 million in unpaid federal taxes.

“It’s disgusting in a way,” former Jamestown nurse Karen Cooper said. “There are hospitals and things that are seeing the COVID patients that could’ve utilized that money.”

Cooper is part of a class-action lawsuit alleging Rennova did not pay Social Security or federal payroll taxes withheld from employee’s paychecks.

Rennova appears to be in deep financial trouble at the other two hospitals it runs, the Big South Fork Medical Center in Oneida and the Jellico Community hospital in Campbell County.

It is behind on federal taxes for both locations, with records indicating IRS liens of more than $4.4 million.

Despite the back taxes, Rennova said in financial filings last week the federal government gave it $7.4 million in taxpayer money through the coronavirus relief fund.

Did you get that?

The federal government unconstitutionally gave the corporation owning these hospitals $7.4 million of your money while they owed more than half of that in taxes!

Talk about crony capitalism!

It’s even worse than that.

The corporation also received another $2.3 million in payroll protection loans.

“While the Company currently believes that its use of the loan proceeds will meet the conditions for forgiveness of the loans, we cannot assure you that we will not take actions that could cause the Company to be ineligible for forgiveness of the loans, in whole or in part,” Rennova said in a financial filing.

Can you believe that?

More than a week ago, HHS stated that it would “force repayment” of stimulus funds from closed institutions, but the real question is, why were they sent the funds in the first place if the hospital was closed?

Is anyone going to be held responsible, and I’m not necessarily talking about the hospital? I’m talking about the politicians that passed the unlawful legislation and the president that signed it?

Nope, cause everyone is just ok with thugs and thieves taking their money and spending it on things they never authorized them to spend it on.

This is not how you make American great.

It’s just another way that God is judging our country (Deuteronomy 28).

Article posted with permission from Sons Of Liberty Media",12.5,Very low,
4,https://dcdirtylaundry.com/arkansas-almost-600-workers-test-positive-for-covid-19-at-another-tyson-plant/,DC Dirty Laundry,2020-05-21,['Dino Porrazzo'],Arkansas: Almost 600 Workers Test Positive For Covid-19 At Another Tyson Plant,https://dcdirtylaundry.com/wp-content/uploads/2020/05/tyson.jpg,"SPRINGDALE, Ark. – (RELEASE) – Tyson Foods, Inc. announced today the results of facility-wide testing for COVID-19 at its Wilkesboro, North Carolina poultry facility.

Of the 2,244 team members and contractors who work at the facility and were tested, 570 tested positive, the majority of whom did not show any symptoms and otherwise would not have been identified. The total comprises 237 individuals who were tested by the Department of Health or when seeking care through their own health care providers and an additional 2,007 individuals who were tested onsite from May 6 to May 9. Team members who test positive receive paid leave and may return to work only when they have met the criteria established by both the CDC and Tyson.

The Wilkesboro facility is among an initial group of more than 30 production facilities in the United States where Tyson is rolling out advanced testing capabilities and enhanced care options on-site to team members in partnership with MATRIX MEDICAL, a leading medical clinical services company, and other partners. The company is prioritizing communities with a higher prevalence of COVID-19 and will assess additional needs based on significant risk factors and access to testing.

As it is doing at the Wilkesboro facility, Tyson will disclose verified test results at other plants to health and government officials, team members and stakeholders as part of its efforts to help affected communities where it operates better understand the coronavirus and the protective measures that can be taken to help prevent its spread.

take our poll - story continues below

Trump or Biden, who will win? Why wait until November 3? Show all of America who you're voting for in 2020

TRUMP or BIDEN You Decide * Donald J. Trump Joe Biden Undecided

Email *

Comments This field is for validation purposes and should be left unchanged. Completing this poll grants you access to DC Dirty Laundry updates free of charge. You may opt out at anytime. You also agree to this site's Privacy Policy and Terms of Use.

“We are working closely with local health departments to protect our team members and their families, and to help manage the spread of the virus in our communities,” said Tom Brower, Senior Vice President of Health and Safety for Tyson Foods. “We are using the most up-to-date data and resources to support our team members, and we are committed to ensuring they feel safe and secure when they come to work.”

Team members at Tyson’s Wilkesboro facility have access to daily clinical symptom screenings, nurse practitioners and enhanced education. AXIOM MEDICAL, a health care case management provider, will also track the symptoms of team members who test positive and provide additional care. Production has begun to ramp up at the facility, where operations were limited on May 14 to carry out additional deep cleaning.

Tyson has also put in place a host of protective steps that meet or exceed CDC and OSHA guidance for preventing COVID-19. These include symptom screenings for all team members before every shift, providing mandatory protective face masks to all team members, as well as a range of social distancing measures including physical barriers between workstations and in break rooms.

“Our team members are essential to helping to feed the nation, and their health and safety is always our first priority,” said Kevin Taylor, Complex Manager for Wilkesboro facility. “Disclosing our testing results will help better protect our team members and help provide the wider Wilkesboro community with the information it needs to stop the spread of the virus.”

Tyson Foods has increased short-term disability coverage to 90% of normal pay until June 30 to encourage team members to stay home when they are sick. The company also has doubled its “thank you” bonus for its frontline workers. Team members who cannot come to work because of illness or childcare issues related to COVID-19 will continue to qualify.

SOURCE- BREAKING911

Scroll down to leave a comment!

Join us at SPREELY if you want REAL NEWS without the leftist censorship!

Also join us at MUMBLIT!

DINO PORRAZZO at Right Wing Tribune

Join me on Twitter!

God Bless.

Coronavirus/Covid-19",12.5,Very low,
