news_id,url,publisher,publish_date,author,title,image,body_text,news_guard_score,mbfc_level,political_bias,country,reliability
0,https://humansarefree.com/2020/05/600-doctors-warn-trump-lockdown-deadlier-than-coronavirus.html,Humans Are Free,2020-05-06,[],600 Doctors Warn Trump: Lockdown Deadlier Than Coronavirus,https://humansarefree.com/wp-content/uploads/2020/05/600-Doctors-Warn-Trump-Lockdown-May-Be-More-Deadly-Than-Coronavirus-e1590141457597.jpg,"Hundreds of doctors have sent a letter to President Trump warning that the nationwide lockdown is killing thousands of Americans.

It may end up more deadly even than the coronavirus it is intended to defeat. Doctors understand that you don’t kill the patient to save the patient.

Also, homeschool moms in Lake Jackson, TX, defy officials and take their kids to the park.

City workers call the cops – but in a twist, the moms know their Constitution and end up schooling both the cops and city officials.

Reference: YouTube Liberty Report",5,Low,,USA,0
1,https://humansarefree.com/2020/05/bill-gates-10-million-bribe-nigerian-children-vaccine-experiments.html,Humans Are Free,2020-05-23,[],Bill Gates Reportedly Offered a $10 Million Bribe to Use Nigerian Children in Coronavirus Vaccine Experiments,https://humansarefree.com/wp-content/uploads/2020/05/Bill-Gates-Reportedly-Offered-a-10-Million-Bribe-to-Use-Nigerian-Children-in-Coronavirus-Vaccine-Experiments-e1590139575318.jpg,"The left’s most beloved “humanitarian” has been caught in yet another human rights scandal, this time involving innocent Nigerian children who were to be used as human guinea pigs in one of his forced vaccination programs.

We are talking about billionaire eugenicist Bill Gates, of course, who reportedly offered a $10 million bribe to the Nigerian House of Representatives in exchange for gaining access to Nigerian children whom he could experiment on with a new vaccine for the Wuhan coronavirus (COVID-19).

All the House had to do was pass a bill presented by Gates that would have mandated the vaccination of all Nigerians with an experimental Wuhan coronavirus (COVID-19) vaccine created by the Bill & Melinda Gates Foundation and its drug partners.

Thankfully, opposition political parties quickly rejected this proposed eugenics and possible genocide attempt, and even threatened the Speaker of the House with impeachment if he agreed to Gates’ bribe.

It was the Nigerian Coalition of United Political Parties (CUPP) that says it intercepted a human intelligence report detailing how the Nigerian House of Representatives was right on the verge of selling out its people when the scheme was unearthed, bringing it to a halt.

The House was not only poised to pass the Gates bill, but it was planning to do so outside the bounds of the traditional legislative process.

In other words, it was a back-door deal done under the cover of darkness to advance the vaccination dreams of Bill Gates.

Listen below to The Health Ranger Report as Mike Adams, the Health Ranger, unpacks the plan to depopulate the world, in part through mass vaccination:

Is Bill Gates Satan in the flesh?

In a statement, opposition spokesman Barrister Ikenga Imo Ugochinyere chastised the House for even considering accepting Gates’ offer, no matter the sum of money.

He further threatened to unseat Speaker Femi Gbajabiamila for his complicity in the horrific plot.

“Opposition Coalition (CUPP) has intercepted very credible intelligence and hereby alerts Nigerians of plans by the leadership of the House of Representatives led by Femi Gbajabiamila to forcefully and without adherence to the rules of lawmaking to pass the Control of Infectious Diseases Bill 2020 otherwise known as the Compulsory Vaccination Bill which is proposing a compulsory vaccination of all Nigerians even when the vaccines have not been discovered,” that statement reads.

“This intelligence is coupled with the information of the alleged receipt, from sources outside the country but very interested in the Bill, of the sum of $10 million by the sponsors and promoters of the Bill to distribute among lawmakers to ensure a smooth passage of the Bill.”

Great Game India reports that the alleged deal to secretly and illegally pass this sellout bill was hatched during a legislative trip to Austria a few months back.

The financial boost was later added to get the bill moving more quickly, and to get it passed by any means necessary.

“Nigerians are reminded that at present, there is no discovered/ approved vaccine anywhere in the world and one now begins to wonder why the hurry to pass a Bill for a compulsory vaccine when there is none,” Great Game India further adds about how a Wuhan coronavirus (COVID-19) vaccine does not even exist.

Meanwhile, Sara Cunial, a prominent Italian politician, has spoken out calling for the arrest of Bill Gates.

She says that he is a “vaccine criminal” who needs to be handed over to the International Criminal Court to be tried for his many crimes against humanity.

Cunial also played a critical role in exposing Gates’ genocidal efforts in India and other countries throughout Africa, which include plans to use vaccinations to deliver microchips into people’s bodies as part of his nefarious ID2020 program.

By Ethan Huff, Guest writer",5,Low,,USA,0
2,https://humansarefree.com/2020/05/george-soros-covid-19-plandemic-as-a-revolutionary-moment-radical-change-needed.html,Humans Are Free,2020-05-22,[],George Soros Views The COVID-19 Plandemic As A ‘Revolutionary Moment’ Where ‘Everything Is Up For Grabs’ Says Radical Change Needed,https://humansarefree.com/wp-content/uploads/2020/05/George-Soros-Views-The-COVID-19-Plandemic-As-A-‘Revolutionary-Moment’-Where-‘Everything-Is-Up-For-Grabs’-Says-Radical-Change-Needed.jpg,"George Soros referred to the coronavirus ordeal as “the crisis of my lifetime” and gave his radical views for change and progress in the wake of the pandemic.

“Even before the pandemic hit, I realized that we were in a revolutionary moment where what would be impossible or even inconceivable in normal times had become not only possible but probably absolutely necessary.”

He added, “And then came COVID-19, which has totally disrupted people’s lives and required very different behavior. It is an unprecedented event that probably has never occurred in this combination. And it really endangers the survival of our civilization.”

Earlier this month, infamous left-wing billionaire George Soros discussed how the coronavirus will shape the world in an interview with Project Syndicate’s Gregor Peter Schmitz.

George Soros is giddy and excited these days, why? Because he sees the COVID-19 “plandemic” doing amazing things to destroy the economy, to destroy capitalism, and the weaken the United States to the breaking point so his army of low-information Liberal minions can swoop in and remake it.

You can watch the PLANDEMIC documentary below:

You will always hear Liberals saying things like ‘transforming America’, ‘changing America’, but you will never hear them talking about America’s greatness because they don’t believe it is.

Soros has been quiet in 2020, but his bank accounts have not, he continues to provide over 1 billion dollars per year to support radical and anarchist Leftist groups and causes.

Black Lives Matter? That’s Soros. ANTIFA? Yep, Soros. All those races riots from a few years back? Yep, that’s Soros too.

George Soros even funded Antichrist-in-training Emmanuel Macron when he ran for president in 2017.

Did you know? America Is Under Attack By 187 Groups Funded By George Soros

You can look for him to provide all the millions necessary for the Democrats to have their ‘mail-in ballot’ election in November, and even if people go to the polls, they are voting with a Soros-financed machine.

These are happy, happy days for Globalist Schwartz György, not since he sided with the Nazis as a teenager to rob his fellow Jewish neighbors and help send them to concentration camps has he been this happy.

Watch the video below, and listen as George Soros tells how that time in his life were some of his happiest moments. Until, that is, the COVID-19 Plannedemic.

George Soros Describes COVID-19 Pandemic As ‘Revolutionary Moment’ In Which ‘Everything Is Up For Grabs’

FROM ACTIVIST MOMMY: In the May 11th interview, Soros referred to the coronavirus ordeal as “the crisis of my lifetime” and gave his radical views for change and progress in the wake of the pandemic.

“Even before the pandemic hit, I realized that we were in a revolutionary moment where what would be impossible or even inconceivable in normal times had become not only possible but probably absolutely necessary,” he said during the interview, adding,

“And then came COVID-19, which has totally disrupted people’s lives and required very different behavior. It is an unprecedented event that probably has never occurred in this combination. And it really endangers the survival of our civilization.”

He went on to say,

“We will not go back to where we were when the pandemic started. That is pretty certain. But that is the only thing that is certain. Everything else is up for grabs. I do not think anybody knows how capitalism will evolve.”

Soros also discussed the “threats” now facing the European Union. Soros is a well-known supporter of the globalist organization. He asserted that “Europe is facing several existential dangers” and that he is “particularly concerned about the survival of the EU because it is an incomplete union.”

According to the Hungarian-born billionaire, the European Union was “in the process of being created,” but that process “was never completed.”

Soros contended that the EU is “exceptionally vulnerable – more vulnerable than the US not just because it is an incomplete union but also because it is based on the rule of law.”

During the interview, the progressive philanthropist also discussed a recent conflict between Germany and the EU that involved a ruling from Germany’s highest court on May 5 that one of the EU’s Court of Justice decisions regarding policies of the European Central Bank (ECB) was not legally binding.

This resulted in the European Court of Justice asserting that it alone had jurisdiction over the ECB.

Also read: Gates, Zuckerberg, Soros, Bezos Are Destroying The U.S. Republic (In Preparation For The New World Order)

George Soros, a globalist, sided with the EU during the interview. “When Germany joined the EU, it committed itself to abide by European law,” he argued.

He expressed fears that this ruling “poses a threat that could destroy the European Union as an institution based on the rule of law” as it could lead to other countries like Poland or Hungary to try to become more independent of the EU since “the German court can question the decisions of the European Court of Justice.”

Soros asked, “Can Hungary and Poland decide whether they follow European law or their own courts – whose legitimacy the EU has questioned? That question goes to the very heart of the EU, which is built on the rule of law. Poland has immediately risen to the occasion and asserted the supremacy of its government-controlled courts over European law. In Hungary, Viktor Orbán has already used the COVID-19 emergency and a captured parliament to appoint himself dictator,” Soros claimed.

Soros claims that Orbán has positioned himself as a dictator but a new poll shows that the majority of Hungarians (54 percent) approve of the Orbán administration’s measures and would vote for him in the coming election scheduled for this year. Orbán isn’t the only world leader Soros labeled as a dictator.

In the interview he briefly talked about President Donald Trump, accusing him of wanting “to be a dictator” but going on to say that “he cannot be one because there is a constitution in the United States that people still respect.”

George Soros remained vague in discussing the “things” President Trump allegedly wants to do but said the constitution “will prevent him from doing certain things” but that it isn’t stopping Trump from trying “because he is literally fighting for his life.”

He went on to add,

“I will also say that I have put my faith in Trump to destroy himself, and he has exceeded my wildest expectations.”

It’s safe to assume that Soros has labeled Trump as an aspiring dictator simply because POTUS presents opposition for the progressive, globalist agenda that Soros heavily finances and actively advocates for.

He has $5.1 million alone invested in a super PAC that is dedicated to funding groups working against the re-election of President Trump.

George Soros also notoriously finances left-wing causes throughout the United States and around the world to the tune of $1 billion each year including abortion, euthanasia, population control, transgenderism, and same-sex “marriage.”

If there ever was an arch-nemesis for conservatives, Soros would most definitely be it. (Read more)

Source: Nowtheendbegins.com",5,Low,,USA,0
3,https://humansarefree.com/2020/05/who-admits-vaccines-dont-work-against-coronavirus.html,Humans Are Free,2020-05-22,[],WHO Inadvertently Admits That Vaccines Won’t Work Against Coronavirus,https://humansarefree.com/wp-content/uploads/2020/05/WHO-Inadvertently-Admits-That-Vaccines-Won’t-Work-Against-Coronavirus-e1590083360376.jpg,"In trying to keep the pandemic going for as long as possible, it would seem, the World Health Organization (WHO) is insistent that developing natural immunity to the Wuhan coronavirus (COVID-19) may not be possible, and that society’s only hope is a vaccine.

But if natural immunity is out of the question, then why would vaccine-induced immunity be any better?

With roughly 310,000 confirmed deaths worldwide, the Wuhan coronavirus (COVID-19) pandemic continues to dominate news headlines, especially now that the Trump administration is getting the ball rolling on developing and releasing a fast-tracked vaccine.

But nobody seems to be addressing the fact that if our own natural immune systems cannot fight the thing, then there is no way a vaccine will do anything other than needlessly cause adverse effects.

In a recent announcement, the WHO stated that there is no solid proof to suggest that people who test positive for the Wuhan coronavirus (COVID-19) and recover develop natural immunity.

They could still get re-infected again, the United Nations (UN) body insists – even as it continues to ignore the fact that a strain-specific vaccine would theoretically provide even less protection than natural immunity, if this is the case.

“There is currently no evidence that people who have recovered from #COVID19 and have antibodies are protected from a second infection,” the WHO wrote in a statement.

It’s about making you obedient, not safe

The reason why the WHO is making a point of emphasizing the questionable immunity that comes following a Wuhan coronavirus (COVID-19) infection is that the globalist entity does not want people refusing to following “safety guidelines” like mask-wearing and physical distancing.

“People who assume that they are immune to a second infection because they have received a positive test result may ignore public health advice,” the WHO laments.

Should a vaccine ever become available, UN Secretary-General Antonio Guterres wants it to be distributed for “free” to everyone – meaning taxpayers will collectively foot the bill through their governments.

This is great news for billionaire eugenicist Bill Gates, whose own vaccine development endeavors are almost guaranteed to reap windfall profits if “free” Wuhan coronavirus (COVID-19) vaccines eventually become a thing.

The way that Gates, the WHO, and other pandemic extremists plan to keep the public strung along in anticipation of a magical “unicorn” vaccine is to continue fear-mongering about the threat of infection.

One of the latest claims is that the Wuhan coronavirus (COVID-19) will never go away, which is sure to scare enough people into demanding whatever “warp speed” drug, injectable or otherwise, is presented as the cure.

“It is important to put this on the table: This virus may become just another endemic virus in our communities, and this virus may never go away,” stated Dr. Mike Ryan, the “emergencies director” of the WHO, during a recent virtual press conference.

Ryan then went on to compare the Wuhan coronavirus (COVID-19) to HIV, stating that “HIV has not gone away, but we have come to terms with the virus,” adding that he does not believe that “anyone can predict when this disease will disappear.”

Unbelievably, there are some 100 potential vaccine candidates for the Wuhan coronavirus (COVID-19) currently in development.

But this means nothing in terms of the continued spread of the disease, assuming any of these vaccines even work, because there are already vaccines for other health conditions like the measles that have not been eradicated.

By Ethan Huff, Guest writer",5,Low,,USA,0
4,https://humansarefree.com/2020/05/petition-against-mandatory-vaccination-coronavirus.html,Humans Are Free,2020-05-21,[],"Petition Against Mandatory Vaccination for the Coronavirus (Almost 500,000 Signatures)",https://humansarefree.com/wp-content/uploads/2020/05/Petition-Against-Mandatory-Vaccination-for-the-Coronavirus.jpg,"People of goodwill can disagree about the safety, efficacy and religious implications of a new vaccine for the coronavirus.

But, everyone should agree on this point:

No government can force anyone who has reached legal adulthood to be vaccinated for the coronavirus [we are protected by the Nuremberg Code].

Equally, no government can vaccinate minors for the coronavirus against the will of their parents or guardians.

Please SIGN this urgent petition which urges policymakers at every level of government to reject calls for mandatory coronavirus vaccination.

Fear of a disease – which we know very little about, relative to other similar diseases – must not lead to knee-jerk reactions regarding public health, nor can it justify supporting the hidden agenda of governmental as well as non-governmental bodies that have apparent conflicts of interest in plans to restrict personal freedoms.

The so-called “public health experts” have gotten it wrong many times during the current crisis. We should not, therefore, allow their opinions to rush decision-makers into policies regarding vaccination.

And, while some people, like Bill Gates, may have a lot of money, his opinion and that of his NGO (the Bill & Melinda Gates Foundation) – namely, that life will not return to normal till people are widely vaccinated – should not be permitted to influence policy decisions on a coronavirus vaccination program.

Finally, we must also not allow the rush by pharmaceutical companies to produce a new coronavirus vaccine to, itself, become an imperative for vaccination.

Unwitting citizens must not be used as guinea pigs for New World Order ideologues, or Big Pharma, in pursuit of a vaccine (and, profits) which may not even protect against future mutated strains of the coronavirus.

And it goes without saying that the production of vaccines using aborted babies for cell replication is a total non-starter, as the technique is gravely immoral.

However, if after sufficient study of the issue, a person who has reached the age of majority wishes to be vaccinated with a morally produced vaccine, along with his children, that is his business.

But we cannot and will not permit the government to make that decision for us.

Thank you for SIGNING and SHARING this petition, urging policymakers at all levels of government to reject mandatory coronavirus vaccination.

Please follow THIS LINK and SIGN the petition.",5,Low,,USA,0
5,https://humansarefree.com/2020/05/bill-gates-admits-700000-people-will-be-harmed-or-killed-by-coronavirus-vaccines.html,Humans Are Free,2020-05-18,[],"Bill Gates Admits: 700,000 People Will be Harmed or Killed by Coronavirus Vaccines",https://humansarefree.com/wp-content/uploads/2020/05/Bill-Gates-Admits-700000-People-Will-be-Harmed-or-Killed-by-Coronavirus-Vaccines-e1589792015708.jpg,"In his rush to develop one, two, or even seven different vaccines for the Wuhan coronavirus (COVID-19), billionaire software tycoon Bill Gates openly admitted that upwards of 700,000 people could become injured or die from these jabs.

The Microsoft co-founder and prominent eugenicist has been more outspoken in recent days than perhaps ever before about his desire to vaccinate the entire world, in this case as soon as possible for the Wuhan coronavirus (COVID-19). And the reality is that many more will die from the vaccine than from the virus itself.

Speaking during a recent segment on CNBC, Gates admitted that in order to make vaccines “work” for the most vulnerable groups, they have to be super-charged, in a sense.

And this super-charging means that some people are going to be injured or killed as a result.

“We clearly need a vaccine that works in the upper age range because they’re most at risk of that,” Gates stated about his plans for Wuhan coronavirus (COVID-19) vaccination.

“And doing that so that you amp it up so that it works in older people, and yet you don’t have side effects, if we have one in 10,000 side effects that’s way more, 700,000 people who will suffer from that.”

Bill Gates also says flu vaccines do not work for older people

During this same interview, Gates admitted something that we, too, have reported on: that influenza vaccines are pretty much useless in older people.

Though supposedly high-risk seniors are pushed to get their flu shots annually, Gates confessed to the fact that this yearly ritual does nothing to protect them against the flu.

“The efficacy of vaccines in older people is always a huge challenge,” Gates stated. “It turns out the flu vaccine isn’t that effective in elderly people.”

“And that actual decision of, ok, let’s go and give this vaccine to the entire world, governments will have to be involved because there will be some risk and indemnification needed.”

In his own analysis, Martin Armstrong of Armstrong Economics crunched the data and found that the number of deaths around the world that are being attributed to the Wuhan coronavirus (COVID-19) pales in comparison to the number of people who will be injured or killed by Wuhan coronavirus (COVID-19) vaccines, based on Gates’ own admission.

While the worldwide death count associated with the Wuhan coronavirus (COVID-19) is currently right around a quarter-million, the roughly one percent of people who could potentially die from a Gates-funded Wuhan coronavirus (COVID-19) vaccine is about triple that.

This suggests that society is better off telling Gates to hit the road and letting the Wuhan coronavirus (COVID-19) run its course – with proper nutrition, of course.

Vaccine experiments like the ones Gates is pushing for the Wuhan coronavirus (COVID-19) have been tried before, by the way.

Back in the ’70s, the United States rolled out a vaccine for “swine flu” that was administered to some 45 million people over the course of 10 weeks.

This vaccination effort was halted, however, after it was discovered that no cases of swine flu were even detected outside of the military base where it was said to have originated.

Meanwhile, one in 100,000 vaccinated individuals ended up suffering from side effects that included Guillain-Barré syndrome, while another 53 died.

Because of the horrors caused by this vaccination campaign, Guillain-Barré is supposedly monitored every single flu season to ensure that influenza vaccine safety meet certain safety thresholds.

“The side effect of treason is lead poisoning or rope burn, but not usually both,” joked one Big League Politics commenter in reference to Bill Gates.

“John the Baptist paved the way for Jesus,” wrote another. “Bill Gates is paving the way for the antichrist.”

By Ethan Huff, Guest writer",5,Low,,USA,0
