news_id,url,publisher,publish_date,author,title,image,body_text,news_guard_score,mbfc_level,political_bias
5,https://dcdirtylaundry.com/coronavirus-testing-is-really-about-harvesting-your-dna-for-a-government-database/,DC Dirty Laundry,2020-05-21,[],Coronavirus testing is really about harvesting your DNA for a government database,https://www.dcclothesline.com/wp-content/uploads/2020/05/DNA-Science.jpg,"(Natural News) Testing, testing, and more testing: This is all that the government can talk about these days in response to the Wuhan coronavirus (COVID-19) pandemic – that and a future vaccine, of course. But what if we told you that the true intent behind mass testing is to steal people’s DNA and store it away in government databases?

It might sound like some kind of crazy sci-fi flick, but hear us out. Back in late April when New York Governor Andrew Cuomo was asked about what happens after a person is tested for the Wuhan coronavirus (COVID-19), and whether the results “automatically go into some kind of database,” this was Cuomo’s chilling response:

“Yes, your result will be logged into both a state and county database through an electronic lab reporting system. The database includes your name.”

When further pressed about what a positive test result entails from the government’s standpoint, Cuomo explained that all newly infected are being ordered by their county health departments to quarantine for 14 days from the time of their most recent symptoms. They are also being asked to procure the names of anyone they may have come into contact with so that they, too, can be told to quarantine.

take our poll - story continues below

Trump or Biden, who will win? Why wait until November 3? Show all of America who you're voting for in 2020

TRUMP or BIDEN You Decide * Donald J. Trump Joe Biden Undecided

Email *

Name This field is for validation purposes and should be left unchanged. Completing this poll grants you access to DC Clothesline updates free of charge. You may opt out at anytime. You also agree to this site's Privacy Policy and Terms of Use.

This directly ties into the contact tracing push from people like Bill and Hillary Clinton, who want an “army of contact tracers” to sweep the nation and hunt down anyone who might have been infected with the Wuhan coronavirus (COVID-19).

Be sure to listen to the following episode of The Health Ranger Report in which Mike Adams, the Health Ranger, talks to Dr. Judy Mikovits about these and other authoritarian measures being thrown at the people in response to this “plandemic:”

WHO official: A vaccine for coronavirus may never arrive

In addition to the typical swabbing protocol, another form of Wuhan coronavirus (COVID-19) testing apparently involves taking blood samples by pricking people’s fingers, which the federal government is now implementing at pharmacies across America.

This combination of collecting both saliva and blood would seem to suggest that dark forces are perhaps trying to profile people’s genomes for some other purpose besides keeping them “safe” from a virus.

Keep in mind that there may never even be a vaccine for the Wuhan coronavirus (COVID-19), at least according to Dr. David Nabarro from the WHO, a professor of global health at Imperial College London.

As it turns out, it is quite difficult to produce an effective vaccine for a virus, let alone one that continues to mutate and basically become new viruses. If a vaccine is, in fact, released, chances are it will not be effective nor will it be safe.

“There are some viruses that we still do not have vaccines against,” Nabarro is quoted as saying. “We can’t make an absolute assumption that a vaccine will appear at all, or if it does appear, whether it will pass all the tests of efficacy and safety.”

Without a vaccine, experts are automatically predicting that the Wuhan coronavirus (COVID-19) will never go away and instead become an annual event. And they are saying this while completely ignoring nutrition, supplementation, and other lifestyle changes that could easily protect the masses at a minimal cost.

“It’s absolutely essential that all societies everywhere get themselves into a position where they are able to defend against the coronavirus as a constant threat, and to be able to go about social life and economic activity with the virus in our midst,” Nabarro says.

More of the latest news about the Wuhan coronavirus (COVID-19) is available at Pandemic.news.

Sources for this article include:

You Might Like

NYPost.com

NaturalNews.com

NaturalNews.com

NYPost.com

DNA",12.5,Very low,
6,https://dcdirtylaundry.com/top-10-commonsense-reasons-not-to-get-vaccinated-ever-with-any-new-shots-including-a-coronavirus-vaccine/,DC Dirty Laundry,2020-05-20,['Sd Wells'],"Top 10 commonsense reasons NOT to get vaccinated, ever, with any new shots, including a coronavirus vaccine",https://dcdirtylaundry.com/wp-content/uploads/2020/05/Doctor-Evil-Scary-Death-Skull-Vaccine-Abstract-1.jpg,"(Natural News) If your brain isn’t already bogged and fogged by fluoridated water, mercury-laced flu shots, and clogged up with mind-numbing canola oil, then you may be able to think this one through before it’s too late for you to. Today’s vaccines are corrupted, untested and dangerous, and the vaccine industry is paying out billions of dollars to keep it all on the hush, hush.

You will never, ever see a case of the injured family on television or in any newspaper, talking about the nightmare of vaccine side effects, including autism, paralysis, coma and death. Here are the top 10 common sense reasons not to get vaccinated with anything, ever.

The real horror stories of today’s vaccines and the top 10 reasons to avoid them

There are lots of reasons to avoid the Franken-science of vaccines, namely:

Most vaccines, including any COVID-19 one they may come out with in the next 18 months, are rushed to market with no safety trials and no proof of efficacy from independent labs. Only the vaccine manufacturer is allowed to “test” it so they can skew results to whatever end justifies their “success.” Nearly all vaccines carry more risk than benefit, because they contain highly dangerous adjuvants, toxic emulsifiers, deadly preservatives, and genetically modified live viruses and bacteria from other animals, including humans (abortions). The COVID-19 virus has already mutated and morphed, and continues to do so, so even if a vaccine is created soon, it will be obsolete and useless, besides being dangerously rushed to market. It’s completely unpredictable, and the truth is that the scientists know that. The secretive vaccine “court” has settled with injured families for over $4 billion dollars (that’s 4,000 million folks) for vaccines, mostly influenza jabs, that routinely and permanently maim, deform and kill babies, children, adults, and senior citizens alike. These real-life horror story cases, settlements and claims are NEVER published by mainstream media. Autism rates have skyrocketed over the past two decades, and the former, senior lead scientist of the CDC, Dr. William Thompson, blew the whistle himself and confessed that the MMR vaccine causes autism, especially in black boys under the age of three. Think about that one for a minute. Most vaccines contain random infected cells from other animals, including from human abortions, dogs, eagles, pigs, cows and monkeys. Most vaccines contain aluminum, which catapults the harmful effects of toxic heavy metals, like mercury, making them more likely to cross your blood/brain barrier, causing brain damage and central nervous system disorders (the vaccine industry notoriously calls this “triggering immune response” but it’s very dangerous). For the first two weeks after getting a vaccine that contains a live virus, it is highly likely that you shed that disease and give it to those around you, so herd immunity is useless here and this is when the vaccine industry always unjustly blames those who don’t vaccinate. It’s called shedding (a.k.a. vaccine induced disease) and it’s scientifically proven to happen. New vaccines are expected to contain micro-chips (instead of serial numbers tattooed on your forearm) that embed under your skin to be used as tracers and trackers, and the ingredients to be released by Bill Gates’ computer software. What could possibly go wrong? Infertility drugs, SSRIs, and high doses of mercury are just a few examples of secret ingredients you might discover too late. With 5G networks bombarding humans with dirty electricity, pesticide-laden food being produced at an all-time high (think GMO and Roundup Ready crops), and with everybody suffering from lockdown syndrome (lowered immunity), any vaccine injections (cocktails of chemicals and live, unpredictable virus combinations) are just deadly accidents waiting to happen. Good luck with all of that.

If you don’t want to be vaccinated with Bill Gates’ untested, unsafe, micro-chipped COVID-19 vaccine, then you are branded “anti-science!”

The lead vaccine industry shill at the New York (Crimes) Times, Kevin “Health Noose” Roose, is strongly pushing for a coronavirus vaccine, without a shred of proof that any such vaccine is either safe or effective. Intelligent Americans who say no to being injected regularly with mercury, aluminum and live, attenuated viruses are not anti-science, or even anti-vax — they’re just anti-stupidity.

take our poll - story continues below

Trump or Biden, who will win? Why wait until November 3? Show all of America who you're voting for in 2020

TRUMP or BIDEN You Decide * Donald J. Trump Joe Biden Undecided

Email *

Phone This field is for validation purposes and should be left unchanged. Completing this poll grants you access to DC Dirty Laundry updates free of charge. You may opt out at anytime. You also agree to this site's Privacy Policy and Terms of Use.

No person in their right mind thinks it’s smart to get injected with dirty vaccines just because the news cycle is blanketing the country with fear-mongering headlines every hour of the day. Many people who don’t get vaccines are pro-vaccine and are very science-based folks, but know that the industry is actually the most corrupt industry on Earth right now, with no regard to safety and that cannot be sued in court.

Realize that what the vaccine industry calls “side effects” are not side effects at all, but really DIRECT EFFECTS from the vaccination. If you get punched in the face and your teeth get knocked out, that’s not a side effect, that in fact, is a direct effect. Get it?

Bill Gates already admitted and bragged at a TED conference/seminar that if we do a “really good job” with vaccines, we can reduce the world’s population by a few billion. Yeah, how’s that working out for you, Bill?

Tune your internet dial to Vaccines.news for updates on a bogus COVID jab that could kill you with the disease you’re trying to avoid at all costs.

Sources for this article include:

ZeroHedge.com

Vaccines.news

TruthWiki.org

NaturalNews.com

Coronavirus Vaccine",12.5,Very low,
