news_id,url,publisher,publish_date,author,title,image,body_text,news_guard_score,mbfc_level,political_bias,country,reliability
24,https://www.americanthinker.com/articles/2020/05/deliver_us_from_evil_democrats_.html,American Thinker,2020-05-13,['Lloyd Marcus'],Deliver Us from Evil Democrats,https://www.americanthinker.com/images/bucket/2020-01/218780.png,"Despite 30 million Americans losing their jobs, domestic violence and suicides on the rise, Democrats and fake news media are terrifying Americans into believing the lockdown must continue. These evil people are fully committed to using the coronavirus to stop Trump's reelection.

I scratch my head thinking, “Don't these wacko leftists realize that if they destroy America, their livelihood is destroyed as well?” Democrats and fake news media's hatred for Trump and his voters and their desire to block him from making America great again, again, overrules logic. Their behavior is like the wicked queen in the Disney Snow White movie. Her hatred for Snow White was so great that she sacrificed her beauty, transforming herself into an ugly old witch to deceive and destroy Snow White.

Democrats and fake news media will sacrifice America if it means destroying Trump. These people must be defeated.

Sadly, half the country still does not realize that Democrats and fake news media are tag-team partners in transforming America into a socialist/communist nation.

Before my lifelong Democrat dad, Dr. Rev. Lloyd E. Marcus passed away at age 90, I tried to inform Dad that his workingman party had been hijacked by 1960s hippies. Hippies (Democrats) also took over Hollywood, mainstream media and public education decades ago. Consequently, they created a generation of young adults who hate America, hate the God of Christianity and believe their parents are stupid, racist, sexist, and homophobic.

Long gone is the mindset of the TV show, “Father Knows Best.” “Family Feud” game show surveyed 100 people. “Who would you ask for advice?” Not one person of those surveyed said they would seek counsel from their father. Wow!

For many years, I have tried to educate my family and friends to the truth that Democrats are not our friends. Everything they desire to do is harmful to Americans. The Democratic party has been taken over by a spirit of anti-Christ. Every policy they seek to implement is rooted in their belief that they are smarter than God, desire to overrule God's original intent and mission to ban God from our culture.

Daring to be an independent thinker speaking the truth about Democrats gets me called names; a self-hating n*****, stupid, Republican and Uncle Tom sellout. I challenge you to research and prove my observation of Democrats wrong.

Democrats and fake news media are all over TV absurdly saying that because of COVID-19, we can never return to normal life in America. For crying out loud, viruses have been around since the beginning of time. Suddenly, because of one flu virus, Democrats say we must wear masks and social distance forever. God did not design or intend for us to live like that. But then, Democrats believe they are smarter than God. Folks, there is no scientific data which supports social distancing.

Knut Wittkowski, PhD, said that elderly and people with immune issues should be protected. Wittkowski said forcing the masses to social distance is harmful because it delays herd immunity which makes the virus last longer. “...we should not believe that we are more intelligent than Mother Nature was when we were evolving. Mother Nature (God) was pretty good at making sure that we're a good match for the diseases that we happen to see virtually every year.”

Dr. Judy Mikovits said that by wearing masks, we are breathing in our own germs. I witnessed this at a local store. The clerk was struggling to breath. “What is wrong with you?” I asked with concern. She said the mandatory requirement that she wear a mask was stupid because it blocked her from breathing fresh air.

Virologists say we are doing the opposite of what we should be doing to deal with coronavirus. We are lowering our immune system by sheltering-in-place, wearing masks and killing our good bugs by overusing hand sanitizer.

And yet, Democrats are using coronavirus to implement crazy policies such as never again allowing church gatherings over 50 people. These Democrats are crazy and evil.

Most of my family and friends who are Christians still do not realize that Democrats are obsessed with overruling God's original intentions. A Democrat memo exposed their desire to legalize 12 new perversions which include pedophilia and bestiality.

Democrats are masters of deceiving and bullying the public into surrendering to anti-God cultural norms. Here's how they will normalize pedophilia and bestiality.

I've seen articles and heard college lectures that pedophiles are born that way. Therefore, pedophilia is simply another God-given sexual orientation. Hollywood will produce movies portraying pedophiles as victims of our intolerance. Expect a new “groundbreaking” TV sitcom titled something like, “Suzy Loves Daddy,” a hilarious comedy about a goofy lovable dad who married his daughter.

Democrats and fake news media will gang attack anyone who dares to criticize the immoral show. They will say, “love is love.” Sadly, Christians will say, “’Suzy Loves Daddy’ is so funny!” Then, they will say, “Jesus loves everyone” which means good Christians should embrace every perversion. Suddenly, pedophilia and incest are normalized, featured in movies, TV shows and commercials from home improvement to diet and exercise. Pedophilia and incest will skyrocket. Your kids will view you as an out-of-touch dinosaur for not embracing “loving” pedophile and incestuous relationships.

Next up, Democrats will force us to normalize bestiality; sex between humans and animals. The Oscar winning movie, The Shape of Water is a major step in normalizing bestiality.

Believing they are smarter than God, Democrats outrageously seek to legalize aborting babies even after they are born to save the planet from overpopulation. Democrats outrageously say it is not a human being with rights unless the mother says so. How can any Christian think this is right? God said, “Before I formed you in the womb, I knew you...” (Jeremiah 1:5)

I could go on and on with examples of how Democrats and fake news media believe themselves smarter than God. “Professing themselves to be wise, they became fools.” ( Romans 1:22)

Democrats are hellbent on prolonging this insane unscientific lock-down for as long as they can get away with it. It is Democrats' most destructive effort thus far to attack America, destroy Trump, and assume the role of God.

Lloyd Marcus, The Unhyphenated American

Help Lloyd Spread the Truth

https://www.trumptrainusa2020.com/

http://LloydMarcus.com",12.5,Low,Extreme right,USA,0
25,https://www.americanthinker.com/articles/2020/05/the_wuhan_virus_lockdown_is_a_colossal_blunder.html,American Thinker,2020-05-13,['Steve McCann'],The Wuhan Virus Lockdown is a Colossal Blunder,https://www.americanthinker.com/images/bucket/2020-05/220888.png,"The Wuhan Virus pandemic is not the most significant crisis in our nation’s history. It isn’t even the greatest public health crisis in our history. But with the imposition of a near total national lockdown it is undoubtedly the greatest marginalization of personal liberty in American history.

Over the centuries, in virtually all societies, people known to be infected by various deadly diseases were confined and isolated in order to mitigate the spread and protect the rest of society. Never have we confined the entire population ostensibly for the same objective.

Over the past 50 years, an ever-increasing percentage of the citizenry has been conditioned to look to the government to cure all societal and health related ills. The ruling classes have eagerly promoted this mindset as it abets their lust for permanent power. However, this obligates those in power to cure all ills, even a global pandemic. Thus, it follows that the State will inevitably claim that in order to do so it must take control of our lives against our will even if we are healthy, lest we fall ill and overwhelm the health care system.

Using exponentially flawed models and projections, not based on any actual evidence or experience with the virus, the government at all levels so terrified the populace that they eagerly embraced the concept of home confinement and the catastrophic collapse of the economy. But one question that the powers-to-be never asked themselves at the time was: How do we get out of this? Now they find themselves trapped by their own decisions.

Recently, both the federal government and states have proposed various goals that must be met before the lockdown is fully lifted. What is egregiously wrong with all these steps is that they are solely about health and arbitrary health related statistics.

Rather than look at the devastated economy as well as the unbelievable and potential life-threatening distress of the vast bulk of the American people, these politicians are hiding behind government scientist/bureaucrats, believing that focus on just Wuhan Virus statistics will shield them from criticism. The national leadership of the Democrat party are also hiding behind the scientists to not only avoid criticism but to prolong the lockdown in the hope that the economy and nation is still in shambles on November 3, election day.

The reality is the decision to reopen the nation is a political decision, not a scientific one.

It all boils down to one simple question. Has the lockdown been worth it? That depends only partly on science. There are also three other factors that must go into that answer: 1) economic consequences, 2) constitutional values and 3) moral judgements.

First, the medical aspect. The declared purpose of the lockdown was to mitigate what was projected to be a complete meltdown of available intensive care and hospital beds nationwide or in now common parlance “bend the curve.” At the height of the virus outbreak, the nation utilized less than 15% of available hospital beds and less than 20% of available intensive care beds for coronavirus patients. This curve has been bent for some time.

Deaths from nursing and senior care facilities homes now account for more than 50% of total recorded fatalities since the beginning of the epidemic. In some states it is as high as 80%. Over the past three weeks nursing home related deaths account for nearly 70% of reported fatalities. As Daniel Horowitz at Conservative Review recently wrote:

This revelation should change everything we know about the current state of affairs with coronavirus. Governors are still justifying the continued lockdown by pointing to rising deaths in many states and counties. But it now appears, using simple arithmetic, that in most states, the overwhelming majority of deaths are in nursing homes, and in some states and counties, nearly every new death is in a senior facility. The implication is that there is no excuse whatsoever not to open up the country and throw all our resources at protecting nursing homes.

Numerous serology study results have been extrapolated to show when accounting for the true number of people who have gotten this virus, the infection fatality rate drops to 0.1% to 0.3% (about the same as the annual flu). A recent study at Truesdale Prison in Tennessee recorded that of 2,444 tests 1,299 were positive (53%) and 96% of those were asymptomatic (showing no symptoms). One inmate (67 years old) has died or a fatality rate of 0.07%.

Accounting for the fact that the deaths are lopsided among the elderly and chronically ill, the fatality rate among the younger population approaches 0.03%.

This virus will never disappear unless and until there is enough exposure to produce a collective immunity or an effective vaccine, available to everyone in the world, is produced. There is no scientific basis, centered on actual findings either in the United States or around the world, for continuing for weeks or months any full or partial shutdown of the general population on either the national, state or local level.

Second, the economic consequences. There has been the inevitable leftist decrying of any attempt to measure the mortality of the coronavirus against the economic and emotional cost of the chosen means of mitigating it. But this is nothing but empty rhetoric as well as hypocritical. All of us whether a tenured college professor and a grocery store clerk and a government bureaucrat and an over-the-road truck driver value and depend upon the economy to generate wealth.

Hundreds of thousands of businesses are on the verge of bankruptcy and permanent closure. 33+ million are unemployed, many are forced against their will to be dependent on government largess and the federal government is creating massive unsustainable debt in an attempt to keep the nation afloat. A thriving economy, the kind we are now destroying, is the source of our security, the financing of our health care system and our children’s future. Without it this nation as we know it will cease to exist. While our leftist brothers may sneer at this reality, it should also be remembered that poverty kills as well. And when it does not kill, it maims, mentally, physically and socially.

Third, the erosion of constitutional values. What are the limits to the things that the State can legitimately do to a people living in a constitutional republic originally established on the basis of guaranteeing individual freedom?

Lord Sumption, a former Supreme Court Judge in the United Kingdom, recently wrote:

To say that there are no limits is the stuff of tyrants. Every despot who ever lived thought that he was coercing his subjects for their own good or that of society. We have to ask ourselves what kind of relationship we want with the State. Do we really want to be the kind of society where basic freedoms are conditional on the decisions of politicians in thrall to scientists and statisticians? Where human beings are just tools of public policy? A society in which Government can confine most of the population without controversy is not one in which civilized people would want to live, regardless of their [politicians] answer to” Is it worth it? My own answer is no. Guidance is fine. Voluntary self-isolation is fine, and strongly advisable for the more vulnerable. Most of them will do it by choice. But coercion is not fine. There is no moral or principled justification for it.

Lastly, on moral judgement. However valuable saving every life may be, it is not the only valuable thing to a society. A comparison is unavoidable between the lives that may be saved and the others lost in a massive national shutdown. Which includes those unable to access other lifesaving medical procedures, as many states effectively shut down hospitals and medical practices in order to theoretically mitigate the coronavirus epidemic.

Thus, it is empty rhetoric to regurgitate the talking point that every life is priceless whenever the subject of reopening the country is raised. These catch phrases are emotionally satisfying, but those that mouth them do not actually believe them, as many who fall back on these platitudes also promote and applaud abortion up to and at birth.

Societies and people make life altering choices all the time, be it going to war to protect the country, commuting two hours a day to work on crowded highways, travel by air, or working in a coal mine. These decisions are made as mankind is fully aware that there is more to life than the avoidance of death.

The answer to the question, “Was the lockdown worth it?” is a resounding no.

Ordering the citizenry to cower in their homes, harassing people for walking on an empty beach, and mandating small businesses close up shop regardless of their hygienic procedures has never, in the history of mankind, been demonstrated to be effective in combating any infectious disease. In summary, lockdowns do not work.

It was common knowledge by early March, based on the experience in Italy, South Korea and other nations, that this virus was problematic for the elderly with serious underlying conditions. (In Italy 85% of deaths have been among those over 70 with serious underlying conditions) Rather than focus and expend all available resources on that portion of the population, this nation decided, based on bogus science, to institute a state optioned complete or partial lockdown leaving that segment of society to essentially fend for itself -- with disastrous consequences. All the while decimating the economy, people’s livelihoods and marginalizing freedom of speech, religion, and assembly.

This nation has made the biggest blunder in its history.

The time has come for the politicians from the President to the Governors and Mayors to stop hiding behind the scientist/bureaucrats and fully reopen the nation. Focus on that segment of the population most at risk, without compulsory isolation or de facto imprisonment. And restore the civil liberties that have been wantonly eroded.

Graphic credit: Sanu N",12.5,Low,Extreme right,USA,0
26,https://www.americanthinker.com/articles/2020/05/who_has_it_worse_donald_trump_or_abraham_lincoln.html,American Thinker,2020-05-13,['Ron A.Y. Rich'],Who Has It Worse: Donald Trump or Abraham Lincoln?,https://www.americanthinker.com/images/bucket/2020-05/220872.jpg,"President Trump's recent decision to leave the White House for a town hall at the knee of Abraham Lincoln in the Lincoln Memorial revived once again a reminder that President Lincoln seemed to be as hated in his day as President Trump is today. Some would say President Lincoln was reviled even more than President Trump since Lincoln was blamed for the Civil War in which about 600,000 to 700,000 American soldiers died (compared to a projected 100,000 American citizens due to the coronavirus), whereas President Trump is merely blamed — whether fairly or not — for the manner of the fight against the coronavirus — against an enemy opposed by Democrats and Republicans alike.

Actually, some say President Lincoln was hated even more than President Trump, since President Lincoln made the ultimate sacrifice — he was assassinated — while President Trump merely suffers from character assassination — again, whether justified or not, and whether a president's character is as important as his actions or not. To date, there is no shortage of gruesome incitement against President Trump, but it has been limited to words and drawings.

Notwithstanding all of the above, an argument can be made that the blind hatred of President Trump, which has been diagnosed as Trump Derangement Syndrome, is even more invidious than the widespread hatred against President Lincoln in his day. This is so because the people who hated President Lincoln at least had rational reasons to do so — that many believed he was responsible for putting an end to their privileged way of life, on the backs of their slaves (inhumane, but rational from the point of view of the Southern slave-owners), and many believed that President Lincoln not only caused the Civil War, but also prolonged the Civil War because of some of the military decisions he made (again, possibly wrong but rational according to many military experts), thereby causing so many extra people to die.

The people who blame President Trump for the deaths caused by the coronavirus are more invidious because they base this on false and irrational premises.

President Trump's critics say he did too little too late, even though most of the top scientific experts and Democratic politicians who criticize him continued to underestimate the severity and virulence of the virus long after President Trump put at least a partial ban on travel from China to the United States.

President Trump's critics point out that the travel ban wasn't total even though it was imposed sooner than bans by most European countries.

President trump's critics criticized even the partial ban as racist and xenophobic and by and large have not apologized.

President Trump's failure to do more sooner to fight the virus was due at least in part to his having been misled by the same scientists, experts, and politicians who in hindsight turned around and accused President Trump of doing too little too late.

Sweden's decision not to impose mandatory lockdowns at all resulted in lower death rates than five major European countries.

Studies have shown that the cutbacks to the economies of countries throughout the world due to their lockdowns are leading to more deaths worldwide as a result of hunger than the deaths caused by the coronavirus,

This is on top of the deaths caused by suicides due to the economic effects of the lockdowns and deaths caused by failures to be able to seek treatment for non-COVID illnesses.

The president has not imposed his own guidelines on when to reopen, but (a) he deferred to the scientific task force to create guidelines; (b) he left it to the governors to decide how to apply these guidelines, and to which counties, and (c) he even criticized governors — including Republicans — who reopened their economies without meeting the requirements of the guidelines.

The president has shown more sympathy for the 30+ million Americans who have lost their livelihoods (multiplied by the number of members of each such taxpayer's household) than most of the governors who have focused on ONLY the numbers of people who have succumbed to the illness, a ratio of 300+ to 1.

The president is blamed for not sending enough ventilators to local governments, notably those controlled by Democrats in New York and other jurisdictions, that failed to replenish their supplies during health emergencies that used them up during the Obama administration.

All of these factors build on the fact that Trump Derangement Syndrome is based on lies fed TO an unsuspecting public by politicians and members of the media who certainly know better.

It is absurd to call President Trump a xenophobe, considering he is a son of immigrants, and he married two immigrants, including his current wife.

It is absurd to call him anti-Muslim for banning immigrants from countries that included non-Muslim countries and that excluded the most populous Muslim country on the planet.

It is absurd to call him a misogynist, considering the many women he has consistently hired to important positions in his businesses and to represent him to the press and to the United Nations.

It is absurd to call him anti-veteran, considering his build-up of the military and his providing more medical options to veterans. (He never insulted Khizr Khan, but only asked rhetorically why his wife wasn't given an opportunity to speak, thus making a statement on behalf of women.)

It is absurd to call him anti-disabled based on some gestures he made at a press conference that he has been shown on video to have made whenever he insults people with whom he disagrees, including Senator Cruz when they were political rivals.

It is absurd to call him anti-black, considering how he lowered blacks' unemployment rate more than any other president in history prior to the coronavirus, not to mention his close personal friendships with many well known black American politicians and celebrities.

It is absurd to consider him anti-Semitic in light of the unprecedented support he has given the Israelis, not to mention his Jewish daughter and son-in-law who have unprecedented influence in his White House.

And it is absurd to condemn a president for colluding with a country even after a report compiled by his political enemies failed to find any evidence of such collusion, and to condemn a national security adviser who was pressured under false pretenses by anti-American Stalinist tactics into a false confession.

We live in a free country. People are free to criticize President Trump. President Trump is free to exaggerate and to speak imprecisely and in an unpresidential manner, especially if done to counterattack statements made by a hostile unfair, unimpressed, and unimpressive press. Members of the press, politicians, and actors are free to express their opposition to the president's views, character, and demeanor. But nobody has a right to knowingly distort the truth in doing so.

Mr. Rich holds multiple graduate degrees but above all values his sense of fairness and common sense.

This article has been updated.",12.5,Low,Extreme right,USA,0
