news_id,url,publisher,publish_date,author,title,image,body_text,news_guard_score,mbfc_level,political_bias,country,reliability
6,https://humansarefree.com/2020/05/dr-kaufman-is-censored-and-lost-his-job-but-he-is-willing-to-go-to-jail-to-resist-they-want-to-genetically-modify-us-with-covid-19-vaccine.html,Humans Are Free,2020-05-17,[],Dr. Kaufman is Censored and Lost His Job but He is Willing to Go to Jail to Resist: ‘They Want To Genetically Modify Us With COVID-19 Vaccine’,https://humansarefree.com/wp-content/uploads/2020/05/Dr.-Kaufman-is-Censored-and-Lost-His-Job-but-He-is-Willing-to-Go-to-Jail-to-Resist-They-Want-To-Genetically-Modify-Us-With-COVID-19-Vaccine-e1589630196260.jpg,"Dr. Andrew Kaufman may be the most censored doctor in the U.S. right now. His videos are removed and censored from YouTube very quickly.

Dr. Kaufman is so intelligent, and so articulate, that the “mainstream” media and medical authorities obviously fear him and his message, and they are doing everything in their power to suppress him.

This video (below) he did with Spiro Skouras, for example, was immediately removed from YouTube, although Spiro’s other videos remain for the most part (for now).

Andrew Kaufman is a medical doctor. Here is his full bio from his website:

Andy Kaufman, M.D. is a natural healing consultant, inventor, public speaker, forensic psychiatrist, and expert witness.

He completed his psychiatric training at Duke University Medical Center after graduating from the Medical University of South Carolina, and has a B.S. from M.I.T. in Molecular Biology.

He has conducted and published original research and lectured, supervised, and mentored medical students, residents, and fellows in all psychiatric specialties.

He has been qualified as an expert witness in local, state, and federal courts. He has held leadership positions in academic medicine and professional organizations.

He ran a start-up company to develop a medical device he invented and patented.

Faculty Positions

Clinical Assistant Professor of Psychiatry, SUNY Upstate Medical University

Vice President, Psychiatry Faculty Practice Corporation, SUNY Upstate Medical University

Medical Director of Faculty Practice, SUNY Upstate Medical University

Assistant Director, Forensic Psychiatry Fellowship, SUNY Upstate Medical University

Consulting Expert Witness, Syracuse University Law School

Education

Medical University of South Carolina, Doctor of Medicine

Massachusetts Institute of Technology, BS in Biology

Training

American Board of Psychiatry and Neurology Board Certification in Psychiatry and Forensic Psychiatry (2011)

SUNY Upstate Medical University, Fellowship in Forensic Psychiatry

Duke University School of Medicine, Resident in Psychiatry

Publications

Knoll JL and Kaufman AR. Suicide in Correctional Settings: Epidemiology, Risk Assessment, and Prevention. Principles and Practice of Forensic Psychiatry edited by Richard Rosner, 3rd edition, 2017.

Way BB, Kaufman AR, Knoll JL, Chlebowski, S: Suicidal Ideation among Inmate-Patients in State Prison: Prevalence, Reluctance to Report, and Treatment Preferences. Behavioral Science and the Law, 31(2): 230-8, 2013.

Kaufman AR, Way BB, Suardi E: Forty Years after Jackson v. Indiana. States’ Compliance with “Reasonable Period of Time” Ruling. Journal of the American Academy of Psychiatry and the Law, 40:261-5, 2012.

Kaufman AR, Knoll JL, Way BB, Leonard C, Widroff J: Survey of Forensic Mental Health Experts on Pro Se Competence After Indiana v. Edwards: Towards an Evidence-Based Pro Se Competency Standard. Journal of the American Academy of Psychiatry and the Law, 39:565-70, 2011.

Knoll JL, Leonard C, Kaufman AR, Way BB: A Pilot Survey of Trial Court Judges’ Opinions on Pro Se Competence after Indiana v. Edwards. Journal of the American Academy of Psychiatry and the Law, 38:536-9, 2010.

Kaufman AR, Way B: North Carolina Resident Psychiatrists Knowledge of the Commitment Statutes: Do They Stray from the Legal Standard in the Hypothetical Application of Involuntary Commitment Criteria? Psychiatric Quarterly, 2010; 81(4): p.363.

Kaufman, AR: More on DSM-5: Will “Cross-Cutting” Butcher Clinical Psychiatry. Correctional Mental Health Report, 2010; 12(2): p. 21.

Kaufman AR: Are Psychiatrists Lexa-Professionals? Correctional Mental Health Report, 2010; 11(5): p. 71

Kaufman AR: Should We Use Law Enforcement for Emergency Transportation of People With Mental Illness? American Journal of Psychiatry 2007; 164(3): Residents’ Journal p. 3

In this interview with Spiro Skouras, you will most likely learn things you have never heard before about the COVID-19 pandemic. Dr. Kaufman will explain why this is all planned, and is not really about a dangerous virus at all, but a way to control people’s lives.

He will explain things about the new type of vaccine they are rushing so fast to develop, and what he believes is the real objective for this vaccine.

Dr. Kaufman has already paid a steep price to be a whistle blower, and he only expects it to get worse.

He states:

This is the only important thing for me to do now, is to get this information out, so that we can prevent ourselves from living in a horrible, horrible future.

I have two young children, and they are my main motivating factor, that I don’t want them to live in a world where they have no freedom. And that’s where we’re heading right now.

And so whatever risks there are, they’re risks that I simply have to take. That’s why I am doing what I am doing.

There have been things that have occurred. I have had consequences. I was let go from my regular psychiatry job because I refused to wear a mask.

I have had several friends who are doctors or other health care professionals who have been very upset with me. (They’re) disappointed and won’t talk to me anymore.

I knew that those risks were part of this. But that’s not what’s important.

I’ll tell you that I would be happy to risk being taken to jail as well, because I’m not going to participate in any of these measures.

I don’t wear a mask. I don’t stay at home.

I respect other people’s rights to make their own choices. So I don’t go and get in people’s faces.

But if anyone is willing to make eye contact and interact with me, I don’t observe any social distancing, (and so) any opportunity to hug someone, especially in public, I always take advantage of that, because I want to show people that actually all of these measures are really voluntary.

Even Governor Cuomo has made a public statement that there’s nothing that they can do to enforce any of these measures and that they are voluntary.

And I would like to encourage other people to make that decision, because if we rely on the authority to give us approval of how to exercise our freedom, they’re going to take more freedoms away, as they’ve been doing.

So while I respect people that to go and protest at the City Hall or State Capital, they are coming from the right point of view, they’re just asking the authority figures, the government, to give them permission, when they don’t need permission from the government.

They already have permission because they have inalienable rights.

It’s not really a decision for me. It’s just what I feel that I have to do to preserve the way of life that I want to live for me and my children.

At the time of this publication, this interview has been viewed just over 15,000 times.

It needs to be MILLIONS! Please watch and share this information that they are trying so hard to censor.

Sources: Healthimpactnews.com; BitChute.com",5,Low,,USA,0
7,https://humansarefree.com/2020/05/researchers-100-covid-19-cure-rate-using-intravenous-chlorine-dioxide.html,Humans Are Free,2020-05-21,[],Researchers: 100% Covid-19 Cure Rate Using Intravenous Chlorine Dioxide,https://humansarefree.com/wp-content/uploads/2020/05/Researchers-100-Covid-19-Cure-Rate-Using-Intravenous-Chlorine-Dioxide-e1589987707929.png,"Preliminary data from a clinical trial involving more than 100 covid-19 patients in Ecuador has resulted in a claimed 100 cure rate within four days, according to Andreas Kalcker who is closely following the results of the effort.

The tests were carried out by the Asociacion Ecuatoriana de Medicos Expertos en Medicina Integrativa, a group of integrative medicine practitioners.

Ecuador has been hit particularly hard by the coronavirus, and the current “standard of care” promoted by Western medicine — largely based on the use of ventilators — has been killing the vast majority of critical patients while utterly failing to address the real root of the problem.

Covid-19 isn’t an Acute Respiratory Disease (ARD), it turns out.

Rather, it often presents as an inflammation and blood clotting condition (see The Lancet research, below) which causes the blood to be unable to carry oxygen, resulting in patient hypoxia and eventual asphyxiation.

This is why intravenous chlorine dioxide — which immediately delivers a high dose of oxygen to blood cells — is believed to work so effectively against covid-19.

It reportedly restores the oxygen-carrying capacity of hemoglobin and clears the clotting in the lungs, all while destroying pathogens.

Chlorine dioxide researcher and advocate Andreas Kalcker has posted a video (in Spanish) where he explains the findings.

That video, entitled, “Mas de 100 Casos de Covid-19 recuperados con CDS por medicos de Aememi,” is found at this link on Lbry.tv.

A video embed is offered here:

In the video, Andreas explains that researchers were able to achieve a complete cure in just four days through the use of intravenous chlorine dioxide (ClO2).

Here’s a photo of some of the researchers holding syringes of chlorine dioxide, which is then infused into the patients’ blood, where it releases a wave of oxygen that researchers believe saturates the blood with O2 while killing pathogens:

Another clinical trial involving chlorine dioxide is currently under way, documented by the US National Library of Medicine at ClinicalTrials.gov.

The study uses oral chlorine dioxide (rather than intravenous) and is entitled, “Determination of the Effectiveness of Oral Chlorine Dioxide in the Treatment of COVID 19.”

The trial is being conducted by the Genesis Foundation and involves 20 patients.

The ClinicalTrials.gov identifier for that trial is NCT04343742.

Andreas Kalcker explains in his video that chlorine dioxide is a powerful disinfectant that destroys viruses and bacteria.

The substance has long been used in water purification processes and is approved by various US government agencies for as a water treatment and purification agent.

This video frame shows blood cells being flooded with oxygen from ClO2, instantly reducing clotting / coagulation:

Covid-19 is not an acute respiratory disease

In another bombshell science paper published May 7, 2020, in The Lancet, researchers Dennis McGonagle and others determined that covid-19 is not a respiratory disease but rather “diffuse pulmonary intravascular coagulopathy,” a kind of blood clotting that presents in lung tissue.

This explains why patients with covid-19 are dying from hypoxia (lack of oxygen) and are frequently killed by the use of ventilators.

As an ICU doctor from New York warned months ago, doctors are treating the wrong disease.

(That doctor’s YouTube channel was deleted and all his videos were censored, of course. No one is allowed to question medical orthodoxy in the medical police state known as the United States of America.)

Study authors also found the inflammation triggers a worsening of the condition, which implies that anti-inflammatory interventions might be the key to saving lives and ending the pandemic.

From the study:

The immune mechanism underlying diffuse alveolar and pulmonary interstitial inflammation in COVID-19 involves a MAS-like state that triggers extensive immunothrombosis…

MAS stands for Macrophage Activation Syndrome, and it is an inflammatory response stemming from an over-reactive immune response, similar to the “cytokine storm” that’s being widely discussed (which vitamin C helps prevent, according to published research). As the study explains:

The severity of systemic inflammation in response to human coronavirus family members has features reminiscent of a cytokine storm or macrophage activation syndrome (MAS), also known as secondary haemophagocytic lymphohistocytosis (sHLH).

Figure 1 from the study:

To simplify these findings, covid-19 is not acute viral pneumonia impacting the respiratory system but rather an inflammation-based immunological response that leads to thrombosis (clotting in the lungs) which kills the patient.

The use of ventilators only makes the problem worse, which is why previous observational studies have found that 88% of patients put on ventilators end up dying. They are dying because the ventilator treatment is the wrong treatment.

Chlorine dioxide is reportedly saving 100 percent of the patients studied so far because chlorine dioxide floods the blood with instantly usable oxygen while killing the pathogens responsible for clotting.

There is also anecdotal evidence that some people are beating covid-19 infections with high doses of aspirin, a blood thinner, although this information should not be taken as advice for treatment, and far more research is needed on blood thinners and anti-inflammatory interventions.

This may also help explain why turmeric and vitamin D are associated with strong reductions in inflammation in the body, which may prove useful in balancing the immune response and preventing the kind of imbalance that can lead to immune system overreactions.

The criminal medical cartels are censoring all treatments and cures that work to save lives

Notably, the criminal Big Pharma cartels and corrupt government regulators (like the FDA, FTC, CDC) are going out of their way to try to criminalize or suppress any non-vaccine, non-pharma solutions that might save lives.

Over the last month, we’ve all witnessed an astonishing level of aggression and mafia-style tactics used by the FDA and FTC against pioneering researchers offering a variety of possible solutions, such as chlorine dioxide or intravenous vitamin C.

They’ve even declared war on hydroxychloroquine and the medical establishment has been engineering clinical trials which are designed to fail from the start in order to discredit the off-patent, affordable drug.

There is no doubt that Big Pharma’s obedient government lackeys are at war with truth and are desperately trying to suppress information about natural cures and integrative treatments that might eliminate covid-19 before vaccines can be made available.

The techno-fascist tech giants like Facebook, Google, Vimeo, YouTube and Twitter are all-in with Big Pharma, going out of their way to censor and destroy all information that criticizes vaccines or offers wisdom about natural treatments or integrative medicine interventions.

This criminal cabal of Big Tech and Big Pharma is the enemy of humanity, as they are deliberately working to worsen the pandemic, increase suffering and death and extend the punishing lockdowns for as long as possible in order to cause several economic damage while preparing the masses for mandatory vaccines.

We are all witnessing a powerful criminal gang of corporations and regulators who are deliberately seeking to destroy human society as we know it today, and they are the gatekeepers of information on the ‘net (and in the news).

[The internet was perfectly fine before the powers that shouldn’t be decided to destroy it. Now censorship and propaganda are rampant online, and Google and YouTube searches are no longer relevant since they promote the dinosaur media lies rather than delivering the actual search trends, as they used to. The MSM is shoved down our throats even deeper, while independent researchers are delisted, etc.]

This is why we are repeating our call for the CEOs of all the top tech giants to be arrested and charged with crimes against humanity, then prosecuted in a court of law.

Also read: Amazon, Google And Facebook Have Taken Over The World And Are Now A Threat To Our Very Existence

Over the weekend, a member of Italy’s Parliament gave a rousing speech in which she labeled Bill Gates a “vaccine criminal” and demanded he be arrested and charged with crimes against humanity.

Such efforts should not be limited to Bill Gates, however. They must include the criminals of other tech giants as well as the corrupt, anti-human criminals running the FDA, FTC and CDC, among others.

Their crimes against humanity must not go unanswered, and they must be held accountable in a court of law.

The destructive, anti-human agendas of Big Pharma and Big Tech are incompatible with human freedom and a sustainable human civilization.

These anti-human institutions must be permanently dismantled, and humanity must rise up against this threat in the same way we once awakened against the Third Reich and the rise of Nazi fascism and the Holocaust.

Right now, Big Pharma, Big Tech, the FDA and the CDC are plotting to kill billions of human beings with an engineered bioweapon, a risky vaccine, and high-fatality prescription drugs that make people more vulnerable to covid-19.

These enemies of humanity must be stopped, and the truth about chlorine dioxide must be set free so that human beings can be saved from suffering and death.

To learn more about the establishment’s war on truth (and war on humanity), watch my recent interview with Dr. Judy Mikovits, who has also been subjected to extreme censorship for raising the alarm about how vaccines are spreading infectious disease.

Sources: NaturalNews.com; Brighteon.com",5,Low,,USA,0
8,https://humansarefree.com/2020/05/nwo-melinda-gates-global-vaccine-upside-down-cross.html,Humans Are Free,2020-05-14,[],NWO Acolyte Melinda Gates Appears on Today Show Pushing Hard for a Global Vaccine While Wearing an Upside-Down Cross,https://humansarefree.com/wp-content/uploads/2020/05/NWO-Acolyte-Melinda-Gates-Appears-on-Today-Show-Pushing-Hard-for-a-Global-Vaccine-While-Wearing-an-Upside-Down-Cross-e1589389484163.jpg,"TODAY’s Savannah Guthrie spoke exclusively to Melinda Gates, who is working to address the pandemic through the Bill and Melinda Gates Foundation.

She says there are “a few good candidates” for a vaccine and that the U.S. needs “to start looking at a paid medical leave policy” to help workers on the front lines.

She also criticizes the Trump administration for its response to the crisis:

“We haven’t had leadership at the national level … it’s chaos.”

This while wearing a very odd looking upside-down inverted cross around her neck.

Melinda Gates in an interview on TODAY Show pushing hard for a global COVID-19 vaccine was wearing a bright and shiny upside-down cross around her neck.

Symbolism is very important to groups like the Illuminati, the New World Order and others, as they love to flash you signs of how much smarter they are than you and I are.

We are ruled by a satanic death cult who is obsessed with symbolism. Besides Melinda Gates’ inverted cross, here’s 2 more examples of satanic symbolism related to the ‘Gates of Hell’ family and the upcoming ‘mark of the beast’ vaccine:

1. An Enzyme Called LUCIFERASE is What Makes Bill Gates Implantable Vaccine Work

2. Microsoft Funds ID2020 And Files Patent For Device Attached To The Human Body For Buying And Selling Bitcoin – Patent #666

They like to put their true agenda right in our faces, and dare us to figure it out. Take a quick trip to our Predictive Programming section, and you will see immediately what we’re talking about.

All this brings us to an interview the TODAY Show did with Melinda Gates back on November 8th, where we see Melinda wearing an upside-down, or inverted, cross around her neck.

Who likes to wear inverted crosses? Satanists, pagans, witches, warlocks, New Agers, most people in Hollywood … you get the idea.

“Christ hath redeemed us from the curse of the law, being made a curse for us: for it is written, Cursed is every one that hangeth on a tree:” Galatians 3:13 (KJB)

The early First Century Christians never used the cross as a sign or symbol for anything, why? Because it was the instrument of the torturous death of Jesus of Nazareth.

The cross as iconic symbolism would not appear until biblical Christianity was hijacked by the Romans around 325 AD. From that point on you see crosses on everything as Rome infused paganism with Christianity.

The bible tells us that the cross is the sign of a curse, and cursed people hang on them. No one in their right minds who believed the bible would want the sign of a curse hanging around their own necks, much less wearing an upside-down cross like the pagans / satanists do.

I will let you make up your own mind as to why Melinda Gates chose to wear an upside-down cross on national television.

I know she went to Catholic school, and that she and Bill have raised their children as Catholics.

But when you look at the millions of dollars they give to Planned Parenthood, an organization that exists to slaughter children in the womb, exactly what kind of Catholic she is gets a little murky, to say the least.

The Roman Catholic Church, what I like to call counterfeit Christianity, loves weird occult and pagan symbolism.

Over the years we’ve shown you the Vatican Audience Hall that is shaped exactly like a giant snake, and has the freakiest, most nastiest-looking statue right behind here the pope sits. [It’s also worth mentioning that the pope’s throne has a massive inverted cross on it.]

Occult symbolism pervades the Vatican to a very high degree. Melinda Gates is a Catholic, you do the math.

Melinda Gates on pandemic: ‘We haven’t had leadership at the national level … it’s chaos’

FROM TODAY: As part of our coronavirus series The Search for Solutions, TODAY’s Savannah Guthrie spoke exclusively to Melinda Gates, who is working to address the pandemic through the Bill and Melinda Gates Foundation.

She says there are “a few good candidates” for a vaccine and that the U.S. needs “to start looking at a paid medical leave policy” to help workers on the front lines.

She also criticizes the Trump administration for its response to the crisis: “We haven’t had leadership at the national level … it’s chaos.” (Read more)

I will include the top comments just incase they decide to close the comments section:

Source: Nowtheendbegins.com",5,Low,,USA,0
