news_id,url,publisher,publish_date,author,title,image,body_text,news_guard_score,mbfc_level,political_bias,country,reliability
8,http://www.presstv.com/Detail/2020/05/24/626028/URL:-US-Israel-China-investment,Press TV,2020-05-24,[],US asks Israel to sever burgeoning ties with China: Paper,https://cdn.presstv.com/Photo/2020/5/24/b1765650-84fe-458f-9080-6e4bdee8793b.jpg,"The United States has asked Israel to sever ties with China in areas which entail security risks, the Jerusalem Post reports.

Citing an unnamed US official, the Israeli daily revealed that the Trump administration has asked Israel to take concrete steps to reduce its ties with China.

So far, “the Israeli side has politely acknowledged our concerns without committing to action,” the unnamed official said.

“I don’t think polite deflection will cut it anymore,” the official said, adding ""this is a high priority for the US.”

One industry that the US has pinpointed as particularly sensitive is technology, so much so that the US has been eyeing Chinese-Israeli joint academic research in the field, the report said.

The US is especially concerned with the billions of dollars Chinese companies have invested in technologies that Israel has classified as commercial, but could be used by Chinese intelligence, like artificial intelligence, satellite communications and cybersecurity.

The demand came just days after US Secretary of State Mike Pompeo visited the occupied territories and asked Israel to reconsider its joint projects with China in areas with security risks and sensitivities for the US, including academic projects and technological research and development.

In previous public statements, US Ambassador to Israel David Friedman and other State Department officials had focused on the establishment of a more robust review process for foreign investments that could pose risks, and a reduction of reliance on China for emergency equipment in light of the coronavirus pandemic.

The US and Israel share some of the most sensitive intelligence with one another. In addition, American contractors sell Israel some of the most classified military hardware and weapons in the US like the F-35 fifth-generation stealth fighter jet, according to the Israeli daily.

The US is concerned that with China building most of Israel’s infrastructure – roads, trains, tunnels, ports and more – it will eventually gain access to the lines of communication through which Israel and the US communicate intelligence with one another. That is something that Washington will not tolerate, said the report.

For too long, Israel has cozied up to China while ignoring potential ramifications or fallout with its greatest ally, the United States, the newspaper said.

However, Tel Aviv could be on a collision course with Washington unless tight restrictions are imposed on Chinese investment in Israel, because the US president sees this both as a geopolitical security threat and a distraction from accomplishing the objectives of his trade war with China.

According to Israel's Army Radio on Tuesday, Tel Aviv has asked Washington for compensation in exchange for reducing ties with China - an offer that the US reportedly rejected.

The ongoing friction between the US and China has escalated in recent months in the wake of the COVID-19 outbreak, and the US has put pressure on many of its allies as a result.

The US has accused China of hiding news of the original outbreak of the novel coronavirus from the world.

President Trump has long called COVID-19 a “Chinese virus,” going so far as to accuse Chinese President Xi Jinping of standing behind a “disinformation and propaganda attack on the United States and Europe.”

The current venomous rhetoric by Trump and his allies about China’s “culpability” for the COVID-19 pandemic has led to strong reactions from Chinese officials.

China's Ambassador to Israel Du Wei, who was found dead in his official residence in Herzliya last Sunday, had made a high-profile defense of his country’s response to the coronavirus pandemic.

In an interview with Israel's Makor Rishon newspaper in April, Du addressed the matter of Chinese investments in Israel, expressing hope for further cooperation.

He also expressed hope to strengthen the ties between Israel and China, addressing the accusations leveled at his country as being the one responsible for the outbreak of the virus.

Mystery and speculation surrounds the death and comments from readers under an online article in the Jerusalem Post included: “Something smells fishy here.”

Another said there was “a long list of suspects,” and the envoy’s death was like something in a spy movie, or the US murder investigation show CSI (Crime Scene Investigation).

Others suggested a link to Pompeo’s recent whirlwind visit to Israel, during which he was overtly critical of China, and demanded that Israel stop sharing confidential military information with Beijing.",17.5,Low,Right,Iran,0
9,http://www.presstv.com/Detail/2020/05/24/626007/US-Joe-Biden-Bernie-Sanders-Hawaii-Democratic-presidential-primary,Press TV,2020-05-24,[],Joe Biden wins Hawaii Democratic presidential primary,https://cdn.presstv.com/Photo/2020/5/24/cfc965a8-b549-43ce-8263-ffac487d7509.jpg,"Former US Vice President Joe Biden has won Hawaii’s Democratic presidential primary, the state Democratic Party announced Saturday.

Biden won 63.2% of the final vote on the ranked-choice ballot, while Vermont Sen. Bernie Sanders, who ended his presidential campaign last month, earned 36.8%.

Sanders formally endorsed Biden on April 13, but will continue to stay on the ballot in upcoming primaries to earn delegates for his representatives to have a seat on important Democratic National Convention committees.

Biden got 16 of Hawaii’s delegates and Sanders will earn eight. Currently, Biden has a total of 1,566 delegates to the party’s national convention, but needs 1,991 delegates to win the nomination.

Hawaii's primary was originally scheduled for April 4, however, due to the coronavirus pandemic, the Democratic Party of Hawaii canceled in-person voting and instead transitioned to an entirely vote-by-mail system.

Over 79,000 ballots were sent to the state party and nearly 35,000 were returned by mail by Friday which was the deadline, according to the announcement.

""Due to the COVID-19 pandemic, on-site same-day voting on April 4th has been cancelled. Instead the Party will send a third mailing of ballots out. ...The mail-ballot return deadline is May 22, 2020. Results will be tabulated and released on May 23, 2020,"" the Democratic Party of Hawaii said in a statement from late March.

Biden's win in Hawaii comes after another victory in Oregon's presidential primary that was also held entirely vote-by-mail earlier this week.",17.5,Low,Right,Iran,0
10,http://www.presstv.com/Detail/2020/05/22/625903/US-support-Israel-annexation,Press TV,2020-05-22,[],US support for Israel’s West Bank annexation anything but ‘peaceful’,https://cdn.presstv.com/Photo/2020/5/22/9e159a00-f49b-491e-a999-d47f8698d3c3.jpg,"By Randi Nord

As millions of Palestinians living in occupation or exile around the world remember the beginning of the Nakba, the Israelis seem determined to keep the 1968 tragedy alive.

US Secretary of State, Mike Pompeo, met with Israeli government leaders last week to discuss moving forward with their so-called “peace plan” of annexing nearly 30% of the West Bank.

Annexation and the Israeli settlements in the West Bank are both illegal under international law (not to mention the countless war crimes Israeli soldiers and settlers commit in Gaza and the West Bank).

Unsurprisingly, Palestinians have condemned the potential annexation, as have EU officials and Jordan.

But will the Israelis actually follow through with their plans to annex the land? And if so, will that trigger an Intifada or broader regional conflict?

Capitalizing on the chaos of coronavirus

The Zionist entity has already exploited COVID-19 to tighten its grip on the Palestinians.

During the pandemic, Tel Aviv has shut down Palestinian testing sites, restricted medical aid from entering Palestinian territories, continued arresting Palestinians, and refused to release prisoners.

By closing the borders and clamping down on medical aid, Israel can weaponize the coronavirus as a biological weapon for ethnic cleansing. Following suit, the Trump regime blocked COVID-19 assistance to Gaza claiming it would be used for “terrorism.”

However, Tel Aviv also sees it as an ideal opportunity to move forward with annexation.

Most countries around the world are preoccupied fighting their own battles against the pandemic. Israel, on the other hand, is on the downswing with cases flattening. The coronavirus serves as a perfect distraction for Israeli crimes to slip under the radar.

Last week, the Zionist entity approved an additional 7,000 settlements in the West Bank in preparation to vote on annexation.

Will the Israelis actually follow through with it?

The Zionist push for annexation rides on a wave of right-wing populism around the world.

After over a year of political deadlock and three elections, Benjamin Netanyahu and his right-wing Likud party have reached an agreement to form a coalition government with rival Benny Gantz of the centrist Blue and White party.

On the backdrop of a corruption investigation, Netanyahu faces pressure from his right-wing voting bloc to follow through with reactionary campaign promises such as annexing Palestinian land. One poll found that roughly half of Israeli Jews support annexing West Bank land so long as Washington is on-board.

Netanyahu also must maintain a right-wing strongman posture against centrist Gantz.

However, annexing the West Bank might not necessarily work in Israel’s favor. Several Palestinians already live in the West Bank so Tel Aviv will either need to forcibly remove them or integrate them as Israeli citizens. While it’s certainly not below Israeli standards to violently remove Palestinians, it might prove more trouble than it’s worth should Palestinians put up a fight.

On the other hand, integrating West Bank Palestinians as Israeli citizens would give them voting rights and effectively disband the two-state solution. This is one reason even many reactionary right-wing Israelis don’t support annexation at this time.

If the Israelis are simply looking for US support, however, they’ll have no shortage of that for the foreseeable future.

The Trump regime has declared its unwavering support for the Zionist entity at every turn imaginable. Washington already moved its embassy from Tel Aviv to Jerusalem al-Quds despite outcry from EU allies and Palestinians. Not only does Donald Trump seems poised to secure another four years in the White House, but even Democratic opposition candidate Joe Biden has openly admitted he will not move the US embassy back to Tel Aviv.

So if all they’re waiting for is US support, the Israelis have plenty of that. Whether or not the Israeli legislature will support the motion remains to be seen.

How will Israeli neighbors and allies respond?

Jordan’s King Abdallah told German outlet Der Spiegel he would consider “all options” should Israelis vote to move forward with their annexation plans.

Jordan has been Israel’s most vocal neighbor to condemn the annexation plans – and for good reason.

The Hashemite Kingdom of Jordan shares a 335km land border with Israel and the occupied West Bank. The territory Israel plans to annex includes a 97km stretch of that land border in the Jordan Valley.

King Abdallah no doubt considers the annexation a direct threat to his own country’s security and entire existence. In previous Israeli- and US-led discussions about the so-called Deal of the Century, officials floated the idea of pushing exiled Palestinians from the West Bank into Jordan, effectively creating a defacto “Palestinian” state inside Jordan.

But it’s not the 1970s anymore and Jordan has minimal leverage. Resisting annexation by cancelling current peace agreements with Israel would put Amman at odds with Washington: Jordan’s single-largest financial supporter. The United States provides over $1 billion in assistance to Amman every year.

The Trump regime has shown it’s not afraid to cut off financial support to entities and organizations that don’t bend to US pressure. Just last month, Washington ended support for the World Health Organization, claiming the WHO was colluding with China in regard to COVID-19.

Taking a stand against Washington and Tel Aviv on annexation would likely force Jordan to commit entirely and realign its geopolitical allies.

Other neighbors have remained fairly mum about the whole thing.

Anyone waiting for Riyadh to wield their financial and political power shouldn’t hold their breath. Unsurprisingly, nothing but crickets has come out of Saudi Arabia.

On the contrary, Crown Prince, Mohammed bin Salman, has strengthened Riyadh’s diplomatic ties with Tel Aviv over the past few years, cooperated with Israel on matters of “security,” and implied it’s time to abandon the Palestinian cause.

It’s worth mentioning that dozens of Palestinian prisoners languish in Saudi jails for “terrorism” charges, proving Riyadh has no problem carrying out Israeli policy in its own land. Of course, there’s also the question of Yemen where Saudi Arabia takes notes directly out of Israel’s genocidal playbook.

An Arab League delegation consisting of officials from Oman, Kuwait, and Qatar met with UN Secretary-General Antonio Guterres in early May to discuss their concern with Israel’s planned annexation. The Arab group released a statement condemning the annexation plans as illegal and detrimental to peace in the region.

For his part, UN Secretary-General Guterres said the annexation will end any potential two-state solution and future peace negotiations.

Egypt, another key Israeli ally and accomplice in many cases, expressed its disdain for Tel Aviv’s plans to annex the West Bank. However, Egyptian officials have not provided any potential response from Cairo should Israel follow through with the plans.

Like Jordan, Egypt’s hands are tied as it relies on the United States for financial assistance: Washington has provided Cairo with $70 billion in economic and military aid since 1980.

Over the past few decades, Washington has successfully kept Israel’s neighbors docile through financial support with political strings attached. While many neighboring countries have condemned Israel’s annexation plans, it’s hard to see a situation where any real action is taken.

European Union foreign ministers have discussed imposing sanctions against Israel if the Zionist entity completes the proposed annexation this summer. Such sanctions could result in the EU removing Israel from certain research programs and agreements.

While not all EU members support sanctions, the EU as a whole seems to agree that annexation is a step away from peace.Washington’s unwavering support for Israel – such as moving the embassy, tearing up the JCPOA, and now the so-called Deal of the Century – continues to put the US at odds with its western allies.

How will Palestinians respond?

The Israelis and their allies in Washington seem to underestimate the resilience of the Palestinian people.

A poll out of the Palestinian Center for Policy and Survey Research found that a whopping 94% of Palestinians reject the plan. Meanwhile, 64% waging an armed struggle to resist implementing the so-called Deal of the Century, which involves annexation.

Even president of the Palestinian Authority, which colludes with Israeli security and effectively carries out Israeli repression in Gaza, condemned Israel’s annexation plans. In April, Mahmoud Abbas saidif the Zionist entity moves forward with annexation, “we will disengage from all commitments and agreements.”

Abbas Hamideh, founder of Al-Awda: The Palestine Right to Return Coalition, says the Zionist entity will go through with their West Bank annexation if the international community doesn’t step in to stop them:

“Unfortunately, Palestinians are limited in responding and cannot do much about it as they are powerless against the overwhelming Zionist occupier. Other than speaking out with their voice, there will be very little they can do.”

Annexation is anything but peaceful

Annexing any part of the West Bank is aggressive and violent on multiple levels. The United Nations has condemned Zionist settlements in the West Bank and declared them illegal on multiple occasions.

Under the so-called peace plan, these areas of the Jordan Valley flagged for annexation are rich in resources and prime locations for agricultural development. Kicking Palestinians out and telling them to make do with the rest would set up their state for failure.

The so-called Deal of the Century also demands that a future Palestinian state have no functioning airport or even military. What sovereign country isn’t “allowed” to have a military or even an airport?

If the Zionist entity moves forward with annexation, it will no doubt expel Palestinians violently from their homes, killing many in the process and forcing neighbors like Jordan and Lebanon to take in even more Palestinian refugees.

Lebanon, Jordan, and Syria are already housing thousands of Palestinians living in exile waiting to return to their homes – their right to return is guaranteed to them according to the Fourth Geneva Convention.

Following through with annexation is a violent and aggressive act – not only against Palestinians but also for Israel’s neighbors and European allies. It seems the US is the only entity supporting them openly at this point.

Randi Nord is the founder of Geopolitics Alert Independent World News where she covers US foreign policy in the Middle East with a special focus on Yemen. Randi's work has appeared in MintPress News, Yemen Press, Al-Akhbar al-Yemeni, and many others.

(The views expressed in this article do not necessarily reflect those of Press TV.)",17.5,Low,Right,Iran,0
11,http://www.presstv.com/Detail/2020/05/22/625908/Yemen-UN-covid,Press TV,2020-05-22,[],UN says Yemen’s health system ‘has in effect collapsed’ as COVID-19 spreads,https://cdn.presstv.com/Photo/2020/5/22/9057c065-fecb-4892-92ef-820fb0b1d450.jpg,"The United Nations warns that urgent funding is needed to contain the novel coronavirus outbreak in Yemen, where the healthcare system has collapsed as a result of the Saudi-led coalition’s devastating campaign.

Many of the aid agencies operating in Yemen say the country is “really on the brink now,” Jens Laerke, spokesman for the UN Office for the Coordination of Humanitarian Affairs (OCHA), told a Friday briefing in Geneva.

“The situation is extremely alarming, they are talking about that the health system has in effect collapsed,” he said, quoting the aid agencies working in the war-torn state.

Laerke went on to say that aid workers have to turn people away because they say they do not have enough medical oxygen or sufficient supplies of personal protective equipment.

His comments came shortly after Doctors Without Borders, also known by its French acronym as MSF, said its main COVID-19 treatment center in southern Yemen has recorded at least 68 deaths in just two weeks.

“What we are seeing in our treatment center is just the tip of the iceberg in terms of the number of people infected and dying in (Aden),” MSF’s operations manager for Yemen Caroline Seguin said Thursday.

The COVID-19 disease has further deteriorated the humanitarian situation in Yemen, where 80 percent of the population are reliant on international aid for survival.

Early this week, the UN's Food and Agriculture Organization (FAO) warned that Yemen’s health system was already under heavy stress and would now be overwhelmed “if COVID-19 continues to spread.”

The so-called regime led by Yemen's former President Abd Rabbuh Mansur Hadi in Aden has since April 10 announced 180 infections and 30 deaths from the coronavirus.

But the MSF said Thursday that its center in Aden had admitted 173 patients from April 30 to May 17, at least 68 of whom had lost their lives, suggesting “a wider catastrophe unfolding in the city.”

Since March 2015, Yemen has been heavily invaded by a military coalition led by Saudi Arabia, trying to restore power to Hadi.

The US-based Armed Conflict Location and Event Data Project (ACLED), a nonprofit conflict-research organization, estimates that the war has claimed more than 100,000 lives over the past five years.",17.5,Low,Right,Iran,0
12,http://www.presstv.com/Detail/2020/05/21/625848/Yemen-COVID-19-MSF-Saudi-Arabia-Hadi-Aden-Hothis,Press TV,2020-05-21,[],MSF: Scores died of COVID-19 in southern Yemen in just two weeks,https://cdn.presstv.com/Photo/2020/5/21/27c4ee41-7793-4005-a8bf-f86802507bae.jpg,"Doctors Without Borders (MSF) says its main COVID-19 treatment center in southern Yemen has recorded at least 68 deaths in just two weeks.

“What we are seeing in our treatment center is just the tip of the iceberg in terms of the number of people infected and dying in (Aden),” MSF’s operations manager for Yemen Caroline Seguin said Thursday.

Since March 2015, Yemen has been heavily invaded by a military coalition led by Saudi Arabia, trying to restore power to ex-Yemeni president Abd Rabbuh Mansur Hadi.

The Saudi coalition also aims to crush the popular Houthi Ansarullah movement, whose fighters have helped the Yemeni army defend the country against the invaders.

Ceaseless Saudi airstrikes and the destruction wrought by the kingdom's mercenaries and armed militia loyal to Hadi have wiped out much of Yemen’s infrastructure, destroying hospitals, schools, and factories.

The COVID-19 disease has further deteriorated the humanitarian situation in the impoverished country, where 80 percent of the population are reliant on international aid for survival.

Early this week, the UN's Food and Agriculture Organization (FAO) warned that Yemen’s health system was already under heavy stress and would now be overwhelmed “if COVID-19 continues to spread.”

The so-called regime led by Hadi in Aden has since April 10 announced 180 infections and 30 deaths from the coronavirus.

But the MSF said Thursday that its center in Aden had admitted 173 patients from April 30 to May 17, at least 68 of whom had lost their lives, suggesting “a wider catastrophe unfolding in the city.”

Even so, inadequate testing capacity made it hard to pin down exact numbers but dying patients “clearly have the symptoms of COVID-19”, it said.

The MSF said endemic diseases like malaria and dengue “never produced so many deaths in such a short amount of time” in the Arab country.

“People are coming to us too late to save, and we know that many more people are not coming at all: they are just dying at home,” the medical charity further said.

The US-based Armed Conflict Location and Event Data Project (ACLED), a nonprofit conflict-research organization, estimates that the war has claimed more than 100,000 lives over the past five years.",17.5,Low,Right,Iran,0
13,http://www.presstv.com/Detail/2020/05/23/625972/basketball-coronavirus-test-Ewing-NBA,Press TV,2020-05-23,[],Basketball legend Patrick Ewing tests positive for Covid-19,https://cdn.presstv.com/Photo/2020/5/23/af5926b6-3a63-409e-a1a0-c2f59ccf1197.jpg,"NBA and the New York Knicks legend Patrick Ewing has announced that he has tested positive for the coronavirus.

Ewing who is currently the head coach of the Georgetown University basketball team, is the only person of the university’s program to have tested positive for the virus and is being isolated in a local hospital.

Ewing played 17 seasons as a center in the NBA and scored 25 thousand points and had more than 11 thousand rebounds. He was also selected as an NBA all-star 11 times and won two Olympic gold medals with team USA.

The New York Knicks great who also won the NCAA championship in 1984 said that he’s fine and is looking to return to action as soon as possible.",17.5,Low,Right,Iran,0
14,http://www.presstv.com/Detail/2020/05/20/625774/COVID-19-Premier-League-coronavirus-,Press TV,2020-05-20,[],Soccer players' mental health at risk during coronavirus shutdown,https://cdn.presstv.com/Photo/2020/5/20/c025a8a2-a757-40d7-9c40-302e5b5a6b10.jpg,"With soccer suspended due to the COVID-19 pandemic, players are worried about their careers and some have become depressed and are considering self-harm, the PFA’s director of player welfare has said.

Professional soccer has been suspended since March and with no clear date set for a return, Michael Bennett says the uncertainty has led to anxiety.

“They don’t know if they’re going to go back to football, they don’t know if the football season will start again, they’re not sure what’s going on,” he added.

“There are financial situations with clubs furloughing players, there is deferral of wages. We’ve got a number of players who are living from paycheck to paycheck and this is having a real impact on them emotionally.

“Also health issues – if we do go back to the season, can it work? Will it work? What about my family? All those sort of ‘what if?’ questions kept coming up.”

The Premier League hopes to restart the season in June with matches to be played without fans at stadiums, while the second-tier Championship clubs will vote this week on how to conclude the season.

(Source: Reuters)",17.5,Low,Right,Iran,0
