news_id,url,publisher,publish_date,author,title,image,body_text,news_guard_score,mbfc_level,political_bias,country
10,https://theduran.com/coronavirus-poverty-increase-has-not-reduced-the-influence-of-u-s-military-establishment/,The Duran,2020-05-22,[],Coronavirus poverty increase has not reduced the influence of U.S. military establishment,https://149425939.v2.pressablecdn.com/wp-content/uploads/2020/05/A-US-corona-arms.jpg,"Submitted by InfoBrics, authored by Paul Antonopoulos, independent geopolitical analyst…

The World Bank warns that there is a global poverty increase as tens of millions of people have fallen back into poverty because of the pandemic. Up to 60 million people worldwide may fall into extreme poverty due to the coronavirus, said David Malpass, head of the World Bank.

“Our estimate is that up to 60 million people will be pushed into extreme poverty, erasing all the progress made in poverty alleviation in the past three years, and our forecasts indicate a deep recession,” Malpass said on Tuesday.

According to him, the bank is trying to help people by providing loans in 100 countries and pledged to provide $160 billion in loans up to mid-2021. Malpass did add that these efforts were not enough. He called on creditor countries to join the G20 initiative – a ban on debt repayment for some developing countries.

The most severe challenges are developing countries. It has been predicted that in Africa tens of millions of people will earn less than the minimum income, that is, below the poverty line. But in many ways, the function of these forecasts is that they show what will happen if we do nothing. It will be difficult to prevent the development of this scenario, but with the joint efforts and cooperation of the whole world, there are legitimate grounds to prevent the most negative consequences.

However, we imagine that poverty only increases in the developing world. Morgan Stanley investment bank found that the global economy will only return to pre-crisis state in the third quarter of 2021. Deutsche Bank even launched more pessimistic forecasts – by the end of next year, developed countries’ GDP will be $1 trillion lower than 2019.

The World Trade Organization has warned that international trade will experience the deepest recession since World War II. The International Monetary Fund on April 14 said the total damage will be greater than the bank’s assessment. As stated by IMF chief economist Gita Gopinat, we are talking about $9 trillion dollars. According to the IMF, by the end of 2020, the global economy will lose 3%. This is a significant amount considering that during the Global Financial Crisis in 2009, the downturn was 0.08%.

This has exposed that the liberal global economic order is extremely vulnerable. The U.S. economy will fall by 5.9%, firstly by a quarterly sharp decline. Based on JPMorgan’s forecast, this index will reach 40%. Analysts surveyed by Bloomberg believe Europe will lose 8.3% of its GDP in the next few months. In total, from January to July, this figure will reach 10% and by the end of the year will be 5.2%. Italy and Spain will suffer the most, with GDP declines of 7.3% and 5.7%, respectively.

Pre-coronavirus data found that in the U.S. 16.2% of children lived in poverty, that is almost 1 in 6 children, with 2.5 million children experiencing homelessness in 2015. 29.9% of Americans live close to poverty while 5.3% of the population live in deep poverty. In addition, in 2018, 11.1% of American households, were food insecure, meaning they had difficulty providing enough food for all people within the house. Earlier this month the unemployment rate in the U.S. reached 14.7% with the Federal Reserve estimating it could reach a high of 25%. With the coronavirus devastating the U.S. and global economy, it can only be expected that these shocking poverty figures in the world’s richest and most powerful country will only increase significantly – this is not a problem only for the developing world.

Despite the increasing poverty and unemployment, there has been no discussion on significant scaling back the U.S.’ global militarism. In 2015, the U.S. had around 800 military bases in 50 foreign countries with 250,000 soldiers spread between them. There is little suggestion that these statistics have changed since then.

The U.S. is continuing its aggression around the world by orchestrating coup attempts in Venezuela, continual backing of jihadist groups in Syria, and sanction regimes against several countries. It appears as the U.S. economy continues to decline and large segments of the American people go deeper into poverty or enter destitution, Washington has no plans to carry out cost saving measures by reducing its monopoly of foreign bases around the globe or drawback its aggression against non-compliant independent states.

In January 1961, U.S. President Dwight D. Eisenhower used his farewell address to warn that “an immense military establishment and a large arms industry” had emerged as a hidden force in U.S. politics and that Americans “must not fail to comprehend its grave implications.” Despite Eisenhower’s warning, it appears the American people have failed to understand its implications as profits for arms industries has taken precedence over poverty reduction that was caused by the failures of the Western liberal economy in handling the corovirus pandemic. The U.S. hegemony of foreign military bases and perpetual war is one to serve the profits of private arms companies at the expense of the American people.

Liked it? Take a second to support The Duran on Patreon!

Read Later Add to Favourites Add to Collection Report",17.5,Low,Extreme right,Cyprus
11,https://theduran.com/quarter-of-americans-have-no-interest-in-taking-covid-vaccine/,The Duran,2020-05-22,[],Quarter Of Americans Have No Interest In Taking COVID Vaccine,https://149425939.v2.pressablecdn.com/wp-content/uploads/2020/05/vaccine20rtrs.jpg,"Ron Paul recently warned “rushed-into-production” vaccines for other viruses have had disastrous health consequences for some people…

President Trump’s “Operation Warp Speed,” a public-private partnership to develop a vaccine and ready it for mass production by early 2021, has generated anti-vaccine concerns among some Americans, a new survey finds.

The survey, published via Reuters/Ipsos on Thursday, found 25% of Americans have no interest in taking a coronavirus vaccine.

About 36% of respondents said they would be less willing to take a vaccine if President Trump said it was safe. Only 14% said they would be interested.

Reuters/Ipsos surveyed 4,428 Americans between May 13-19 said they would need to review additional research on the vaccine to determine if it was safe.

A little less than 66% were “very” or “somewhat” interested in a vaccine if made readily available.

Dr. William Schaffner, an infectious disease expert at Vanderbilt University Medical Center in Nashville, told Reuters, considering there are 92,000 virus-related deaths, he thought there would be a much higher amount of people that would want the vaccine.

“It’s a little lower than I thought it would be with all the attention to COVID-19,” said Schaffner. “I would have expected somewhere around 75 percent.”

The survey found 14% were not interested at all, 10% were not very interested, and 11% were unsure about subjecting themselves to a vaccine.

Health experts tell Reuters that, “at least 70% of Americans would need to be immune through a vaccine or prior infection to achieve what is known as “herd immunity,” when enough people are resistant to an infectious disease to prevent its spread.”

President Trump’s Operation Warp Speed program aims to produce 300 million doses of a vaccine by January, a goal that we’ve said is widely unrealistic.

The president’s constant hype of vaccines has led some people to believe many of the drugs in development are being rushed and could have dangerous side effects. Ron Paul recently warned “rushed-into-production” vaccines for other viruses have had disastrous health consequences for some people.

Nearly 84% of respondents said vaccines for measles are safe, suggesting that people are doubtful about a rushed vaccine for COVID-19. Of the folks who were “not very” interested in taking the vaccine, 29% of them said they would reassess their thoughts once the FDA approved it.

Peter Hotez, dean of the National School of Tropical Medicine at Baylor College of Medicine, where his staff is currently developing a vaccine, said:

“It’s not surprising a significant percentage of Americans are not going to take the vaccine because of the terrible messaging we’ve had, the absence of a communication plan around the vaccine and this very aggressive anti-vaccine movement.”

The poll underlines how political divides among Democrats and Republicans predate the pandemic, but lockdowns have since catalyzed new divides and exacerbating old ones. That being, nearly 20% of Republicans said they had no interest in a vaccine, which was more than double the proportion of Democrats who said the same.

With creepy billionaire Bill Gates and big government rushing vaccines into development and for possible mass production next year — the anti-vaccine movement in America continues to grow.

https://www.zerohedge.com/health/quarter-americans-have-no-interest-taking-covid-vaccine

Liked it? Take a second to support The Duran on Patreon!

Read Later Add to Favourites Add to Collection Report",17.5,Low,Extreme right,Cyprus
12,https://theduran.com/why-did-european-leaders-approval-ratings-rise-during-lockdown/,The Duran,2020-05-22,['Greg'],Why did European leaders’ approval ratings rise during lockdown?,https://149425939.v2.pressablecdn.com/wp-content/uploads/2020/05/773x435_cmsv2_790b8bb3-6fac-5a5e-ae88-7c07b7044ed9-4670396.jpg,"European leaders have enjoyed higher poll numbers during the coronavirus pandemic despite having some of the highest COVID-19 deaths per capita in the world.

Latest polling data shows governing parties in the UK, Germany, Italy and France have had a popularity boost during national lockdowns.

“This is the most serious crisis that has hit Europe since the Second World War,” said Daniele Albertazzi, a political scientist from the University of Birmingham.

“It is quite well-known that in times of crisis, people do tend to rally behind the flag and the government of the day.”

Some European governments’ use of wartime metaphors could also have helped them to avoid scrutiny and maintain their popularity during the COVID-19 pandemic by convincing people they needed to come together to defeat the virus.

“Governments have been very shrewd and clever in exploiting this and using metaphors that remind people of war-time periods, so the virus has become an enemy that the population has to defeat by pulling together.”

“Right now people on the streets are saying that this is not the moment to have a go at the government.”

Matthew Goodwin, a political scientist at the University of Kent, said that during moments of crisis “voters tend to rally around their incumbents”.

“This is especially likely to occur when voters face a big external ‘threat’, like terrorism and now a pandemic. I think the wartime rhetoric encouraged this, but we would most likely have seen a rally effect regardless,” Goodwin said.

Boris boost?

According to Opinium, the popularity of the UK’s ruling Conservative Party jumped from a 49% share before the lockdown was introduced, to 54 per cent afterwards. The main opposition Labour Party saw its figures drop by 4 per cent over the same period.

The Conservative Party’s leap in popularity could be explained by the rallying around the flag effect detailed by Albertazzi and Goodwin.

But it could also be linked to sympathy towards UK Prime Minister Boris Johnson, who was hospitalised with COVID-19 on April 5 — around the time the party’s fortunes peaked — and later spent time in intensive care.

Speaking in mid-March, Johnson said of COVID-19: “This is a disease that is so dangerous and so infectious that without drastic measures to check its progress it would overwhelm any health system in the world.

“I have used the Italian health system, it is excellent, and the problem is not the health system, it’s the numbers of sufferance.

“That is why we announced the steps yesterday that we did – advising against all unnecessary contact – steps that are unprecedented since world war two.

“We must act like any wartime government and do whatever it takes to support our economy.”

Macron and Merkel make gains

Meanwhile, in France, President Emmanuel Macron’s ratings improved by an average of 10% after the country imposed a national lockdown on March 17.

The numbers have fallen over the course of the lockdown, but Macron still enjoys marginally higher ratings than before the COVID-19 pandemic.

During his speech to impose lockdown, Macron repeatedly used the phrase “nous sommes en guerre (“We are at war”).

But the most noticeable increase in support for the government is in Germany, where the CDU/CSU of Angela Merkel has risen, since the start of March, from a 24% to a 38% vote share.

Meanwhile, no other major political party in Germany has seen an increase in ratings, and Die Grunen (Greens) have fallen 7%, according to the survey institute, Kantar Emnid.

How did leaders in Italy and Spain fare?

Support for Italian Prime Minister, Giuseppe Conte, has also increased, while the ruling social democratic parties in Denmark, Sweden and Portugal had all improved by at least 4% in opinion polls by the end of March.

In Spain, public opinion in Pedro Sanchez’s Socialist Workers Party (PSOE) fell in the week before the national lockdown was introduced on the March 14, but has since slowly improved in April, according to ElectoPanel.

PSOE’s coalition partner Unidad Podemos has nevertheless seen a slight fall in opinion, but support has been steadily growing each week for Pablo Casado’s Partido Popular.

Will it last?

Analysts are suggesting these good numbers for governments will not sustain as the COVID-19 pandemic continues.

This “rally effect” of public support for incumbents “does now seem to be tailing off as voters begin to question their governments,” said Goodwin.

“Emmanuel Macron and Donald Trump, for example, are now suffering in the polls more than they were at the start of the crisis. This is important because we know that perceptions of competence -is a leader competently managing an important issue?- are very important to how people vote,” Goodwin added.

“You can see in countries like Italy, Switzerland, and Finland that there has been a short period of truce between governments and opposition or more radical and more moderate parties,” said Albertazzi.

“As weeks go past, people will start realising the enormous financial effect of the crisis and more and more stories emerge about the mishandling of the pandemic and the big mistakes that were made by governments”.

Populists fall but will return soon

Europe Elects data has also shown that a number of populist parties across Europe have fallen in opinion polls.

Matteo Salvini’s Lega Nord has fallen by roughly 4% since February, while VOX España, Alternative für Deutschland (AfD) and Marine le Pen’s Rassemblement National in France also suffered a decrease.

“Radical and populist parties seemed to have initially accepted that they needed to tone down their criticisms of governments or their opponents,” Albertazzi told Euronews.

But analysts do expect that populists will resume their communications soon, even though there are significant risks.

“It is easy to have a go at governments, opponents or the European Union,” said Albertazzi. “But there is certainly a risk that populists might jump on the bandwagon of criticism too early and misjudge the mood of the public.”

“This is a crisis of such huge proportions that we may still be in the stage where the public and business associations want to see more unity and division.”

But Albertazzi also noted that it is politically important for populist parties to change their stance as soon as possible.

“They have to demonstrate that they have remained fundamentally different from what they see as traditional parties, which they accuse of sticking to the same recipes.

“It is important that the voting public can see populists and radicals as something different, who are not taming their communications strategy.”

“When the immediate crisis passes and politics returns to some sense of normality, politicians are going to have to deal with the hangover,” said Euronews’ political editor Darren McCaffrey.

“More questions will be asked about how they dealt with the health crisis and how exactly they can help their economies bounce back while trying to get public finances in order.”

Liked it? Take a second to support The Duran on Patreon!

Read Later Add to Favourites Add to Collection Report",17.5,Low,Extreme right,Cyprus
13,https://theduran.com/chechen-leader-kadyrov-hospitalized-with-coronavirus-in-moscow-reports-the-moscow-times/,The Duran,2020-05-21,['Alex Christoforou'],Chechen Leader Kadyrov Hospitalized With Coronavirus in Moscow: Reports – The Moscow Times,https://i1.wp.com/theduran.com/wp-content/uploads/2020/05/0f67fc4089964e1a98a2c1666cf3ff3f2.jpg?fit=1360%2C765&ssl=1,"Doctors reportedly recommended that Kadyrov go to Moscow after his “condition began deteriorating rapidly.”

Chechen leader Ramzan Kadyrov has been hospitalized in Moscow with a suspected coronavirus infection, Interfax reported Thursday.

Kadyrov, 43, was reportedly flown to the Russian capital Wednesday, a few days after reporting flu-like symptoms, the Baza Telegram channel reported earlier Thursday. Chechen doctors recommended that Kadyrov seek treatment there after his “condition began deteriorating rapidly,” Baza said.

The Telegram channel cited medical data as saying that Kadyrov has been diagnosed with lung damage and a suspected Covid-19 infection.

“He is under doctors’ supervision,” Interfax cited its source as saying.

A well-known transport tracker said Thursday that a private jet linked to Kadyrov arrived at Moscow’s Vnukovo Airport from the Chechen capital of Grozny.

Kadyrov’s official page on Russian social network Vkontakte has posted several updates in the past 24 hours, including posts on his charitable donations and birthday greetings for Russia’s defense minister, but has not yet addressed his alleged infection.

Kadyrov was last active on his Telegram account on Tuesday, while Instagram blocked his page last week.

https://www.themoscowtimes.com/2020/05/21/chechen-leader-kadyrov-hospitalized-with-coronavirus-in-moscow-reports-a70339

Liked it? Take a second to support The Duran on Patreon!

Read Later Add to Favourites Add to Collection Report",17.5,Low,Extreme right,Cyprus
14,https://theduran.com/nicola-sturgeon-is-leading-her-country-out-of-lockdown-and-out-of-the-uk/,The Duran,2020-05-21,[],"Nicola Sturgeon is leading her country out of lockdown, and out of the UK",https://149425939.v2.pressablecdn.com/wp-content/uploads/2020/05/Nicola-Sturgeon.jpg,"Submitted by InfoBrics, authored by Johanna Ross, journalist based in Edinburgh, Scotland…

Scotland’s First Minister Nicola Sturgeon has been voted the UK’s ‘most impressive’ politician according to a recent poll. The survey, carried out by Press Gazette, asked 2700 people who they thought was doing best at handling the current crisis. Sturgeon came out top, with 29% of the vote, ahead of Chancellor Rishi Sunak and Labour opposition leader Keir Starmer. The poll follows on from a recent Scottish Government survey which gave Nicola Sturgeon a rating of 84% for her slow and measured approach to lockdown. For in defiance of Westminster’s lifting of lockdown restrictions earlier this month, Scotland has until now kept them in place, only hinting recently that some may be lifted on 28th May.

The statistics regarding Sturgeon’s performance will not come as a surprise to many, given the contrast with her Westminster counterpart. Boris Johnson has faced a barrage of criticism in recent weeks over his handling of the coronavirus pandemic in Britain. And with the highest death rate in Europe, and second highest death toll in the world, it’s no surprise that questions are being raised. Yet the PM has of late, not provided the consistent, strong leadership required at this time. In contrast to his Scottish counterpart, who gives a daily briefing on the Covid-19 situation in Scotland, without fail; Boris Johnson has not given a press conference for days, and has not been seen in public for days, prompting #WhereisBoris to trend on Twitter. The difference between the two leaders could not be greater; every time Boris puts a foot wrong, it boosts Sturgeon, and the case for Scottish independence.

Unlike the Scottish government, which has yet to make any change to the current social distancing guidelines, other than being able to leave home now twice a day for exercise – instead of once as previously stated – Boris Johnson announced last week that people from different households could now meet; that if required, workers could return to work, and that from 1st June some shops would reopen and some pupils would return to school. The messaging also changed – rather confusingly, from ‘Stay Home’ to ‘Stay Alert’ – with no-one quite clear as to what the latter actually means. The motivation for beginning to lift lockdown measures is no doubt, mainly, economic, with experts warning that the UK is headed for a recession like no other. But there are concerns that Johnson has acted too soon, as with the death toll rising to the virus every day, we could be faced with another ‘peak’ if we return to normality too soon.

For the reality is the virus is still with us, and is likely to remain with us for years to come. Boris Johnson himself gave the example of SARS, for which, he highlighted, a vaccine has not been found in the last 18 years. Although scientists across the globe are working tirelessly in a bid to discover a vaccine as soon as possible, there are no guarantees that they will succeed in the short term. The key in the meantime, will be testing – both for those infected with coronavirus and for immunity, with antibody testing. But the UK government has only recently started to take testing seriously. Early on in the pandemic it downplayed the importance of it, favouring ‘herd immunity ’instead. This was in contrast to countries like China and South Korea that saw testing as a vital way of managing the crisis. Back then, Britain’s Chief Scientific Advisor, Sir Patrick Vallance, said ‘We think this virus is likely to be one that comes year on year, becomes like a seasonal virus. Communities will become immune to it and that’s going to be an important part of controlling this longer term. About 60% is the sort of figure you need to get herd immunity’. Britain has paid dearly for this ‘laissez-faire approach.

The case against the UK government is building by the day. Aside from the overall death toll of 35, 341, it has been established that an additional 23,000 deaths took place this year in care homes. Far from putting a ‘protective ring’ around care homes as Health Minister Matt Hancock has said, the government has been accused of putting a ‘noose’ around them, with elderly patients effectively like sitting ducks in the wake of the pandemic. It has been observed that no real attempts were made to prevent the spread of coronavirus throughout Britain’s nursing homes, with patients regularly admitted into homes from hospital, without being tested for the virus. Recently it was even reported that Personal Protective Equipment originally intended for care homes was diverted to NHS hospitals. Justice Secretary Robert Buckland admitted on Wednesday that : “We needed to make a choice about testing, we did decide to focus upon the NHS.’

Choices indeed have been made. And increasingly, questions are being raised as to whether the right decisions have been taken – both before and during the pandemic. For at a time when the country is ‘clapping for carers’ every week, in a display of public support for NHS staff, the government is passing its immigration bill, targeting the very migrants who play such an important role in Britain’s health service. As MP Valerie Vaz put it: ‘With this immigration bill the government is effectively clapping them out of the country’. Indeed the harsh reality of Tory policy cannot be escaped during this pandemic. The under-funding of public services over the years, particularly the NHS, primarily by the Conservative government is manifesting itself during this crisis like at no other time. We have entered an era where capitalism is under more strain than ever, where the only solution to this crisis comes from state interference – with the transport industry to care homes to universities all set to require substantial financial aid to survive. A different Britain will emerge from the pandemic.

As for Scotland, it must decide whether it wants to continue being at the receiving end of Tory policies which favour business over people, or whether it will finally carve out for itself a fairer society with welfare at the fore. With a resurgence of coronavirus potentially looming on the horizon, I know which society I’d prefer to live in…

Liked it? Take a second to support The Duran on Patreon!

Read Later Add to Favourites Add to Collection Report",17.5,Low,Extreme right,Cyprus
