news_id,url,publisher,publish_date,author,title,image,body_text
68,https://www.npr.org/2020/03/21/819439661/a-look-at-the-covid-19-crisis-from-a-pharmacists-perspective,National Public Radio (NPR),2020-03-21,['Scott Simon'],A Look At The COVID-19 Crisis From A Pharmacist's Perspective,https://media.npr.org/include/images/facebook-default-wide.jpg?s=1400,"A Look At The COVID-19 Crisis From A Pharmacist's Perspective

Twila Boyd, a pharmacist in South Charleston, Ohio, explains what it's like to treat patients in the midst of the coronavirus outbreak.

SCOTT SIMON, HOST:

We've been hearing from health care workers of all kinds as they battle the coronavirus outbreak. Now a pharmacist, Twila Boyd - she owns the Charleston Pharmacy in South Charleston, Ohio, a town of about a thousand people. She joins us from her home now. Thanks very much for being with us.

TWILA BOYD: Well, thank you. I appreciate it.

SIMON: How have your days changed? - a whole lot busier?

BOYD: (Laughter) On Monday, we saw a 50% spike in our pharmacy volume. And it's continued the rest of this week - people trying to get their medications early or trying to get multiple months filled of their medications. So yes, it's been very interesting.

SIMON: Can you help them?

BOYD: Yes, we can. What we're trying to tell people - that if they just normally get a 30-day supply of their medication, it's best if they continue with that pattern. If you have people stockpiling, then that doesn't leave as much or anything left for the other ones later on. So it's like the grocery stores. But right now, we have medications. And we're doing fine. We're able to get things in. It may take us a couple of days to get something that we need. But we are able to get it in.

SIMON: People working for you - overextended, extra hours, extra stress?

BOYD: I think this is a very stressful time because a lot of their friends maybe are working from home, and they're feeling the stress of dealing with the population where somebody might be a carrier that doesn't have any symptoms. But right now, they're doing very well. There's a lot of cookies and cupcakes that are being brought in. And the people that come in are bringing - some of them will bring health cleaning supplies. So that's nice.

SIMON: Do you have any masks?

BOYD: No, we do not have any masks. We do have gloves. I do have a delivery driver that goes out every day Monday through Friday. And he does wear gloves. And he has a mask. So he can wear those no problem because he is dealing with the elderly. He's dealing with children or, you know, families. So he is trying to have minimal contact with them.

SIMON: Do you get new protocols all the time?

BOYD: Every day - yes, we do. The one that is really good is that we do not have to have everybody sign with either the pen pad with the pen or their finger. So we don't have people touching the machine constantly or one right after the other. Then other things - it's telling us that if you have the elderly, pregnant or somebody that is sick, if they come into the pharmacy, they would be waited on immediately. And then they would be ushered out of the pharmacy once they get their medication. So we don't really have anybody that sits in the pharmacy and waits for their medication. Most of the people just drop their prescriptions off and are leaving the pharmacy. So that is also good.

SIMON: Well, I guess we should note that Charleston Pharmacy - South Charleston, Ohio - is open for business.

BOYD: Yes, it is (laughter). Yes, it is. We are open. And it's always nice that - if you have a pharmacy - that you are familiar with the pharmacist, that if you have questions, you can call them, or you can talk to them. At this point, they're really very busy. And most of them are understaffed.

SIMON: Yeah.

BOYD: But during regular periods of time, if you have questions, you could always talk to the pharmacist because we are a wealth of knowledge. And we can certainly help you. Since we're usually the first ones - if someone is feeling sick...

SIMON: Yeah.

BOYD: ...They usually go to the pharmacy first. So if you think you might have it, we could help you with deciding whether you do have either the COVID-19, the flu or they just have a cold or if it's just allergy season. So we do see a lot of people coming in with runny noses right now.

SIMON: Twila Boyd owns and operates the Charleston Pharmacy - South Charleston, Ohio. Thanks very much. Good luck to you.

BOYD: Thank you very much.

(SOUNDBITE OF MUSIC)

Copyright © 2020 NPR. All rights reserved. Visit our website terms of use and permissions pages at www.npr.org for further information.

NPR transcripts are created on a rush deadline by Verb8tm, Inc., an NPR contractor, and produced using a proprietary transcription process developed with NPR. This text may not be in its final form and may be updated or revised in the future. Accuracy and availability may vary. The authoritative record of NPR’s programming is the audio record."
69,https://www.npr.org/sections/health-shots/2020/03/21/819207625/coronavirus-threatens-rural-hospitals-already-at-the-financial-brink,National Public Radio (NPR),2020-03-21,['Lauren Weber'],Coronavirus Threatens Rural Hospitals Already At The Financial Brink,https://media.npr.org/assets/img/2020/03/20/gettyimages-960990096_wide-4bc1a285e92389dd8cf2f2e4603d800085aa36fe.jpg?s=1400,"Coronavirus Threatens Rural Hospitals Already At The Financial Brink

Enlarge this image toggle caption Cavan Images/Getty Images Cavan Images/Getty Images

Rural hospitals may not be able to keep their doors open as the coronavirus pandemic saps their cash, their CEOs warn, just as communities most need them.

As the coronavirus sweeps across the United States, all hospitals are facing cancellations of doctor visits and procedures by a terrified populace — profitable services that usually help fund hospitals. Meanwhile, the institutions also find themselves needing to pay higher prices for personal protective equipment such as face masks and other gear that's in short supply. Vice President Mike Pence called on hospitals nationwide Wednesday to delay elective surgeries to free up capacity and resources for future coronavirus patients.

The American Hospital Association responded Thursday by asking Congress for $100 billion for all hospitals to offset coronavirus costs, citing rural hospitals' inability to withstand huge losses for long.

""If we're not able to address the short-term cash needs of rural hospitals, we're going to see hundreds of rural hospitals close before this crisis ends,"" warned Alan Morgan, the head of the National Rural Health Association, which represents 21,000 health care providers and hospitals. ""This is not hyperbole.""

Well before the COVID-19 threat, rural health care's profitability had collapsed nationwide due to a combination of narrowing Medicare reimbursements, a larger share of patients lacking high-paying private insurance and the hollowing out of rural America. Given such pressures, more than 120 rural hospitals have been forced to close over the past decade.

Those hospitals in small-town America that have survived rely heavily on moneymakers such as elective surgeries, physical therapy and lab tests to make their razor-thin margins work. But, according to the Chicago-based Chartis Center for Rural Health, almost half of them still operate in the red.

So the added financial hit from the coronavirus outbreak could be the final straw for many rural hospitals — exposing the complicated business dynamics at play within the United States' critical public health infrastructure.

""This virus, and what it is causing for these hospitals, is the perfect storm that will close these hospitals at a time this country critically needs them,"" says Robin Rau, CEO of Miller County Hospital in southwestern Georgia. ""This is going to be the death blow to them.""

Two weeks ago, she started eliminating all medical services that were not urgent. She estimates that has cut off at least half of the hospital's revenue. Other CEOs warned similar cuts at their hospitals mean they won't make payroll in the coming weeks.

The National Rural Health Association, along with many rural hospital executives, is lobbying for immediate cash assistance, no-interest loans, Medicare reimbursement adjustments and other suggestions to alleviate the pain. The association favors a bailout plan from Sens. John Barrasso, R-Wyo., and Michael Bennet, D-Colo., which in early drafts called for the equivalent of a three-month advance based on hospitals' previous patient numbers, according to Bennet's office.

""Rural hospitals have already been closing their doors at startling rates, and this crisis will only exacerbate that fact,"" Bennet tells KHN in a written statement. ""There is an incredible opportunity for rural hospitals to shoulder some of the burdens of caring for patients and helping to meet possible bed shortages.""

Still, many rural hospital CEOs worry any assistance may come too late.

""And yet I hear they're going to bail out the cruise lines? Really?"" Missouri's Scotland County Hospital CEO Dr. Randy Tobler says.

As Tobler looks at his older, sicker, underinsured patient population, he says he is afraid the hospital, located on the state's northeastern rural border, might last only until May before running out of money for payroll.

""In the truly safety-net areas, we're being called to high duty,"" he says. ""And we're running on fumes.""

Michael Purvis, CEO of Candler County Hospital in Metter, Ga., says he's already fallen into a negative cash flow situation in the past week. The number of patients coming to his hospital, which is about 65 miles outside Savannah, for profitable outpatient procedures has dropped by half as people in droves have canceled their surgeries, MRIs and physical therapy. Purvis has implemented fever checks of people at the entrance. But he remains fearful that his billing staff could be forced to quarantine themselves if they fall ill — effectively shutting off the hospital's revenue.

""If my billers and coders stay healthy, I can make it to April, maybe end of June,"" Purvis says.

On top of the massive loss of revenue, Julie Jones, CEO at Community Hospital-Fairfax in northwestern Missouri, says she can only get specialty N95 respirator masks that offer critical protection for her front-line providers for about $5 each — more than 16 times the normal cost of 30 cents.

Angela Ammons, CEO of Clinch Memorial Hospital in Homerville, Ga., says she has warned staff that if hand sanitizer and disinfecting wipes continue to go missing, she'll watch the video footage and fire on the spot anyone caught stealing supplies. And she is so worried about running out of protective equipment, she's asking any of her ""crafty"" staff with sewing machines to sew cotton masks.

""I would rather staff go in with a fabric mask than no mask at all,"" she says.

To be sure, rural hospitals are not as equipped as larger hospital systems to handle the most serious coronavirus cases. Many are not outfitted with ICUs or enough doctors and staff to handle multiple intensive care patients. That means they have to transfer those patients to larger hospitals.

Still, rural experts argue that their bed and health care capacity can be leveraged to keep potential coronavirus cases out of the major hospitals. Plus, rural facilities could be places for initial triage or eventual recovery care.

And if nothing changes, Rau worries, the country is about to lose this critical public health infrastructure.

""We can talk all we want about the cost of health care in this country in this ridiculous health care system we have,"" she says. ""But at a time like this, who for a minute would think about getting rid of rural hospitals?""

Kaiser Health News is a nonprofit, editorially independent program of the Kaiser Family Foundation. KHN is not affiliated with Kaiser Permanente."
70,https://www.npr.org/2020/03/19/817971577/trump-governors-to-discuss-coronavirus-strategy-as-fema-takes-bigger-role,National Public Radio (NPR),2020-03-19,"['Philip Ewing', 'Franco Ordoñez']",FDA Seeks To Expand Treatment For Coronavirus As Part Of White House Response,https://media.npr.org/assets/img/2020/03/19/gettyimages-1213518010_wide-70e2ba9d2d1411a365b4ae3b0c01a63bcaf53c1d.jpg?s=1400,"FDA Seeks To Expand Treatment For Coronavirus As Part Of White House Response

Enlarge this image toggle caption Chip Somodevilla/Getty Images Chip Somodevilla/Getty Images

Updated at 3:37 p.m. ET

The Food and Drug Administration is trying to clear the way to expand the types of medicines or treatments available during the coronavirus pandemic, President Trump said Thursday.

Early trials have begun for a prospective coronavirus vaccine, and the FDA also is working to permit patients to have access to medicines approved for use in other countries or for other uses.

FDA Commissioner Stephen Hahn stressed that the agency is moving as quickly as it can while still following protocol to ensure safety standards are met.

The White House briefing comes as the administration continues to ramp up its response to the virus, including providing economic relief and mobilizing the Federal Emergency Management Agency. Trump met with governors about their needs.

Trump also said Thursday that he would support the prospect of the government taking an equity stake in companies as part of a big stimulus for the economy.

The particulars are being negotiated in Congress as part of another bill that could lead to hundreds of billions or $1 trillion in cash or other support for individual Americans, small business and big companies.

Trump's answer on Thursday suggested that he would be open to a situation in which the government might buy a percentage of the stock of a big company in order to provide it with equity to continue operating through the economic shock associated with the pandemic.

Trump said the amount of spending would depend on the virus.

If social distancing and the clinical response could stop the coronavirus ""in its tracks,"" about $1 trillion would be ""plenty,"" the president said. If that won't do, more negotiations might be required.

FDA fast track

FDA officials want to expand the treatments available during the pandemic in a way that's both fast and responsible, Trump said, so that authorities can monitor what works as soon as practical.

""Immediately — like, as fast as we can get it,"" the president said.

Trump said the measures he announced on Thursday could be a ""game-changer,"" but ""maybe not.""

Hahn, of the FDA, said he wanted to assure Americans that the agency would work as fast as it could to broaden access to new medicines and treatment but that it remained bound by its mission to ensure that those products would be safe.

""We are looking at everything that's coming across our desks as treatment options for coronavirus,"" Hahn said. ""We need to make sure this sea of treatments will get the right drug to the right patient at the right dosage at the right time.""

One first step in the short term, Hahn said, is to examine medications already in use for other purposes.

Doctors will look at an anti-malaria drug, for example, to see how it might be applied to coronavirus sufferers, he said. Another option might be to take blood from patients who've recovered from a coronavirus infection and inject it into sick patients to help their immune response.

Hahn said the FDA's work would be a ""continuous process"" and might take three to six months. A vaccine might not be complete for about a year.

Overall, it was not clear on Thursday that beyond officials' emphasis on doing lots of assessments quickly, when the work that has begun would start to pay off at significant scale.

""This is an unprecedented situation,"" Hahn said. ""This is a really significant time.""

More testing

Dr. Deborah Birx, the White House's coronavirus coordinator, told reporters in the same briefing that she recognized that the number of coronavirus cases in the United States would likely continue to rise as more tests become available and it takes less time to process them.

The number of infections has topped 10,000, as of Thursday afternoon, according to the latest reports.

Birx said the rate of positive results is between 10 and 11%, meaning that about 90% of people receiving tests don't have the coronavirus.

Even so, a more robust testing regime likely will reveal more cases, officials said.

Conference with governors

Trump traveled from the White House to the Federal Emergency Management Agency on Thursday. He spoke with a group of governors about the need to be able to care for what is expected to be a wave of people needing treatment for the respiratory disease caused by the coronavirus.

FEMA is accustomed to responding when natural disasters like hurricanes and tornadoes overwhelm local resources, but the scope and scale of the coronavirus pandemic presents huge logistical challenges.

Georgia's Republican Gov. Brian Kemp told Trump to ""leave the directives for the National Guard with the governors.""

Responded Trump: ""That's done. I like it.""

Kemp also asked Trump to consider maintaining staff at a military base used for quarantining cruise ship passengers in order to handle people from the metro Atlanta area.

Louisiana's Democratic Gov. John Bel Edwards said he was worried that his state's medical facilities would be overwhelmed in a week. Edwards said the state would like to be able to send some patients to a hospital run by the Department of Veterans Affairs.

Trump said he would work to approve that quickly.

Vice President Pence urged governors to place orders for N95 masks after a new change to liability laws made it possible for hospitals to use industrial masks, normally targeted for construction sites.

Pence also told governors that a survey was being done to determine the supply of ventilators. Birx, the response coordinator, urged them to ensure that coronavirus test results are reported centrally so that supplies can be surged to the right areas.

Nebraska's Republican Gov. Pete Ricketts said he was concerned about the supply of reagents for processing tests.

Ricketts also said there was an urgent need for ""pop-up alternative day care,"" especially for first responders and health care workers. He asked Trump for assistance with streamlining the process of clearing day care workers.

""We need a waiver from the fingerprint requirement to be able to do that quickly,"" he said.

Ricketts also asked that the Education Department relax ""free appropriate education"" requirements because recent guidelines created concerns. He said some school attorneys have told teachers they cannot teach because they could be sued under those ""appropriate education"" requirements.

Massachusetts Democratic Gov. Charlie Baker said his state has put in orders for personal protective equipment supplies, as Trump had previously directed. But he suggested the federal government was crowding out other buyers.

""On three big orders, we lost to the feds,"" Baker said, asking Trump to look into the issue.

Maryland's Republican Gov. Larry Hogan said the federal government should give at least half of stimulus aid funding to the states, saying that state government could get money out faster to where it's needed.

Pressure for results

Trump is under pressure to show that his administration has the situation in hand as Americans see their day-to-day lives dramatically change.

Schools are closed, people are heeding warnings to stay away from others, and many have lost their income as the economy has been shocked to a near-halt.

Meanwhile, Trump's administration is negotiating with Congress on a new package of aid to help people and businesses through the huge economic losses from the crisis. It will be the third round of aid in two months. Trump signed the second package into law Wednesday night.

But the virus is making it hard for lawmakers to do their work.

On Wednesday evening, two congressmen said they had tested positive for the virus, and others who had met with them — including Rep. Steve Scalise, the No. 2 Republican in the House — said they would self-quarantine, to be safe.

No decision on Olympics, Trump says

Trump acknowledged at the White House that Japanese Prime Minister Shinzo Abe discussed the upcoming Summer Olympics, set to occur in Tokyo, in a call with world leaders earlier this week.

Abe hasn't decide whether to cancel the games, Trump said, but ""we'd live with his decision if he does.""

Trump was asked on Thursday when he thought life would get back to normal.

""I hope very soon,"" he said. ""We'll see. This is uncharted territory."""
71,https://www.npr.org/2020/03/18/817841085/coronavirus-forces-bureau-to-suspend-census-field-operations-until-april-1,National Public Radio (NPR),2020-03-18,['Hansi Lo Wang'],Coronavirus Forces Bureau To Suspend Census Field Operations Until April 1,https://media.npr.org/assets/img/2020/03/18/_dsc0209_wide-63efadd5f032a03246a0fdec8b94a7514d921bff.jpg?s=1400,"Coronavirus Forces Bureau To Suspend Census Field Operations Until April 1

Enlarge this image toggle caption Amr Alfiky/NPR Amr Alfiky/NPR

Updated March 19 at 9:25 a.m. ET

The coronavirus pandemic is forcing the U.S. Census Bureau to temporarily suspend all field operations for the 2020 census for two weeks until April 1, the agency announced Wednesday in a statement on its website.

As the country continues to bunker down in response to the spread of COVID-19, the bureau's director, Steven Dillingham, says it is making the change ""to help protect the health and safety of the American public, Census Bureau employees, and everyone going through the hiring process for temporary census taker positions.""

For the next couple of weeks, the bureau is also reducing the number of on-site workers at two facilities in Jeffersonville, Ind., that process paper census forms, the bureau says in a separate statement on its website.

Another facility in Phoenix that also processes paper forms is ""adopting social distancing practices in line with guidance from health authorities,"" Michael Cook, a spokesperson for the bureau, told NPR in a statement on Thursday.

Many census advocates are worried that the ongoing public health crisis could jeopardize the bureau's ability to accurately count the U.S. population this year as required by the Constitution.

All U.S. households, however, can continue to respond to the census on their own either online at my2020census.gov, over the phone or by paper form, if they receive one. Official letters with instructions on how to participate in the national head count are expected to arrive at most homes by Friday.

The announcement comes days after the bureau confirmed to NPR on Saturday that it is delaying deploying door knockers to college towns until April 23 and waiting until early April to start sending out census workers with computer tablets to help people complete online forms.

Still, there has been a lot of uncertainty about how the bureau plans to protect early rounds of census workers expected to go door to door to count residents in remote parts of Alaska and Maine, and in some American Indian tribal territories. Other workers were set to leave paper questionnaires in Puerto Rico and other places recovering from natural disasters. The bureau had also been preparing to conduct an in-person count of people experiencing homelessness.

Recently hired enumerators, also known as door knockers, and other field staff have been gathering around the country for training sessions. The bureau confirmed to NPR on Saturday that at least one employee, who was hired to be a census field supervisor, has tested positive for COVID-19 and is in quarantine.

""The employee is following guidance of the Iowa Department of Public Health,"" Michael Cook, a spokesperson for the bureau, said in a follow-up email on Sunday.

While that employee has not interacted with the public on behalf of the bureau, the census field supervisor was in contact with a ""very limited number of employees"" at a training session, and all of them are in self-quarantine, Cook said on Saturday.

The latest state population counts are due to the president by December 31, according to federal law.

The numbers of every person living in the U.S. determine each state's share of congressional seats and Electoral College votes for the next decade. They also guide how as much as $1.5 trillion a year in federal funding for Medicare, Medicaid and other public services are divided up among local communities.

In the written statement, Dillingham said that as of Wednesday morning, more than 11 million households have submitted a census response on their own through the Internet since March 9, when the online form at my2020census.gov was soft launched.

Rep. Carolyn Maloney (D-N.Y.), who helps oversee the 2020 census as the chair of the House Oversight and Reform Committee, says she hopes more households will continue to find ways to respond to the census during the temporary pause in field operations.

""Every American should know that this does not affect your ability to self-respond,"" Maloney said in a statement. ""By responding now, you will ensure that the Census Bureau does not need to send a census worker to your door."""
