news_id,url,publisher,publish_date,author,title,image,body_text
46,https://www.npr.org/sections/coronavirus-live-updates/2020/04/09/830450210/inmates-in-washington-state-protest-after-fellow-prisoners-test-positive-for-cov,National Public Radio (NPR),2020-04-09,['Scott Neuman'],Inmates In Washington State Protest After Fellow Prisoners Test Positive For COVID-19,https://media.npr.org/assets/img/2020/04/09/ap_1603010200387790_wide-f37deac020570c6af856db5072b56f18599be1ad.jpg?s=1400,"Inmates In Washington State Protest After Fellow Prisoners Test Positive For COVID-19

Enlarge this image toggle caption Elaine Thompson/AP Elaine Thompson/AP

Dozens of inmates at the Monroe Correctional Complex in Washington state have staged a brief protest after several fellow prisoners tested positive for the novel coronavirus in recent days.

In a statement issued late Wednesday, the Department of Corrections Washington State said that around 6 p.m. local time more than 100 men at the prison's minimum-security unit ""began engaging in a demonstration in the recreation yard.""

It said fire extinguishers were set off in two housing units at the facility and that verbal directives were obeyed by about half the prisoners, but that the others initially refused to comply.

""All measures to bring individuals into compliance were ignored including verbal directives, pepper (OC) spray and sting balls, which release light, noise, and rubber pellets,"" the statement said.

It said that the situation was brought under control with no injuries and that the facility is now on restricted movement.

""It is believed at this time that the incident was caused by recent positive test results of COVID-19 among six men within the Minimum Security Unit,"" the statement said. ""Those six men were transferred from the Minimum Security Unit on Sunday to the facility's isolation unit.""

It said inmates in the housing unit where the first positive tests for coronavirus were discovered ""continue to have no symptoms of illness or disease (asymptomatic) and are wearing surgical masks for further protection.""

The corrections department announced Sunday that an inmate in the minimum-security unit had tested positive for the virus and on Wednesday that two more, a 68-year-old and a 28-year-old prisoner, also had been diagnosed, according to KOMO News.

KOMO reported that prison staff had been ordered to wear N95 masks and that prisoners in the minimum-security unit were required to undergo body temperature checks.

In a telephone interview earlier this month with Northwest News Network, Arthur Longworth, who has served 35 years at Monroe on a sentence of life without parole for aggravated murder, said prisoners in his medium-security unit have been put on quarantine since a staff member tested positive for coronavirus.

Longworth, who is an award-winning prison writer, said he fears that the disease could spread quickly through the prison because of tight spaces, shared quarters and dense populations.

He said he fears an outbreak of COVID-19 could sweep through the facility in the same way as a fire would.

""I've been in fires in the cell block before, it's a scary thing,"" he said. ""And when the virus gets in here, as it has, it feels kind of like that."""
47,https://www.npr.org/sections/coronavirus-live-updates/2020/04/08/830290047/broadway-to-remain-closed-until-june,National Public Radio (NPR),2020-04-08,['Jeff Lunden'],Broadway To Remain Closed Until June Because Of Coronavirus,https://media.npr.org/assets/img/2020/04/08/gettyimages-1217654631_wide-7abc8982f51f9477833f64b21d58a2a19aa49115.jpg?s=1400,"Broadway To Remain Closed Until June Because Of Coronavirus

Enlarge this image toggle caption Jamie McCarthy/Getty Images Jamie McCarthy/Getty Images

Broadway shut down in March for what it thought would be a month, but with New York at the epicenter of COVID-19 cases in the U.S. and with guidelines from the Center for Disease Control and the New York governor Andrew Cuomo, theaters will now remain shut until at least June 7th. The announcement was made on Wednesday morning by the Broadway League, an organization of theater owners and producers.

Broadway brought in $1.8 billion in ticket sales and close to 15 million audience members last season. It's New York's top tourist attraction, bringing in more people than all of the tri-state area's professional sports teams combined. And many ancillary businesses have been affected, too – hotels, taxi cabs, restaurants.

When performances were suspended, 16 shows were scheduled to open before the Tony Awards deadline in late April – two of them, a revival of Who's Afraid of Virginia Woolf? and Hangmen subsequently announced they were closing. The musical Beetlejuice will not reopen in June, may move to another theater later. Three shows at non-profit venues will postpone their productions to next season.

The pandemic's toll has rocked the community with personal losses, among them Tony Award-winning playwright Terrence McNally, character actor Mark Blum, and composer Adam Schlesinger."
48,https://www.npr.org/2020/04/09/830159777/irs-budget-cuts-and-staffing-challenges-create-coronavirus-payment-headaches,National Public Radio (NPR),2020-04-09,['Kelsey Snell'],"IRS Budget Cuts, Staffing Challenges Create Coronavirus Payment Headaches",https://media.npr.org/assets/img/2020/04/08/gettyimages-517241890_wide-9038162150ec39b10eea219218570cdf8fbdc084.jpg?s=1400,"IRS Budget Cuts, Staffing Challenges Create Coronavirus Payment Headaches

Enlarge this image toggle caption Brendan Smialowski/AFP via Getty Images Brendan Smialowski/AFP via Getty Images

The Internal Revenue Service is under huge pressure to quickly disburse the $1,200 payments promised to most people in the $2.2 trillion coronavirus relief bill. Experts say it could take months for everyone to get their checks — with some people possibly waiting until after they file their taxes next year.

Over the past 10 years. the IRS budget has been reduced by roughly 20%, leaving the agency with aging technology and forcing it to cut back on staff and training, according to experts. The added stress of the coronavirus is already causing customer service headaches.

""There's a dearth of people who are qualified to do the work and they're overworked,"" said Mark Everson, who served as IRS commissioner from 2003 to 2007 under President George W. Bush. ""If you're going to get a check in the mail, it could come as late as end of August.""

Treasury Secretary Steven Mnuchin told House Democrats on Wednesday that the first round of coronavirus payments will be made by direct deposit next week. Democrats on the House Ways and Means Committee estimate that about 60 million people would be eligible for those deposits. However, the IRS estimates, roughly 150 million people will file taxes this year.

The remaining 90 million, along with millions more, would have to wait for deposits in the mail, which takes time.

But the headaches don't stop there.

Some people may have made more than the $99,000 income cap last year, meaning they would miss out on the payments. But if they lost a job and their income dropped, they would be eligible and would have to go back to the IRS in 2021 to get their payments.

Everson, who is now vice chairman at the business tax advisory AlliantGroup, says people confused about the payments shouldn't bother trying to call the IRS to try to figure out what to do.

""I wouldn't counsel anybody to call in,"" Everson said. ""You're not going to get through on the phones.""

The IRS itself agrees. The portion of its site dedicated to coronavirus payments counsels ""do not call"" and ""check back for updates.""

That reliance on Web updates creates another layer of confusion for many low-income and older people. Nina Olson, who served from 2001 through last August as the IRS internal watchdog known as the national taxpayer advocate, said many of the people without bank information on file also don't have access to the Internet.

Olson says the IRS workforce has been badly depleted through budget cuts and further reduced as the agency tries to comply with Centers for Disease Control and Prevention mandates for social distancing to help slow the spread of coronavirus.

""Some of what has hit the cutting room floor is quality taxpayer service,"" Olson said. ""That is really a problem when you are paying out money to people in a crisis situation where people are already anxious and it could be a matter of life or death for an individual or a business.""

Mnuchin says the IRS is rushing to put together a Web portal to allow people to update their bank and personal information so that they can take advantage of the direct deposits. But those aren't the only questions people have.

Olson says many low-income taxpayers and people without bank accounts get their refunds through prepaid debit cards. Those debit cards likely are no longer active, but the account data may still be on file with the IRS. If relief payments go to those cards, those taxpayers will have to work that out with the IRS.

The agency says they plan to send people a letter notifying them 15 days after a payment is processed or sent to them. The goal is to confirm that people got the payments and, if they didn't, to give them a chance to reconcile.

Olson and Everson said these coronavirus-specific problems would have been hard for the agency to predict, but there is a lot the agency could have done to prepare for an economic disaster like the one facing the country today if it had the funding to do it.

""There's been a series of budget reductions and that has depleted the workforce and particularly in the technology area,"" Everson said. ""The technology, you need to continually invest in that, has been really shortchanged.""

Everson said he worries the strain on the system and rush to issue payments also put the agency at risk for a data breach.

Former acting National Taxpayer Advocate Bridget Roberts released a report in January detailing how the 20% funding reduction over the past decade has led to a 20% reduction in the workforce, even as the number of returns filed has increased by 9%.

The IRS has seen its funding increase slightly over the past few years, first in 2018 after Congress approved the Tax Cuts and Jobs Act. But those increases have not made up for cuts that began in 2013 when the agency was embroiled in a scandal.

Congressional Republicans accused the agency of using ideological targeting to deny nonprofit status to organizations the IRS deemed politically conservative. Rep. Jim Jordan, R-Ohio, who helped lead the drive to cut the agency's funding, said it was a necessary response to the scandal.

""When you have a federal agency with the power and the clout and the ability to impact American citizens' lives like the IRS has, and you discover that they were targeting people based on their political beliefs, that is frightening,"" Jordan said in an interview. ""And then coming and asking for more taxpayer dollars, I mean really, that's just not going to fly.""

Jordan and former congressman and current White House chief of staff Mark Meadows led the conservative House Freedom Caucus during the scandal. They both criticized the agency for bureaucratic failures and mismanagement.

Democrats dismissed the scandal at the time and restored more of the funding when they took control of the House after the 2018 election. Rep. Lloyd Doggett, D-Texas, who leads the subcommittee that oversees tax issues, said they are playing catch up.

""Republicans assured that the IRS was less capable of doing its work,"" Doggett said. ""I think it would be great if we could have a bipartisan initiative as a result of this crisis to look at the IRS and try to ... streamline it for this century.""

Jordan would not rule out the possibility of considering future IRS funding increases if the agency can prove that it doesn't have enough resources to fully implement the coronavirus legislation. But he remains reluctant to agree to diverting any spending away from direct aid to fund a federal agency.

Doggett, Everson and Olson also raised concerns that the IRS workforce is further depleted by the coronavirus outbreak. A spokesman for the agency said 45,000 of its roughly 80,000 employees are working remotely and thousands more are complying with CDC regulations as they continue to work in offices across the country.

More than 20,000 employees are on temporary leave, but an IRS spokesman said the virus won't impact their ability to get the payments out.

Given all of the challenges, Everson and Olson say fully resolving the payments may take until next year. For now, they have some advice: Follow the IRS instructions and avoid calling, remember to file your taxes, and avoid scams that ask for personal information over the phone. The IRS will never call you and ask you for your information, Everson said.

""Anybody who is not comfortable going online themselves needs to find a friend or relative who can help them through interacting with the service,"" Everson said. ""If you do hear from the IRS and it really is the IRS, don't ignore them if they send you a letter."""
