,news_id,url,publisher,publish_date,author,title,image,body_text,mbfc_level,political_bias,country,reliability
0,0,https://abcnews.go.com/US/feds-warn-attacks-related-bogus-covid-19-conspiracy/story?id=70721145,ABC News,2020-05-16,['Josh Margolin'],Feds warn of attacks related to bogus COVID-19 conspiracy theory,https://s.abcnews.com/images/US/5g-tower-tmobile-1-rt-rc-200516_hpMain_16x9_992.jpg,"What started as a bizarre and bogus conspiracy theory involving the novel coronavirus in Britain has apparently crossed the Atlantic Ocean, U.S. law enforcement officials believe, and they are now increasingly worried about the possibility for real-world violence.

“We assess conspiracy theories linking the spread of COVID-19 to the expansion of the 5G cellular network are inciting attacks against the communications infrastructure globally and that these threats probably will increase as the disease continues to spread, including calls for violence against telecommunications workers,” the U.S. Department of Homeland Security reported Wednesday in an intelligence report obtained by ABC News.

“Violent extremists have drawn from misinformation campaigns online that claim wireless infrastructure is deleterious to human health and helps spread COVID-19, resulting in a global effort by like-minded individuals to share operational guidance and justification for conducting attacks against 5G infrastructure, some of which have already prompted arson and physical attacks against cell towers in several US states,” the report concluded.

Wires of a telecommunications mast damaged by fire are seen in Sparkhill in Birmingham, Britain, April 6, 2020. Carl Recine/Reuters, FILE

The assessment was followed on Thursday by a joint intelligence bulletin issued by the FBI, DHS and the National Counterterrorism Center. Both documents were distributed to senior federal officials and law enforcement agencies around the country.

The federal officials who wrote the DHS analysis could not be more pointed about the seriousness of their concerns, saying the bulletin was “intended to highlight targeting and attacks globally against critical infrastructure during the COVID-19 pandemic and advise of online threats against critical infrastructure made by individuals including domestic violent extremists in the United States and others possibly driven by conspiracy theories. Critical infrastructure has been a longstanding target of (domestic terrorists) and current targeting observed appears to be focused primarily on locations associated with the (5G network) and the electric grid.”

The conspiracy theory is totally bogus and has zero connection to legitimate science, according to numerous experts who have researched the question and have been interviewed by ABC News. Once confined to the fringe of the internet, the theory says coronavirus is caused or spread by 5G technology, which is being constructed throughout Western Europe and the US as a means of improving phone and computer communications.

Eileen Culloty, a researcher specializing in countering disinformation at Dublin City University, told ABC News last month that “theories about 5G have been around for years, but were mostly confined to the fringes… For some people, the dramatic upheaval of COVID-19 demands an equally dramatic explanation. That’s the core appeal of a conspiracy theory -- it reduces complexity and coincidence into a simple narrative and points at someone or something to blame.”

As the pandemic first began to appear outside of China early this year, fears were heightened among law enforcement when a series of cell towers around Britain were targeted in unexplained arson attacks. By mid-April officials in the UK and US agreed the attacks were likely the result of the online paranoia having jumped from the screen to the real world.

Similar incidents have now been reported in the U.S., according to the federal documents.

“Since December 2019, unidentified actors conducted at least five arson incidents targeting cell towers in Memphis, Tenn., that resulted in more than $100,000 in damages,” the DHS reports say. “Additionally, 14 cell towers in western Tennessee, between February and April, were purposely turned off by way of disabling their electrical breakers,"" according to separate DHS field intelligence reporting. In April, arsonists set fire to a major cell tower in Portland, Ore., damaging electrical components at the base of the structure.”

Internationally, incidents were also reported in Australia, the Netherlands, New Zealand, according to the documents obtained by ABC News. On top of that, union officials in England reported that “telecommunications workers have been threatened with physical violence in light of conspiracy theories linking 5G networks to the spread of COVID-19.”

The chatter about 5G towers boiled over into an April 22 Facebook posting that “encouraged individuals associated with anarchist extremist ideology to commit acts of sabotage by attacking buildings and 5G towers around the world…in furtherance of an ‘International Day of Sabotage,’” the bulletin said.

Videos have also been posted online, showing people how to damage or destroy cell towers, according to the bulletin.

While many try to dismiss internet craziness as words without significance, experts fear the arson incidents could become another conspiracy like “Pizzagate,” which circulated during the 2016 presidential election campaign. In that case, false allegations that a Washington, D.C., pizzeria was a front for a human-trafficking and a child-sex ring were spread online by a number of far-right commentators, leading ultimately to a shooting without injuries at the restaurant in 2016. The shooter later told authorities he went to the restaurant to rescue the “victims” he had heard about.

The 5G conspiracy, unlike Pizzagate, has attracted people from across the political and ideological spectrum, according to intelligence analysts.

“We are seeing more people spreading these conspiracies, but equally disturbing is that more Americans seem to be believing them,” said ABC News contributor John Cohen, who used to oversee DHS intelligence operations as the acting undersecretary of the department. “In some cases, those people that believe the conspiracy theories commit destructive and violent acts as a result. This can be dangerous.”",High,Left-center,USA,1
1,1,https://abcnews.go.com/Health/200-cases-doctors-warn-reports-rare-coronavirus-linked/story?id=70703314,ABC News,2020-05-15,"['Olivia Rubin', 'Soo Rin Kim']","With over 200 possible cases, doctors warn reports of rare, coronavirus-linked child inflammatory illness likely to rise",https://s.abcnews.com/images/US/kids-01-as-gty-200515_hpMain_16x9_992.jpg,"With over 200 possible cases, doctors warn reports of rare, coronavirus-linked child inflammatory illness likely to rise Over half of reported cases are in New York, but at least 20 states see cases.

Medical professionals in 20 states and Washington D.C. are investigating more than 200 confirmed or suspected cases of a mysterious illness thought to be linked to the coronavirus and affecting children, according to a new ABC News survey of hospital and state health officials across the country. And while the unexplained syndrome is believed to be extremely rare, experts said they expect the number to grow.

Experts said the inflammatory syndrome, recently named by the Centers for Disease Control and Prevention as Multisystem Inflammatory Syndrome in Children (MIS-C), resembles toxic shock syndrome and Kawasaki disease, itself a rare inflammatory disease typically affecting children under the age of five, and has the potential to be deadly. At least three children have died with the syndrome in New York, where at least an additional 119 cases are under investigation, according to the New York State Department of Health.

While the CDC says the group of symptoms is ""associated with"" COVID-19, exact cause remains a mystery.

Many kids, though not all, who experience symptoms of MIS-C -- which include fever, rash, eye irritation, swollen lymph nodes and/or swelling of the hands and feet -- either have been diagnosed with COVID-19 or tested positive for the antibodies, said health experts. And doctors say even those that have tested negative for antibodies could test positive later because of the lag in antibody development.

According to the CDC, It typically takes one to three weeks after someone becomes infected with the novel coronavirus for their body to make antibodies, and some people could take longer than that.

The illness is only a small percentage of the 1.5 million coronavirus cases in the U.S. Dr. Courtney Gidengil, a pediatric infectious disease physician and a policy researcher at the thinktank RAND, said the syndrome is incredibly rare, and parent’s should not panic.

But Gidengil warned the U.S. should expect to see the number of reported cases of the mystery illness rise.

“It seems like it takes four to six weeks for [MIS-C] to develop after infection, not due to the virus itself but rather the body’s response to the illness,” Gidengil said. ""We probably will start to see it pop up more around the entire country.”

There is no current official tally of suspected incidents of the illness nationwide, but an ABC News survey of hospital and state health officials in all 50 states and Washington, D.C. found at least 220 confirmed or possible cases of the illness. The majority of possible cases have been reported in New York, but more than a dozen have also been reported in New Jersey and Michigan, and officials said they also saw potential cases in Massachusetts, Washington D.C., Connecticut, California, Utah, Delaware, Illinois, Kentucky, Louisiana, Ohio, Oregon, Pennsylvania, Washington State, Tennessee, Mississippi, Missouri, Georgia and Minnesota.

Some other states like Maryland and North Carolina have told ABC News they don’t have any confirmed cases but are monitoring for any suspected cases.

""I'll wager that's going to only go up and it's going to be much more widespread than anyone thinks,"" New York's Cuomo said.

A man and child walk while wearing protective masks during the coronavirus pandemic on May 14, 2020, in New York. Cindy Ord/Getty Images

The CDC sent a warning Thursday to thousands of doctors to be on the lookout for the illness, which was previously known as pediatric multi-system inflammatory syndrome, or PMIS. Friday the government agency said that surveillance of the disease ""is limited,"" but ""now that the case definition and [a health alert] are out, more info is likely to follow.""

Health departments across the country said they have already been on the lookout. Doctors in the U.K., Italy and Spain reported an increase in cases there last month.

The Michigan health department sent out an alert earlier this month to local health agencies and health care providers about the disease and a reminder to report suspected cases within 24 hours. To date, there are 17 suspected cases under review in the state, Michigan health department spokesperson Lynn Sutfin told ABC News. New Jersey, which has reported a total of 18 cases as of Wednesday, sent out their own alert earlier this month as well.

A doctor in Oregon told ABC News proper knowledge about the illness allowed an afflicted eighth grader to get treatment immediately, which ultimately helped save her.

""I'm very grateful because I could have been gone,"" 14-year old Leah said in an interview with ABC . ""I'm glad I got help right away.""

In California, the state has yet to declare the syndrome a reportable illness, but hospitals have been paying close attention as early as March. Dr. Jim Stein, chief medical officer at Children’s Hospital Los Angeles, said the illness is a sign that the impact of the novel coronavirus is extending to children in a way that “this is no longer considered necessarily less significant for children than it is for adults.”

The CDC alert said that “It is currently unknown if multisystem inflammatory syndrome is specific to children or if it also occurs in adults.”

But little is known about the illness' connection to COVID-19.

Of the 16 children with inflammatory symptoms in California, 14 have been tested for coronavirus antibodies, Stein said. None of them had tested positive for the coronavirus detection at the time they were admitted to the hospital, but four of them tested positive later. Stein added that the 10 patients that tested negative could also develop antibodies later.

Dr. Andrew Pavia, who has been monitoring two suspected cases at the University of Utah Health Primary Children’s Hospital, said treatments given to patients with the toxic shock related symptoms could also interfere with antibody tests for COVID-19, further complicating the efforts to identify any link between the two.

Health experts are also going back to their current and past patients as they examine more patients and the case definition of the illness broadens from the classic Kawasaki disease, which could increase the number of cases brought forth.

“There's just a lot to worry about with respect to kids,” Alker said. “We really need a national strategy we need our leaders to sort of thoughtfully consider and address this wide range of threats that children face right now to their health and development.”

“And unfortunately there's just no sign that exists right now,” Alker added.

With new illness, questions about summer camps, schools re-opening

The sudden rise in critically ill children, albeit extremely small nationwide, has only further ignited the debate surrounding reopening, especially when it comes to schools.

Most states have decided that school openings will occur on a local level, and for nearly the entire country that decision still hangs in the balance. But the start of summer camps and summer programs is just around the corner, and many states have already moved to allow them to go on. States including Georgia, Tennessee, and Connecticut all have possible cases of MIS-C they have been monitoring in their state but have said summer camps may reopen with various forms of social distancing in place.

Dr. Anthony Fauci, the nation’s top infectious disease expert, repeatedly warned lawmakers during a hearing on Tuesday about opening schools and businesses too soon, which he said could cause further outbreaks.

“We don't know everything about this virus and we really better be very careful particularly when it comes to children,"" Dr. Fauci warned.

But some lawmakers have been quick to dismiss the warnings, eagerly pushing to open schools in the fall, which are seen as a major indicator of the country being officially opened.

Sen. Rand Paul, R- Kentucky, pushed back on Fauci's calls for cautiousness and said it would be a “huge mistake” not to let kids return to school sooner. President Trump also told reporters Wednesday that he was “surprised” by Fauci’s comments. He said it was “not an acceptable answer.”

""I think that we have to open our schools,"" Trump said in an interview on Wednesday. ""Young people are very little affected by this. We have to get the schools open.""

A kid wears a protective face mask while riding a bicycle in Union Square during the coronavirus pandemic on May 6, 2020, in New York. Noam Galai/Getty Images

In Connecticut, where Gov. Ned Lamont and hospitals have recently confirmed that at least five children in the state are being monitored and treated for the new syndrome, the state’s Office of Early Childhood announced this week that summer camps, with the exception of overnight camps, can open on June 29 with specific guidance in place, including a requirement to get a permission to host a group more than 30 as well as other social distancing measures. When schools can reopen there remains a question, as Education Commissioner Miquel Cardona said this week that the school reopening plan will depend on infection trends and that they will need to be flexible.

Georgia Gov. Kemp has implemented a similar measure. Summer camps were permitted to begin operating this week, as long as they follow 32 mandatory criteria that his team developed in absence of the CDC’s guidance. Overnight camps are prohibited. Kemp's office did not respond to a request for comment about how the new illnesses in the state would impact his decisions about schools moving forward.

In most other states, some summer camps are opening up while some other camps are choosing to remain closed amid state governments’ lack of state-wide directives.

In Maryland, Montgomery County this week went ahead and cancelled all summer camps in the county as it awaits for state health department's guidance for camps. Guidance on summer camps is pending in Michigan and Massachusetts as well, while Missouri has left it to counties and cities to decide on the fate of summer camps.

In Utah, the Girl Scouts of Utah has extended the cancellation of “in-person meetings for troops and services of units” until June 30, but YMCA of Northern Utah is moving ahead with its camps while adhering to CDC social distancing guidelines. Schools remain closed through the end of the academic year.

An 'additional risk to consider'

Early concerns about re-opening schools had more to do with the possibility of children potentially transmitting the coronavirus to their teachers, parents or elderly grandparents, who have shown to be much more susceptible to COVID-19's more serious effects.

Pavia said that the new ""scary illness"" affecting kids, while very rare, has only added to the difficult safety calculations.

“I think it's one more factor to put into the very complex decision making about letting kids go back to school in the fall or the summer camps,” Pavia said. “We know that overall they're likelihood of getting severe respiratory disease is very low. We think that MIS-C is a rare but very serious complication, and you know how it's hard to make decisions about rare but serious events.”

“I think for schools, it's just an additional risk to consider,” Pavis added. “I still think that for deciding whether to open schools, the bigger concern is what role children may play in prolonging the epidemic and infecting older people. That's likely to be a much larger impact in terms of numbers. Psychologically, this may have a bigger role.”

In the meantime, health experts are urgently trying to get the word out about the disease so parents can know identify and get their children medical attention as soon as possible.

“Parents: know the signs of Pediatric Multi-Symptom Inflammatory Syndrome to protect your child,” New York City blasted out in its text-message notification system on Friday.

""This is truly disturbing,"" Gov. Cuomo said of the illness at a press conference this week. ""We raise it because it's something parents should be aware of.""

ABC News' Katherine Faulders and Allie Pecorin contributed to this report.",High,Left-center,USA,1
