news_id,url,publisher,publish_date,author,title,image,body_text
27,https://www.npr.org/sections/health-shots/2020/04/20/837120101/coronavirus-crisis-spurs-access-to-online-treatment-for-opioid-addiction,National Public Radio (NPR),2020-04-20,['Phil Galewitz'],Coronavirus Crisis Spurs Access To Online Treatment For Opioid Addiction,https://media.npr.org/assets/img/2020/04/17/gettyimages-530530538_wide-607672362fa1bc656b716584e517150820827143.jpg?s=1400,"Coronavirus Crisis Spurs Access To Online Treatment For Opioid Addiction

Enlarge this image toggle caption Ian Hooton/Getty Images/Science Photo Library Ian Hooton/Getty Images/Science Photo Library

Opioid addiction isn't taking a break during the coronavirus pandemic.

But the U.S. response to the viral crisis is making addiction treatment easier to get.

Under the national emergency declared by the Trump administration in March, the government has suspended a federal law that required patients to have an in-person visit with a physician before they could be prescribed drugs that help quell withdrawal symptoms, such as Suboxone. Patients can now get those prescriptions via a phone call or videoconference with a doctor.

Addiction experts have been calling for that change for years to help expand access for patients in many parts of the country that have shortages of physicians eligible to prescribe these medication-assisted treatments. A federal report in January found that 40% of U.S. counties don't have a single health care provider approved to prescribe buprenorphine, an active ingredient in Suboxone.

A 2018 law called for the new policy, but regulations were never finalized.

""I wish there was another way to get this done besides a pandemic,"" says Dr. David Kan, chief medical officer of Bright Heart Health, a Walnut Creek, Calif., company. It has recently started working with insurers and health providers to help addicted patients get therapy and medications without having to leave their homes. He said he hopes the administration will make the changes permanent after the national emergency ends.

Years before the emergency regulations were issued, Bright Heart — along with several other telemedicine counseling providers — began offering opioid addiction treatment and counseling via telemedicine, even if they couldn't prescribe initial medication for addiction. Patients can renew prescriptions for drugs to deal with withdrawal symptoms, get drug-tested and meet with counselors for therapy.

When Nathan Post needed help overcoming a decade-long drug addiction, he went online in 2018 and used Bright Heart Health to connect to a doctor and weekly individual and group counseling sessions. He says the convenience is a big benefit.

""As an addict, it was easy to have excuses not to do stuff, but this was easy because I could just be in my living room and turn on my computer, so I had no reason to blow it off,"" he says.

Post, 38, a tattoo artist who recently moved from New Mexico to Iowa City, Iowa, was addicted to Suboxone, the drug he was prescribed in 2009 to deal with an addiction to opioid pills.

Officials with the insurer Anthem say Bright Heart's telemedicine option has helped increase medication-assisted treatment for members with opioid drug abuse issues from 16% to more than 30% in California and nine other states. While fewer than 5% of Anthem patients seeking addiction treatment use telemedicine, the company expects the option to become more common.

One barometer of the effectiveness of the care, Bright Heart Health officials say, is that 90% of patients are still in treatment after 30 days and 65% after 90 days — far higher than with traditional treatment.

Several insurers across the country — including Aetna and Blue Cross Blue Shield companies such as Anthem — have begun covering the telemedicine addiction service.

Dr. Miriam Komaromy, medical director of Boston Medical Center's Grayken Center for Addiction, says there are some downsides to virtual care.

""I think therapists and providers do worry whether it provides the same level of engagement with the patient and whether it's possible to gauge someone's sincerity and level of motivation as easily over a camera as in person,"" she says.

Nonetheless, she predicts telemedicine service will grow because of the tremendous need to broaden access to mental health and addiction counseling. ""Too often the default is no counseling for patients,"" she said. ""This gives us another set of tools.""

Patients can also have trouble finding a doctor who is eligible to prescribe medication to help treat addiction. Physicians are required to get a federal license to prescribe Suboxone and other controlled substances that help patients with opioid addiction, and they can write only limited numbers of prescriptions each month. Many doctors hesitate to seek that qualification.

A few small studies have found that patients are as likely to stay with telemedicine treatment as with in-person care for drug addiction. But no studies have determined whether one type of therapy is more effective.

Telemedicine does have its limits, and it is not right for everyone, particularly patients who require more intensive inpatient care or who lack easy Internet access, Komaromy says.

Premera Blue Cross and Blue Shield officials say they are partnering with Boulder Care, a digital recovery program based in Portland, Ore., to help customers in rural Alaska. ""Telemedicine is a unique way for someone to go through treatment in a discreet manner,"" says Rick Abbott, a Premera vice president.

While telemedicine has been growing in popularity for physical medicine, some people may still be reluctant to use it for drug addiction.

There are also concerns that allowing providers to prescribe controlled substances without meeting patients in person could increase the risk of fraud.

""There is a fear around this that there may be some rogue providers who make a lot of money off addiction and will do it stealthily on the Internet,"" says Dr. Alyson Smith, an addiction medicine specialist with Boulder Care. ""While that is a small risk, we have to compare it to the huge benefit of expanding treatment that will save lives.""

Smith says she doesn't notice a big difference in treating patients for drug addiction in her office compared with on a video screen. She can still see patients' pupils to make sure they are dilated and ask patients about how they are feeling — physical and emotional signs that can help determine whether it's appropriate to prescribe certain drugs. Dilated pupils are a sign of patients suffering from withdrawal from heroin and other drugs.

Dr. Dawn Abriel, who treated Post and previously directed a methadone clinic in Albuquerque, N.M., says she can diagnose patients over video without issue.

""I can pick up an awful lot on the video,"" particularly a patient's body language, she says. ""I think people open up to me more because they are sitting in their homes and in their place of comfort.""

In West Virginia, one of the states hardest hit by the opioid addiction epidemic, Highmark, a Blue Cross Blue Shield company, started offering telehealth addiction coverage with Bright Heart Health in January. Highmark officials say a lack of health providers, particularly in rural parts of the state, meant that many of the insurer's members had difficulty finding the help they needed.

Dr. Caesar DeLeo, vice president and executive medical director of strategic initiatives for Highmark, says the insurer had been having problems getting customers into care. Only about a third of members with addiction issues were receiving treatment, he says.

""We needed to address the crisis with a new approach,"" DeLeo says. ""This will give people more options and give primary care doctors who do not want to prescribe Suboxone another place to refer patients.""

DeLeo says patients will also be referred to Bright Heart in hospital emergency rooms.

Dr. Paul Leonard, an emergency doctor and medical director for Workit Health, an Ann Arbor, Mich., company offering telemedicine treatment and counseling programs, says many patients who turn to ERs for addiction treatment get little help finding counseling.

With online therapy, patients can sign up while still in the ER.

""We've built a better mousetrap,"" Leonard says.

Providers who specialize in addiction medicine and have recently turned to telemedicine say they and their patients are getting more accustomed to virtual care.

""There are always times you wish you could reach out and hold someone's hand, and you can't do that,"" says Boulder's Smith. ""But we feel like we are more skilled at a virtual hand-holding and really connect with people — and they feel well supported in return.""

Kaiser Health News is a nonprofit, editorially independent program of the Kaiser Family Foundation. KHN is not affiliated with Kaiser Permanente."
28,https://www.npr.org/sections/coronavirus-live-updates/2020/04/27/846046185/germany-backs-away-from-compiling-coronavirus-contacts-in-a-central-database,National Public Radio (NPR),2020-04-27,['Matthew S. Schwartz'],Germany Backs Away From Compiling Coronavirus Contacts In A Central Database,https://media.npr.org/assets/img/2020/04/27/ap_20118390380820_wide-1d5d86d4174dd0aea42f3d5620c6921507e818f1.jpg?s=1400,"Germany Backs Away From Compiling Coronavirus Contacts In A Central Database

Enlarge this image toggle caption Michael Sohn/AP Michael Sohn/AP

Germany is backing away from a centralized digital contact tracing program it had been considering to combat the coronavirus, saying the effort will only work if people trust that their privacy is being respected.

German officials had planned to collect data from users' cellphones and store the data in a central repository. That approach would give health officials greater access to information that could help slow the spread of the coronavirus. But it troubled privacy advocates, who worry about a slippery slope if the government has access to so much personal information about citizens' interactions.

Over the weekend, governmental ministers reversed course, saying the country would move to a decentralized approach.

""This app should be voluntary, meet data protection standards and guarantee a high level of IT security,"" Chancellery Minister Helge Braun and Health Minister Jens Spahn said in a statement, according to Reuters. ""The main epidemiological goal is to recognize and break chains of infection as soon as possible.""

Contact tracing works by identifying anyone that an infected individual has come into contact with, and then notifying people who might have been exposed. Apple and Google announced earlier this month they are creating a tracing system that uses cellphones' ability to detect nearby phones via Bluetooth.

Apple and Google are taking what is known as a decentralized approach, in which all the potentially identifying information is stored locally, on users' phones.

The centralized system originally preferred by German officials would have required Apple to change the settings on its phones to allow for the collection of information. Reuters, citing a ""senior government source,"" says Germany backtracked after Apple refused to make that change.

Earlier this month, hundreds of academics from around the world warned of the potential consequences of unchecked automatic contact tracing.

""We are concerned that some 'solutions' to the crisis may, via mission creep, result in systems which would allow unprecedented surveillance of society at large,"" said a letter signed by nearly 300 professors around the globe.

""Solutions which allow reconstructing invasive information about the population should be rejected,"" they wrote, warning that a state, the private sector or hackers could use that data to spy on citizens.

The European Parliament supports a decentralized approach, and it has cautioned that there is a ""potential risk of abuse"" if data is stored in a centralized database.

Editor's note: Apple and Google are among NPR's sponsors."
29,https://www.npr.org/sections/coronavirus-live-updates/2020/04/27/845304917/new-zealand-says-it-has-won-battle-against-covid-19,National Public Radio (NPR),2020-04-27,['Scott Neuman'],New Zealand Says It Has Won 'Battle' Against COVID-19,https://media.npr.org/assets/img/2020/04/27/gettyimages-1211047497_wide-dd31667ffb75306ef4b0b3fcd6fb8cac198369e3.jpg?s=1400,"New Zealand Says It Has Won 'Battle' Against COVID-19

Enlarge this image toggle caption Mark Mitchell/Pool/Getty Images Mark Mitchell/Pool/Getty Images

New Zealand's Prime Minister Jacinda Ardern says that the island nation has defeated — for the present — the coronavirus as her government announced the lifting of some restrictions imposed to halt the spread of COVID-19.

""There is no widespread undetected community transmission in New Zealand. We have won that battle,"" Ardern said Monday. ""But we must remain vigilant if we are to keep it that way.""

Asked whether New Zealand had eliminated COVID-19, Ardern replied: ""currently.""

The coronavirus has been trending down in New Zealand since April 5, when 89 confirmed cases were announced. On Sunday, there were no new cases announced for the first time in weeks, but another five were reported on Monday. A total of 19 people have died in New Zealand from COVID-19.

The country's director-general of health, Ashley Bloomfield, said the small number of new cases in recent days ""does give us confidence that we have achieved our goal of elimination.""

Bloomfield and Ardern said that declaring the virus eliminated did not mean there would be no new cases, but that the numbers would be manageable with the help of aggressive contact tracing, which the prime minister said had been scaled up ""significantly"" with the capacity to make up to 10,000 calls per day.

Ardern's remarks came as New Zealand, a country of just 5 million people, downgraded its COVID-19 alert to level 3 — meaning most, but not all, businesses are being allowed to reopen.

Businesses and professions that require face-to-face contact — such as hairdressers, salespeople, masseuses and public gyms — will remain closed until the alert level is reduced another notch, Ardern said.

""Your business must be contactless. Your customers can pay online, over the phone or in a contactless way,"" she said. ""Delivery or pickup must also be contactless.""

Exceptions include supermarkets, dairies, gas stations, pharmacies or other permitted health services, according to the New Zealand Herald.

For those who return to the physical workplace, they should maintain 1 meter (about 3 feet) of social distancing, Ardern said.

""COVID-19 has spread in workplaces, so the quid pro quo of being able to open is doing it in a way that doesn't spread the virus,"" she said.

The prime minister also advised that if people can work from home, they should continue to do so.

New Zealand has garnered praise for largely putting aside politics in order to tackle the outbreak.

As NPR's Julie McCarthy reports, Ardern, 39, a mother of a 21-month-old, ""regularly appears on Facebook Live chats, dressed in a sweatshirt, commiserating with families enduring isolation in their 'bubble,' as she calls their place of shelter, and assuring children the tooth fairy is still on the job. When she imposed stringent stay-home rules in late March, she urged people to 'be strong and be kind.' ""

Australia has also seen a precipitous decline in new cases since a peak nearly a month ago.

Speaking on Sunday, Australia's home affairs minister, Peter Dutton, suggested that New Zealand and Australia could reopen travel between them even as restrictions on inbound air passengers from other countries remained.

""You could look at an arrangement with New Zealand given they're at a comparable stage as we are in the fight against this virus,"" Dutton told Sky News, as reported by Radio New Zealand. ""You could look at other nations in our region if they've enjoyed the same success, but New Zealand might be the natural partner."""
30,https://www.npr.org/2020/04/23/842706630/congress-passes-latest-economic-relief-package-to-confront-coronavirus,National Public Radio (NPR),2020-04-23,"['Susan Davis', 'Claudia Grisales', 'Kelsey Snell', 'Alana Wise']","Trump Signs Latest Coronavirus Economic Relief Package, Aimed At Small Businesses",https://media.npr.org/assets/img/2020/04/24/ap_20115604651951_wide-7bc0f630d80defea29d8d383c24ea89d216d7968.jpg?s=1400,"Trump Signs Latest Coronavirus Economic Relief Package, Aimed At Small Businesses

Enlarge this image toggle caption Evan Vucci/AP Evan Vucci/AP

Updated at on Friday at 1:30 p.m. ET

President Trump on Friday signed Congress' latest coronavirus economic relief package, which includes additional aid to small businesses and hospitals.

The measure passed overwhelmingly in the House on Thursday — 388-5, with one lawmaker voting present.

The five lawmakers who voted against the package included one Democrat — Rep. Alexandria Ocasio-Cortez of New York — and four Republicans — Reps. Andy Biggs of Arizona, Jody Hice of Georgia, Ken Buck of Colorado and Thomas Massie of Kentucky.

""We have our differences, but we are coming together on this particular bill, and I am proud of that,"" said House Speaker Nancy Pelosi, D-Calif., who made the case for ongoing, robust federal intervention as the only way out of the crisis. Pelosi on Thursday wore a white scarf to cover her face, but lowered it to speak on the House floor.

""I think that we have to do whatever we can to recognize that public policy has a role here, that governance carries with it responsibilities and opportunity and results and progress for the American people,"" she said. ""And that science and governance are the answers to meeting the health care needs and meeting the needs of our economy as we go forward.""

The Senate passed the measure by unanimous consent on Tuesday.

The details

The $484 billion package includes an additional $321 billion for the newly created Paycheck Protection Program, a lending program designed to help small businesses stay afloat with forgivable loans during the crisis. PPP was popular and ran out of its initial influx of $350 billion in just two weeks. It is likely the program will need additional funding. Republicans have criticized Democrats for holding up the bill — initially a stand-alone $250 billion request to fund PPP.

toggle caption Andrew Harnik/AP

In the end, Democrats secured an additional $60 billion carved out for smaller banks to assist businesses, many minority-owned, that have struggled to borrow from bigger lenders. It also includes $100 billion Democrats sought for hospitals and more testing.

They were unsuccessful, however, in their efforts to include additional resources for state and local governments — a fight they vowed to carry on to the next round of funding talks.

""There will not be another bill without state and local government"" resources in it,"" Pelosi said on Friday.

Social distancing during votes

The House debate on Thursday included stark images reflective of the time: House Chaplain Patrick Conroy delivered the opening prayer wearing a yellow mask, as did most lawmakers and aides who appeared in the chamber. The visitors' galleries, normally open to the public, were closed.

It was the first roll call vote in the House since it approved a prior coronavirus relief bill on March 14. After that vote, two lawmakers fell ill and about a dozen others self-quarantined as a result. One of those quarantined members, Rep. Joe Cunningham, D-S.C., later tested positive for COVID-19. House leaders installed more aggressive social distancing guidelines for today's votes.

""We should be mindful of the people surrounding us,"" said House Rules Chairman Jim McGovern, D-Mass., who is leading an ongoing effort to find ways to allow lawmakers to vote and hold hearings remotely.

Loading...

Members were directed to vote in smaller groups broken down by alphabetical order for each vote. Between floor speeches and votes, lawmakers were asked to stay in their offices. And members were asked to vote by machine and not a manual card that requires more contact. Short recesses were held between debates and votes to clean the chamber.

The pandemic also continues to affect lawmakers personally. Financial Services Chairwoman Maxine Waters, D-Calif., announced on the House floor that her sister is hospitalized with COVID-19. Sen. Elizabeth Warren, D-Mass., announced that her eldest brother died from the virus on Tuesday.

Next up

This is the fourth measure Congress has approved since March 1 to confront coronavirus and the economic fallout. While all four enjoyed fast, bipartisan support, there are signals that the parties are retreating to more familiar partisan lines for an anticipated fifth package.

Senate Majority Leader Mitch McConnell, R-Ky., has said he wants a ""pause"" before Congress considers additional legislation, and that it is unlikely additional measures will be able to pass the Senate by unanimous consent, which is generally reserved for noncontroversial bills. He has also indicated he will oppose any no-strings-attached funding for states and that he supports a new legal channel for states to declare bankruptcy to address their fiscal woes.

Among the measures Congress is expected to debate for inclusion in future legislation is funding for state and local governments to make up for budget shortfalls, additional cash payments to American workers and families, extended unemployment benefits, aid for the U.S. Postal Service and first responders, and new infrastructure spending."
