,news_id,url,publisher,publish_date,author,title,image,body_text,mbfc_level,political_bias,country,reliability
6,6,https://abcnews.go.com/Health/coronavirus-contact-tracers-nemeses-people-answer-phones/story?id=70693586,ABC News,2020-05-15,"['Benjamin Siegel', 'Dr. Mark Abdelmalek', 'Jay Bhatt']",Coronavirus contact tracers' nemeses: People who don't answer their phones,https://s.abcnews.com/images/International/nyc-masks-ap-rc-200514_hpMain_16x9_992.jpg,"Coronavirus contact tracers' nemeses: People who don't answer their phones Experts say the outreach effort has to be massive, but the public must help.

What is contact tracing and can it help in the fight against coronavirus?

What is contact tracing and can it help in the fight against coronavirus? Kathy Willens/AP

Massachusetts, praised by public health officials for being one of the first states to set up a coronavirus contact tracing program, is running into a problem: people aren’t picking up their phones.

When investigators reached out to infected residents and those with whom they came into close contact, more than half of their calls were being ignored, health officials revealed in recent a press briefing with Gov. Charlie Baker.

“If you get a call or a text from your local board of health or the COVID Team, it’s vital you take that call,” Baker said at the May 7 news conference, though state officials said the numbers have since improved.

Tune into ABC at 1 p.m. ET and ABC News Live at 4 p.m. ET every weekday for special coverage of the novel coronavirus with the full ABC News team, including the latest news, context and analysis.

Michigan Gov. Gretchen Whitmer said her state has faced the same problem.

""I know a lot of you don't answer the phone when you see an unknown caller reaching in, but I implore you to answer the call if it comes,"" she said at an April 20 news conference.

Experts have long said that along with robust coronavirus testing, contact tracing -- the detective work of searching backward from a positive coronavirus case for everyone who might've been exposed to it -- on a massive scale is key to a safer reopening of the country.

Workers wait in line for a shuttle at Tesla's primary vehicle factory after CEO Elon Musk announced he was defying local officials' coronavirus disease (COVID-19) restrictions by reopening the plant in Fremont, Calif., May 12, 2020. Stephen Lam/Reuters

Starting with people who test positive for COVID-19, tracers, with a series of carefully worded questions, figure out who a person was in contact with a few days before their symptoms started – skillfully reconstructing their schedules from sometimes hazy memories to map out a detailed chain of potential COVID-19 transmission.

They then follow up with that person's close contacts, alerting those who may have been exposed to COVID-19, all without ever revealing the identity of patient zero.

But across the country, the growing number of coronavirus contact tracers are struggling to reach some residents who may have been exposed and, therefore, could be spreading the disease, public health officials in several states told ABC News.

While it’s not clear how many Americans are ignoring contact tracing calls – a Centers for Disease Control and Prevention (CDC) spokesperson said the agency is not gathering data on the subject from the states – any spike in missed connections could delay efforts to quickly notify people and limit the spread of the virus in communities beginning to loosen restrictions, public health officials and experts told ABC News.

“When you miss anyone, and your contact tracing is incomplete, then you are at risk of ongoing transmission,” said Capt. Eric Pevzner, the chief of the CDC's Epidemic Intelligence Service, the country’s premier public health investigation program.

Pedestrians walk past customers sitting outside at a bar in Tucson, Arizona, U.S., on Monday, May 11, 2020. Cheney Orr/Bloomberg via Getty Images

In interviews with ABC News, health officials offered a variety of explanations for why people aren’t answering phone calls from contact tracers, from robocall fatigue to concerns over privacy to a general mistrust of the system.

“It’s a trend we need to watch,” said Dr. Crystal Watson, a senior associate at the Johns Hopkins Center for Health Security, in light of the “truly unprecedented” scale of contact tracing being done.

“It’s going to take a really impressive amount of cooperation and buy-in from the public to do this,” she said.

A consequence of endless robocalls

At a time when Americans are bombarded with more than 58 billion robocalls a year, and fraudsters are using the coronavirus to target potential victims in phone calls and text messages, many people are reluctant to field unexpected calls from unknown numbers.

“We’re hearing more and more from local health departments that have ramped up contact tracing, if citizens, if community members are seeing the Health Department on their phone, they’re really reluctant to provide information,” said Lori Tremmel Freeman, the CEO of the National Association of County and City Health Officials, which represents nearly 3,000 local health departments across the country.

Before the coronavirus pandemic, local health officials performing contact tracing to track down food-borne illness and sexually transmitted disease outbreaks would be responsible for placing calls.

But with many states partnering with private companies and nonprofits to expand their coronavirus contact tracing efforts, some calls are being made from numbers that trace back to local health departments -- meaning the people who may already have been reluctant to answer are more likely to assume it's a robocall, a telemarketer or some other kind of sales pitch.

“We’re in a time in the United States when there’s a ton of spam phone calls,” John Welch of Partners in Health, the nonprofit working with the state on their contact tracing program, said at the press conference with Baker last week. “If they are worried about a scam, have folks call us back.”

To address the problem, Massachusetts is working with telephone companies to make sure their contact tracers are identified as “MA COVID TEAM” on any call in hopes the more official-sounding identification will convince people the call is legitimate.

The state has also launched a public service announcement campaign to promote the effort help residents understand what to expect from a potential phone call.

State health officials told ABC News Friday the outreach, along with some new tracing communication strategies, has recently brought their ""connection rates"" to above 60%, including 67.9% for May 11. The officials said that through the middle of the week, the state's effort has reached more than 34,000 people -- 18,936 confirmed cases and 15,889 of their contacts.

Some communities wary of giving health investigators personal info

But even if the recipient recognizes a legitimate government entity, sometimes that's a problem too. In some communities, contact-tracing response rates also appear to reflect larger concerns about what health authorities could do with the information they're given.

“In general, people are wary of sharing personal information with strangers or with people from government,” said Dr. Richard Besser, the president and CEO of the Robert Wood Johnson Foundation and former acting director of the CDC.

“Many of the groups that are being hardest hit -- black Americans, Latinos, Native Americans -- have had poor experiences with government officials and many have had poor experience with public health,” said Besser, who also previously served as chief health and medical editor for ABC News.

Freeman, who is in contact with hundreds of counties conducting contact tracing each day, said that communities with large immigrant populations have struggled in some cases to reach undocumented immigrants who have come in contact with people infected with COVID-19.

“Because of some of the fear created already in our country around immigration and legal status, there are some we simply will never reach because they’re fearful that the information will be used to somehow track them"" by Immigration and Customs Enforcement, she told ABC News.

In Maryland’s Anne Arundel County outside of Baltimore, public health workers have made community outreach a priority in their contact tracing by adding translators to their staff, and making sure all their informational handouts are available in Spanish.

The county has also increased outreach to African-American and Hispanic community leaders, to help encourage residents to participate, according to Jennifer Schneider, the deputy director of the health department’s bureau of disease prevention and management.

“There is some mistrust, and we battle with that in public health in general, for the communities to trust the government,” she said. “Immigration status is not a requirement for being tested. We just try to get that messaging out as much as we can and often.”

While the county, which has over 2,500 cases of COVID-19, says it has reached roughly 95% of traced contacts, Schneider said they are concerned about that figure rising as the state begins to ease out of its lock-down, and residents begin interacting with more people.

“We may have to pivot our operations to better find those individuals. That is a concern that we do have,” she said.

The emerging role of technology

In some parts of the country, local public health officials are using technology to reach residents who favor other forms of communication over phone calls.

In Chicago, the city launched Chi COVID Coach to allow the health department to communicate directly with Chicago residents via text message, and provide them with resources on testing and symptoms.

“Let’s not make the choice between tech and people, we need both,” Raed Mansour, Director of Innovation at the Chicago Department of Public Health, told ABC News. “In contact tracing, you need to meet people where they are.”

In many places, that has included text messaging for those who are less likely to answer calls.

""Texting is another way we are letting people know they are trying to reach them,"" Pevznar, the CDC official, told ABC News.""We find people tend to be more receptive to text. Text is a valuable tool.""

Perhaps most importantly, however, experts also urged for a more robust public awareness campaign to encourage people to participate.

That effort could help address problems some tracers have faced when they finally do successfully get in touch with people.

One of the newer unexpected problems some tracers are seeing is nearly an existential one: a lost sense of time.

Some people have struggled to piece together their schedules, after weeks of stay-at-home orders in certain regions, public health officials told ABC News.

Since your life has been disrupted, you don’t have those things to pin your memory to. People’s days tend to blend together,” said Pevznar.

Then, there are those who make contact tracing exponentially difficult by flouting quarantine measures. Sara Bosse, the health director in California’s rural Madera County, said that her team has checked in on asymptomatic residents infected with COVID-19 who have stopped complying with stay-at-home restrictions.

“As the weather has gotten warmer, we’ve noticed that people want to be outside and go places and do things,” she told ABC News.

Dr. Philip Huang, the director of the Health and Human Services department in Dallas County, Texas, said it's important to get people to understand why they need to isolate and self-quarantine if contacted, even if they don't have symptoms.

""People need to be responsible. It’s actually caring for the community and caring for others – it may be someone's mother or someone’s grandmother,"" he said. ""It does affect us all.""

What to know about coronavirus:

How it started and how to protect yourself: Coronavirus explained

What to do if you have symptoms: Coronavirus symptoms

Tracking the spread in the U.S. and worldwide: Coronavirus map",High,Left-center,USA,1
7,7,https://abcnews.go.com/US/covid-19s-hidden-victims-alzheimers-patients-nursing-homes/story?id=70686559,ABC News,2020-05-16,['Jack Arnholz'],"COVID-19’s hidden victims, Alzheimer's patients in nursing homes",https://s.abcnews.com/images/Health/alzheimers-nursing-home-rt-jt-200515_hpMain_16x9_992.jpg,"COVID-19’s hidden victims, Alzheimer's patients in nursing homes Nearly 50% of all nursing home residents live with Alzheimer's or dementia.

When Ken Gregersen, 88, left his wife's nursing home in Ankeny, Iowa, on March 11, he didn't know that that would be the last time he'd see her for two months.

""I got an email, or I got notified by the care facility that no longer could I visit her. So I haven't actually seen her then since March,"" he told ABC News.

Evie, his wife of 67 years, is in the late stages of Alzheimer's disease and receives hospice care. Just like thousands across the country, her nursing home closed its doors to visitors amid the coronavirus outbreak.

Howard Smith visits his wife, Lois, a 77-year-old Alzheimer's patient, at the New Paltz Center nursing facility for the first time since lockdowns due to the outbreak of the coronavirus disease (COVID-19) in Pine Bush, NY., May 5, 2020. Caitlin Ochs/Reuters

The COVID-19 pandemic has rocked long-term care facilities. State data analyzed by ABC News reveals that almost a third of coronavirus deaths come from nursing homes.

With nearly half of all long-term care facility residents living with Alzheimer's or dementia, individuals with the disease have become one of the most disproportionately impacted groups from COVID-19 in the country.

As coronavirus-related deaths continue to climb, some observers have raised alarms that not enough is being done to protect Alzheimer's and dementia patients and those in long-term care facilities.

""Given some of the numbers that have now emerged, it's pretty clear that we did not have and probably still today don't have what would be full transparency on an accurate and timely basis about where the cases are occurring,"" Alzheimer's Association CEO Harry Johns told ABC News.

Alzheimer's, a chronic neurodegenerative disease, itself, does not make someone more vulnerable to coronavirus. However, those with the illness are more susceptible because they are usually older and/or have co-morbidities. Living in nursing homes also heightens the COVID-19 exposure risk for Alzheimer's and dementia patients.

Still, health concerns are not the only extra burden these individuals carry amid the outbreak. The enforced separation of nursing home residents from their families and loved ones may only increase the hardship.

In this June 4, 2017, file photo, President and CEO of Alzheimer's Association, Harry Johns, attends the Nashville Disco Party Benefiting Alzheimer's Association in Nashville. Rick Diamond/Getty Images for Alzheimer's Association, FILE

""Depending on the degree of progression of the disease, someone with Alzheimer's may not understand what's going on,"" Johns said.

""[They] may not understand then why they can't leave the house. Why the kids are at home and extended family. Those kinds of confusions can, in and of themselves create challenges for the individual who has dementia, as well as for those carers,"" he added.

Johns says he believes current public health circumstances impact those with Alzheimer's more than other care home residents.

""For any resident that family contact is so important if someone is ill. But for Alzheimer's, people who have dementia, it is especially difficult because the connections to family can -- when someone has progressed -- keep them grounded,"" Johns told ABC News.

Coronavirus has also forced families of individuals living with Alzheimer's and dementia to navigate not seeing their loved ones for extended periods of time.

""It's not enjoyable at all. I don't know the right emotional words to say. I really do miss her. We're a very close couple, we've been married this long. We've had a wonderful marriage,"" Ken Gregersen said.

Ken and Evie Gregersen of Ankeny, Iowa have been married for 67 years. Courtesy of Ken Gregersen

Ken's wife, Evie, moved to her nursing home in 2016 after her Alzheimer's diagnosis in 2012. Before the coronavirus outbreak, he would visit his wife three times a day.

""I would go over there and give her her breakfast. And then I'd go back and give her her lunch, and then I also (went) back to give her her dinner in the evening. And that's when I usually stayed a few minutes extra and I'd walk her around in her wheelchair and sing a song to her. And so I could then go from being her caregiver to being her husband again,"" he said.

While Evie's nursing home ended visits, Ken still talks to his wife every weekday on FaceTime. He said as Evie's condition deteriorates -- she can no longer open her eyes or speak -- he worries about many unknowns.

Evie Gregersen was first diagnosed with Alzheimer's in 2012. She moved to a nursing home in 2016. Ken Olson Photography

""Every day, when I see her FaceTime, and I talk to her and I try to tell her, what's going on in my life, or what are our children or grandchildren are doing, I always wonder does she hear me? Does she understand me? Does she miss me? You know, it makes me very anxious,"" he added.

Although Evie's nursing home has reported no patients or caregivers testing positive for coronavirus, Ken still worries what could happen if his wife contracts the virus.

""I know that I'm going to lose her someday. I mean I'm prepared for that. I think people who are taking care of someone with Alzheimer's, they start through the grieving process long before death occurs,"" he said.

""I know it's going to occur, but I don't want her to suffer. And the COVID virus ... it looks like there's a lot of suffering going on, you know, gasping for air and being so uncomfortable. That worries me,"" he added.

Before the coronavirus outbreak, Ken Gregersen would visit his wife three times a day at her nursing home. Courtesy of Ken Gregersen

Ken says he's satisfied with the precautions Evie's nursing home has taken. However, as coronavirus cases rise in long-term care facilities, there have been calls for states and the federal government to do more to protect care facilities.

This week, the Alzheimer's Association announced new policy recommendations to fight coronavirus in long-term care facilities.

Johns identifies increased transparency, testing and personal protective equipment (PPE) as critical in fighting the disease at nursing homes, and helping to get to a point where family members can visit their loved ones.

""We believe it takes these multiple approaches. That PPE will make a difference, but if you don't have the testing, then you can't prevent the outbreaks. If you don't have the transparency, you can't deal rapidly enough with the outbreaks. So, it is the dynamic combination of doing these things that we believe is most crucial,"" Johns said.

""It is the dynamic of all of these things happening to improve people's lives, save people's lives and really, relieve the burden that is so present for people who care for those with Alzheimer's and other dementia,"" he added.

On Monday, President Donald Trump's administration also called for increased coronavirus testing with Vice President Mike Pence telling governors he wants to see every state prioritize COVID-19 screening inside the facilities.

However, those guidelines do not go as far as those of the Alzheimer's Association.

But until those guidelines are met, people continue to wait to visit their loved ones living in long-term care facilities. Meanwhile, family members, like Gregersen, settle for seeing their parents, spouses and friends' faces confined to portable screens.

""Thank goodness the hospice caregivers who come in set up a FaceTime event Monday to Friday so that I get a chance to see [Evie's] face. She no longer opens her eyes, but I'd like to think that she hears my voice. And I'd like to think she recognizes it,"" Gregerson said.

What to know about coronavirus:

How it started and how to protect yourself: Coronavirus explained

What to do if you have symptoms: Coronavirus symptoms

Tracking the spread in the U.S. and worldwide: Coronavirus map",High,Left-center,USA,1
