news_id,url,publisher,publish_date,author,title,image,body_text
0,https://www.npr.org/sections/coronavirus-live-updates/2020/05/17/857512288/obama-malala-jonas-brothers-send-off-class-of-2020-in-virtual-graduation,National Public Radio (NPR),2020-05-17,['Emma Bowman'],"Obama, Malala, Jonas Brothers Send Off Class Of 2020 In Virtual Graduation",https://media.npr.org/assets/img/2020/05/17/gettyimages-1225292515_wide-0f5fcc59771ededddf6dc140c508a0a645260886.jpg?s=1400,"Obama, Malala, Jonas Brothers Send Off Class Of 2020 In Virtual Graduation

Enlarge this image toggle caption Getty Images for EIF & XQ Getty Images for EIF & XQ

Celebrities, activists, artists and students themselves recognized America's 3 million-plus graduating high school seniors in a widely broadcast ceremony on Saturday night, after the coronavirus crisis robbed the class of 2020 of a crucial milestone.

The virtual event, called Graduate Together: America Honors the High School Class of 2020, carried a resounding message of community at a time when COVID-19 rules out the possibility of large gatherings.

In his commencement speech, former President Barack Obama told students that they've already faced big challenges to get to this point.

""Graduating is a big achievement under any circumstances. Some of you have had to overcome serious obstacles along the way,"" he said.

And just as seniors were ready to celebrate crossing the finish line, the coronavirus pandemic hit.

Acknowledging the new uncertainties introduced by the pandemic, Obama told the class of 2020 that the global health crisis would force them to grow up faster.

""When everything's up for grabs, this is your generation's world to shape,"" Obama said.

""This pandemic has shaken up the status quo and laid bare a lot of our country's deep-seated problems,"" he said, pointing to economic inequality, systemic racism and health care disparities.

The former president closed with a final piece of advice: Build a community.

""No one does big things by themselves,"" he said. ""If we're going to save the environment and defeat future pandemics, we're going to have to do it together. So be alive to one another's struggles. Stand up for one another's rights. Leave behind all the old ways of thinking that divide us.""

NBC YouTube

Basketball star LeBron James, whose activism has centered on primary education, flipped the ""stay home"" message spread during the public health crisis into a metaphorical one: ""Stay close to home.""

""Class of 2020, the world has changed. You will determine how we rebuild, and I ask that you make your community your priority,"" James said.

Megan Rapinoe, soccer player for the U.S. Women's National Team, told the seniors, ""I'm not gonna ask you to come together. I'm going to ask you to demand better.""

She encouraged students to vote in November, adding, ""Who is leading matters.""

Education activist Malala Yousafzai is also missing her graduation, after studying philosophy, politics and economics at Oxford University.

She asked viewers to remember the young women in the world who won't be able to return to school because the coronavirus crisis pushed them into forced marriages and low-paying jobs.

""As you go out and change the world, don't leave them behind,"" she said.

The speeches were punctuated by students who thanked teachers, tributes from parents and plenty of TikTok clips.

Musicians stepped in front of green screens that featured videos of seniors dancing and playing instruments. Special appearances were made by Dua Lipa, H.E.R., Zendaya, Shaquille O'Neal, Yara Shahidi, Bad Bunny, Lena Waithe, Pharrell Williams and YBN Cordae.

Broadway star Ben Platt and his brothers, Henry and Jonah Platt, sang an a cappella medley of popular graduation anthems — supported by students' backing vocals — including Vitamin C's ""Graduation (Friends Forever)"" and the Beatles' ""In My Life.""

The Jonas Brothers closed out the show with a new song, ""X,"" featuring Karol G, joined by students dancing in sync via video."
1,https://www.npr.org/2020/05/17/852719312/she-wasn-t-alone-a-doctor-reflects-on-new-york-city-s-coronavirus-peak,National Public Radio (NPR),2020-05-17,['Meg Anderson'],"'She Wasn't Alone,' A Doctor Reflects On New York City's Coronavirus Peak",https://media.npr.org/assets/img/2020/05/13/covid_diary_drlorenzoni_015_wide-989bcccdb476b3af83ea577582ccc8d8e1faa7f4.jpg?s=1400,"'She Wasn't Alone,' A Doctor Reflects On New York City's Coronavirus Peak

Enlarge this image toggle caption Elias Williams for NPR Elias Williams for NPR

On the night of March 30, just before 7 p.m., Dr. Ray Lorenzoni put on his face mask, walked across the street from the Bronx apartment he shares with his wife and started his shift at the Children's Hospital at Montefiore Medical Center.

Lorenzoni, 35, is in his second year of a pediatric cardiology fellowship at the hospital. But this night, the patients would be different: It was his first shift treating adult coronavirus patients — the first adults he's treated in the hospital since medical school six years before.

""Coming into the hospital, it was a little bit unreal,"" he says. ""The whole floor was filled with adult patients.""

By then, COVID-19 cases systemwide at Montefiore Medical Center had gone from just two cases a little over two weeks earlier to more than 700. In response, Montefiore transformed part of the children's hospital into a 40-bed adult COVID unit. All around the city, other hospitals were making similar adjustments. Medical students graduated early. Operating rooms were converted into ICUs. A field hospital went up in Central Park.

But the surge in New York City has done much more than simply rearrange space and upend protocol. More than 15,000 people have died of COVID-19 there, and that enormous toll will profoundly impact the city's tens of thousands of health care workers for years to come. Lorenzoni is one of them.

A little over a month ago, Lorenzoni answered a request from NPR for hospital workers to describe what work was like at the epicenter of the crisis. Lorenzoni began recording his reflections for NPR after his shifts, sitting at the desk in his bedroom, speaking into his iPhone in a slow, measured voice.

Just a few weeks earlier, Lorenzoni had watched — along with many other Americans — how the Italian medical system had been brought to its knees. It seemed likely it was only a matter of when, not if, the coronavirus would arrive in the U.S. And of course, by then, it already had.

""I knew I could be involved because of what happened in Italy,"" Lorenzoni says, and adds, ""a pediatric physician needing to take care of critical adult patients is unheard of.""

Still, he was surprised he was recruited so early.

""They filled us up pretty quickly and the patients were very sick. I remember in the first couple shifts we were putting breathing tubes in patients on a floor that doesn't usually do that,"" he says.

Treating adults hit him hard, he says. He's used to working with kids.

""Pediatrics is a career where most of your patients get better,"" he says. ""But these were very with-it adults who were scared. They knew what the risk was.""

It felt important to him, he says, to be honest about what was happening, even when the news wasn't good.

""One of my main mantras is to sit down with somebody. And that was very tough in this environment because our protective equipment didn't surround us,"" he says. ""So we were discouraged from sitting down on the bed next to a patient to have a deep discussion or sitting down in a chair and being at eye level with the patient.""

Instead, he says he would do his best to give his patient a sense of comfort by leaning against the wall, trying not to stand over or talk down to them.

""I think patients can see right through a physician when they try to dance around a difficult conversation,"" he says. ""You can be honest with a person and they appreciate that honesty.""

One patient, a man in his mid-forties, kept asking how bad his condition was. As the man's health deteriorated, Lorenzoni was open with him, aware that those hard conversations — like what it means to be put on a ventilator — are sometimes the last a patient will ever have.

""I remember that he asked me, 'doc, I know I'm not getting better, what else can we do?' and unfortunately I had to answer that we'd been doing everything we could. And he broke down. And I broke down a little bit in tears,"" he says.

Enlarge this image toggle caption Elias Williams for NPR Elias Williams for NPR

In his recordings, Lorenzoni lingered on the quieter moments. He spoke about why it was important to take time with his patients, especially because visitors were not allowed. One woman, in her early 30s, often wanted staff to check in on her, beyond the usual rounds that doctors and nurses make.

""I feel like she knew she wasn't doing well, and she wanted the company,"" Lorenzoni says.

When he would leave for the day, he'd check in on her to make sure she was okay, but he worried that she would take a turn for the worse by the time he returned.

Eventually, that's what happened. She needed to be placed on a ventilator to breathe.

""One of the things I remember before the breathing tube was placed was simply sitting by her side and telling her what was going to happen. And what we could and couldn't do to help,"" he remembers. ""She was scared about how little control she had or even the doctors had in how she did.""

Lorenzoni transferred her to an ICU, an operating room that had been converted. His shift was ending, and he signed out his other patients, but he stayed on to be with this one during the intubation.

""When her body didn't respond well to that, because it was so weak, I was there doing chest compressions on her,"" he says. ""And I signed her death certificate afterwards. It was a tough day.""

She was the first of his patients to die.

""Although she passed away without her family by her side, she wasn't alone,"" he says. ""I hope that even this small amount of company that she had at the end was comforting for her. And it's going to be one of the things that sticks with me for the rest of my career.""

Many of the people who have died from COVID-19 in New York had underlying health conditions, like diabetes and high blood pressure, and that's true in Lorenzoni's experience as well. But he says conditions that put someone at a higher risk are much more common than people realize.

""These are people that we know. These are people that we're related to,"" he says. ""It's either yourself, or your neighbor, or people that you work with.""

Hospitalizations and deaths from COVID-19 have been decreasing for a few weeks now in New York, and Lorenzoni is back on pediatrics. It's a welcome relief for now, but he says if there's another surge, he could be called back."
2,https://www.npr.org/sections/coronavirus-live-updates/2020/05/17/857612249/pharma-bro-martin-shkreli-denied-release-from-prison-to-research-coronavirus-cur,National Public Radio (NPR),2020-05-17,['Jason Slotkin'],'Pharma Bro' Martin Shkreli Denied Release From Prison To Research Coronavirus Cure,https://media.npr.org/assets/img/2020/05/17/ap_17181832761201_wide-e3c2452c89d5957baeccb226f24e08d1be928c39.jpg?s=1400,"'Pharma Bro' Martin Shkreli Denied Release From Prison To Research Coronavirus Cure

Enlarge this image toggle caption Greg Allen/Greg Allen/Invision/AP Greg Allen/Greg Allen/Invision/AP

A federal judge has denied a request from Martin Shkreli — the former pharmaceutical executive widely disdained as ""pharma bro"" — to be released from prison so he can work on a coronavirus treatment.

In her ruling Saturday, U.S. District Judge Kiyo Matsumoto sided with probation officials who described Shkreli's stated aim of developing a coronavirus cure as the type of ""delusional self-aggrandizing behavior"" that got him his sentence in the first place.

""The court does not find that releasing Mr. Shkreli will protect the public, even though Mr. Shkreli seeks to leverage his experience with pharmaceuticals to help develop a cure for COVID-19 that he would purportedly provide at no cost,"" Matsumoto wrote in the nine-page ruling.

The judge also ruled that Shkreli had failed to demonstrate adequate grounds for release based on compassionate reasons.

""Defendant is a healthy, 37 year old man with no recent history of preexisting medical conditions that place him at higher risk for COVID-19 and its potentially life-threatening adverse effects, and he is confined in a facility where there are currently no cases of COVID-19,"" Matsumoto concluded.

Shkreli entered the public eye in 2015 when, as the then-head of Turing Pharmaceuticals, he purchased the lifesaving HIV drug Daraprim and raised the price from $13.50 a pill to $750 — an increase of more than 5000%. The price-hike quickly cast Shkreli as a combination villain and punchline, the widely-recognized and disliked ""pharma bro.""

Two years later, Shkreli was found guilty of securities fraud stemming from his management of two hedge funds and a separate drug company.

In her ruling, Matsumoto cited the fraud conviction — and Shkreli's public behavior regarding the case — as one of several factors guiding her determination.

""With regard to the nature and circumstances of his offenses, defendant intentionally deceived and manipulated individual and public investors, and before sentencing, made disparaging remarks about the government and the sentencing process that showed little regard for the rule of law,"" the judge said.

Shkreli is currently serving a seven-year sentence."
3,https://www.npr.org/2020/05/17/856767177/coronavirus-may-mean-lights-out-for-summer-camps-this-year,National Public Radio (NPR),2020-05-17,['Tovia Smith'],Coronavirus May Mean Lights Out For Summer Camps This Year,https://media.npr.org/assets/img/2020/05/15/gettyimages-511095945_wide-3c47da3d9b7bb75824988b0dcbb1e62cec08a5d9.jpg?s=1400,"Coronavirus May Mean Lights Out For Summer Camps This Year

Enlarge this image toggle caption PeopleImages/E+/Getty Images PeopleImages/E+/Getty Images

Summer camps around the nation are grappling with whether or how they can open this summer, as the pandemic continues. The prospect is especially challenging for overnight camps, where hundreds of kids play, eat and sleep together, and the very idea of social distancing is completely anathema to the camp experience.

Little wonder a growing number of sleepaway camps have already capitulated to COVID-19.

""The cancellation of camp this summer is profoundly disappointing for all of us after what already feels like an eternity of frustration and uncertainty,"" wrote Shannon Donovan-Monti, executive director at Chimney Corners Camp in Western Massachusetts, in an email to parents this week. ""There are no words that can take away the heartbreak of depriving our children and ourselves of something that has given us such joy and connection to others.""

Eleven-year old Maddie Prince was among the many Chimney Corners campers who took it hard. ""It makes me sad that I can't be with my friends,"" she said.

Camp is where she ""grows up more,"" she said, and where she is happiest. ""You don't have any tech and it's really easy to forget all of your worries,"" she added.

National Will Summer Camps Open This Year? Will Summer Camps Open This Year? Listen · 4:52 4:52

""I would argue that kids need camp this summer more than ever before,"" said Dayna Hardin, president of CampGroup, which runs 15 camps from Maine to Michigan, including 13 overnight camps that are still hoping to open. She says the overnight experience might be just what the doctor ordered for kids who have been suffering through months of isolation and anxiety. And she argued that kids may actually be safer from infection at overnight camp than at home.

""We are looking at this like we are the castle,"" Hardin said. ""Our kids are going to enter the castle and we are going to pull up the drawbridge and we will be our own isolated community.""

But a strict ""no in, no out"" policy would certainly crimp camps' style. It would mean no field trips, no visiting days and no socials or sports tournaments with other camps. Staff would have to remain on campus for days off. And laundry and food deliveries would pose challenges.

Camp life inside the ""bubble,"" as some are calling it, would also change. Instead of playing tag, kids would have to fill their time with non-contact activities like making crafts.

""Camp is going to look very different,"" said Matt Fragala, managing principal consultant at Environmental Health & Engineering, the group hired by the American Camp Association (ACA) to recommend best practices and guidelines for camps. Specifics will depend on state and local mandates, but Fragala said recommendations will include constant disinfecting, spreading kids out for sleeping and eating at a distance and in shifts in the dining hall. The goal, Fragala said, is to ""control some of the mayhem the best way we can. It's going to be a change from business as usual at camp. But there's a balance we have to try to meet to keep everybody safe and to minimize potential risk.""

Camps are also expecting to have to split kids up into smaller units, said ACA president and CEO Tom Rosenberg. ""These would be like families where [kids] would be able to socialize somewhat normally,"" he said. ""But between the family circles, there will be physical distancing.""

The same rule would apply to wearing face masks, according to Rosenberg. Campers would wear them when outside their ""family"" group, he said, and staff who interact with more than one ""family"" group, like a food service worker or an archery instructor, would likely have to wear a mask all day.

Camps would be expected to regularly monitor campers and staff for symptoms of COVID-19, for example by taking temperatures every day. But whether camps would test for COVID-19 is an open question. Some camps see testing as a requirement; they won't even consider opening unless they could test kids before and during the session. But other camps say they would not test, relying on taking campers' temperatures daily and watching for other symptoms. That's an approach some parents find irresponsible.

""That keeps me up at night,"" said Fina Barouch, a Boston-area physician and parent of two campers. She said she will not allow her kids to go to camp.

""It only takes one person to be shedding virus when completely asymptomatic, and my concern is that this could turn into something like the nursing home pandemic, where it just spreads exponentially,"" Barouch said.

The CDC has issued its guidance for camps, recommending general precautions like social distancing, screening and extra disinfecting. The agency also directs camps to follow state and local laws, but in most cases camps are still waiting to hear what those will be, and they're growing increasingly frustrated that they don't have more information to help them make their decision.

A few state and local governments have already decided to ban sleepaway camps this summer, including Georgia and Minnesota, and Connecticut is expected to do so. Officials in Vermont have indicated they want to allow overnight camps to open, with extra precautions that are still being worked out. But the vast majority of jurisdictions are still wrestling with the issue.

Massachusetts Gov. Charlie Baker said the issue comes up every day in conversation with other states.

""The tough part,"" he said, ""is figuring out, especially when it comes to some of the stuff that involves the joys of being a kid, figuring out some way to do this, where you have at least enough rules to make sure it can be done safely, but you don't destroy the whole spontaneous nature of what those are supposed to be about.""

Indeed, one camp director said an overnight camp that cuts so many core traditions would be like Disney World without the Magic Kingdom or Mickey Mouse.

Camp consultant Lauren Kasnett Nearpass, co-founder of Summer 365, agrees that if the restrictions become so onerous that camp no longer feels like camp, it may no longer be worth it.

""If you have to remove the magic completely,"" she said, ""if it's going to look and feel so different, then perhaps you know, we just power forward to 2021.""

The prospect of a watered-down camp experience gives pause even to die-hard campers like 15-year-old twins Sasha and Amanda Fine, who were looking forward to the perks and privileges they would enjoy as members of the oldest bunk at their camp this summer.

""Trust me, I want camp more than anyone,"" said Sasha. ""It's just that we can't have camp like this. Like it's taunting us.""

A month ago, Amanda said, her friends were all in favor of going to camp this summer no matter what. But now, she said, rather than a heavily compromised and shortened 2020, most would rather wait and have a ""normal"" summer in 2021."
